Comment ID,Comment_VS,Title_VS,Comment,Title,Publish Date,Permalink
ffxq9dy,-0.8316,-0.34,I have the same attitude when people come to work sick.  I live in a very liberal state and people get tons of sick time.  Coworkers refuse to use it when they should so at the end of the year they can take a week off.,Quick rant about the tourists who spread the virus...,2020-01-29 10:56:16,/r/Coronavirus/comments/evr951/quick_rant_about_the_tourists_who_spread_the_virus/
ffxg2sk,0.7845,-0.34,Concentration camp? Don't be a nonsense.All I am asking is to be responsible and respect others health and safety when you know you are exposed to virus.,Quick rant about the tourists who spread the virus...,2020-01-29 10:56:16,/r/Coronavirus/comments/evr951/quick_rant_about_the_tourists_who_spread_the_virus/
ffxqdyy,0.6808,-0.34,"Camps, yes camps. this is a good idea.  round up all the Chinese and either put them in camps or ship them out.",Quick rant about the tourists who spread the virus...,2020-01-29 10:56:16,/r/Coronavirus/comments/evr951/quick_rant_about_the_tourists_who_spread_the_virus/
ffxqdib,0.5994,0.0,Honestly surprised there isn't a confirmed case in India already.,India on Coronavirus: Update,2020-01-29 11:23:22,/r/Coronavirus/comments/evrnme/india_on_coronavirus_update/
ffxps7m,-0.1027,0.0,"If the virus hits India, India will be in big trouble. Pray for the world.",India on Coronavirus: Update,2020-01-29 11:23:22,/r/Coronavirus/comments/evrnme/india_on_coronavirus_update/
ffxm761,0.0,0.0,[removed],India on Coronavirus: Update,2020-01-29 11:23:22,/r/Coronavirus/comments/evrnme/india_on_coronavirus_update/
ffxkesz,-0.1065,0.0,SpiceJet and Vistara should also cancel their flights to China..I'm pretty sure the virus has already entered India but at least by doing this..it won't spread like a wildfire,India on Coronavirus: Update,2020-01-29 11:23:22,/r/Coronavirus/comments/evrnme/india_on_coronavirus_update/
ffxqjaj,0.0,0.0772,RIP Africa,"Africa on alert after Kenya, Ethiopia report suspected coronavirus cases",2020-01-29 12:29:30,/r/Coronavirus/comments/evsp4l/africa_on_alert_after_kenya_ethiopia_report/
ffxvwlx,0.8565,0.0772,"Well wish me luck our continent isn't equipped with the right medical supplies to treat viruses, I just hope it doesn't reach South Africa because due to our high HIV/AIDS rate I'm scared the virus might mutate.","Africa on alert after Kenya, Ethiopia report suspected coronavirus cases",2020-01-29 12:29:30,/r/Coronavirus/comments/evsp4l/africa_on_alert_after_kenya_ethiopia_report/
ffxsk5v,-0.4939,0.0772,"F, I meant Ifor infected","Africa on alert after Kenya, Ethiopia report suspected coronavirus cases",2020-01-29 12:29:30,/r/Coronavirus/comments/evsp4l/africa_on_alert_after_kenya_ethiopia_report/
ffyq439,0.0,0.0772,there goes Africa...,"Africa on alert after Kenya, Ethiopia report suspected coronavirus cases",2020-01-29 12:29:30,/r/Coronavirus/comments/evsp4l/africa_on_alert_after_kenya_ethiopia_report/
ffy5fz0,-0.7264,0.0772,"Lack of sanitation, basic hygiene and HIV+ people is going to lead to Africa having a very bad time.","Africa on alert after Kenya, Ethiopia report suspected coronavirus cases",2020-01-29 12:29:30,/r/Coronavirus/comments/evsp4l/africa_on_alert_after_kenya_ethiopia_report/
ffydns6,0.7096,0.0772,Good luck. We'll all need it.,"Africa on alert after Kenya, Ethiopia report suspected coronavirus cases",2020-01-29 12:29:30,/r/Coronavirus/comments/evsp4l/africa_on_alert_after_kenya_ethiopia_report/
ffzzrp3,0.2074,0.0772,I really hope this fizzles out if it reaches you I worry about my family there what a beautiful fucking country how terribly run it is!,"Africa on alert after Kenya, Ethiopia report suspected coronavirus cases",2020-01-29 12:29:30,/r/Coronavirus/comments/evsp4l/africa_on_alert_after_kenya_ethiopia_report/
ffxquti,0.3612,-0.3818,"After China's next morning update, SARS will look like nothing.","Updated charts that compare 2019-nCoV, SARS, and the 2009 swine flu. Links to sources in the comments.",2020-01-29 12:37:30,/r/Coronavirus/comments/evstoj/updated_charts_that_compare_2019ncov_sars_and_the/
ffxr9eg,-0.7269,-0.3818,"Oof, even the fake numbers look awful.","Updated charts that compare 2019-nCoV, SARS, and the 2009 swine flu. Links to sources in the comments.",2020-01-29 12:37:30,/r/Coronavirus/comments/evstoj/updated_charts_that_compare_2019ncov_sars_and_the/
ffxvb78,0.7784,-0.3818,See it's posts like this that have me conflicted between trusting the people saying not to panic and panicking...Edited to add: I wonder what the Spanish flu curve looked like at this point if we had that data,"Updated charts that compare 2019-nCoV, SARS, and the 2009 swine flu. Links to sources in the comments.",2020-01-29 12:37:30,/r/Coronavirus/comments/evstoj/updated_charts_that_compare_2019ncov_sars_and_the/
ffxq7nt,-0.3818,-0.3818,SARS stats:[http://www.diaspoir.net/health/sars/Total.html](http://www.diaspoir.net/health/sars/Total.html)2009 Swine Flu stats:[https://en.wikipedia.org/wiki/2009\_flu\_pandemic\_table\_April\_2009](https://en.wikipedia.org/wiki/2009_flu_pandemic_table_April_2009)Current outbreak stats:\*https://\*[bnonews.com/index.php/2020/01/the-latest-coronavirus-cases/](https://bnonews.com/index.php/2020/01/the-latest-coronavirus-cases/),"Updated charts that compare 2019-nCoV, SARS, and the 2009 swine flu. Links to sources in the comments.",2020-01-29 12:37:30,/r/Coronavirus/comments/evstoj/updated_charts_that_compare_2019ncov_sars_and_the/
ffyj0qy,0.3612,-0.3818,Thank you for making these.  I search them out everyday.,"Updated charts that compare 2019-nCoV, SARS, and the 2009 swine flu. Links to sources in the comments.",2020-01-29 12:37:30,/r/Coronavirus/comments/evstoj/updated_charts_that_compare_2019ncov_sars_and_the/
ffz0jwe,0.3612,-0.3818,Can you keep the overall curve of sars like in previous graphs?,"Updated charts that compare 2019-nCoV, SARS, and the 2009 swine flu. Links to sources in the comments.",2020-01-29 12:37:30,/r/Coronavirus/comments/evstoj/updated_charts_that_compare_2019ncov_sars_and_the/
ffzd20g,0.474,-0.3818,Hey Op. Can you provide updates once in a while? I really like this comparison!,"Updated charts that compare 2019-nCoV, SARS, and the 2009 swine flu. Links to sources in the comments.",2020-01-29 12:37:30,/r/Coronavirus/comments/evstoj/updated_charts_that_compare_2019ncov_sars_and_the/
ffyt43w,-0.2212,-0.3818,"Ii's important to mention that 99% of confirmed cases are in China and 100% of death are in China. Most countries let a-symptomatic travelers from China to enter freely, so it's hard to say this is spreading.","Updated charts that compare 2019-nCoV, SARS, and the 2009 swine flu. Links to sources in the comments.",2020-01-29 12:37:30,/r/Coronavirus/comments/evstoj/updated_charts_that_compare_2019ncov_sars_and_the/
ffxt8ak,-0.2516,-0.3818,"The total number of people infected by SARS was 8,096, with a 14 days incubation period we cross that number many days ago, and we will see the number of people diagnosed with nCov cross the 8k the day after tomorrow.","Updated charts that compare 2019-nCoV, SARS, and the 2009 swine flu. Links to sources in the comments.",2020-01-29 12:37:30,/r/Coronavirus/comments/evstoj/updated_charts_that_compare_2019ncov_sars_and_the/
ffxw1jm,0.4019,-0.3818,I wish we did have that data.,"Updated charts that compare 2019-nCoV, SARS, and the 2009 swine flu. Links to sources in the comments.",2020-01-29 12:37:30,/r/Coronavirus/comments/evstoj/updated_charts_that_compare_2019ncov_sars_and_the/
ffyp225,-0.3818,-0.3818,Spanish flu might be slower since it has 3 pandemic waves.,"Updated charts that compare 2019-nCoV, SARS, and the 2009 swine flu. Links to sources in the comments.",2020-01-29 12:37:30,/r/Coronavirus/comments/evstoj/updated_charts_that_compare_2019ncov_sars_and_the/
ffxx1cx,0.852,-0.3818,"Where did you get the charts from in the images though? They look good. I mean, the data is kind of scary, but I've looking for live charts like this for a few days now. If you created them, it'll be good to see a longer period of time of days tracked. Maybe you could have 3-4 views - in addition to the view that you have, a 3 month view, and a 1 year view, so we can see where the current virus sits in comparison to the overall projections of the previous viruses.","Updated charts that compare 2019-nCoV, SARS, and the 2009 swine flu. Links to sources in the comments.",2020-01-29 12:37:30,/r/Coronavirus/comments/evstoj/updated_charts_that_compare_2019ncov_sars_and_the/
ffxxs2n,-0.3182,-0.3818,"I find it odd for the 29th, China has only reported two new deaths.","Updated charts that compare 2019-nCoV, SARS, and the 2009 swine flu. Links to sources in the comments.",2020-01-29 12:37:30,/r/Coronavirus/comments/evstoj/updated_charts_that_compare_2019ncov_sars_and_the/
ffxq81h,-0.6966,-0.3818,"**2009 flu pandemic table April 2009**This is a table containing the figures from the WHO Influenza A Situation Updates issued in April 2009 roughly once a day.  Where more than one update was issued in a day, the figures are from the last update that day.  The table can by sorted by country, date of first confirmed case or date of first confirmed case by continent.This presentation of the data in these and other tables shows the progression, peaks, and, eventually, decline of the epidemic in each country and continent.***^[ [^PM](https://www.reddit.com/message/compose?to=kittens_from_space) ^| [^Exclude ^me](https://reddit.com/message/compose?to=WikiTextBot&message=Excludeme&subject=Excludeme) ^| [^Exclude ^from ^subreddit](https://np.reddit.com/r/Coronavirus/about/banned) ^| [^FAQ ^/ ^Information](https://np.reddit.com/r/WikiTextBot/wiki/index) ^| [^Source](https://github.com/kittenswolf/WikiTextBot)   ^]^Downvote ^to ^remove ^| ^v0.28","Updated charts that compare 2019-nCoV, SARS, and the 2009 swine flu. Links to sources in the comments.",2020-01-29 12:37:30,/r/Coronavirus/comments/evstoj/updated_charts_that_compare_2019ncov_sars_and_the/
ffzgzon,0.0,-0.3818,https://www.reddit.com/r/China_Flu/comments/ew31dq/updated_charts_that_compare_2019ncov_sars_and_the/,"Updated charts that compare 2019-nCoV, SARS, and the 2009 swine flu. Links to sources in the comments.",2020-01-29 12:37:30,/r/Coronavirus/comments/evstoj/updated_charts_that_compare_2019ncov_sars_and_the/
ffzgtd1,0.0,-0.3818,https://www.reddit.com/r/China_Flu/comments/ew31dq/updated_charts_that_compare_2019ncov_sars_and_the/,"Updated charts that compare 2019-nCoV, SARS, and the 2009 swine flu. Links to sources in the comments.",2020-01-29 12:37:30,/r/Coronavirus/comments/evstoj/updated_charts_that_compare_2019ncov_sars_and_the/
ffzgspn,0.0,-0.3818,https://www.reddit.com/r/China_Flu/comments/ew31dq/updated_charts_that_compare_2019ncov_sars_and_the/,"Updated charts that compare 2019-nCoV, SARS, and the 2009 swine flu. Links to sources in the comments.",2020-01-29 12:37:30,/r/Coronavirus/comments/evstoj/updated_charts_that_compare_2019ncov_sars_and_the/
ffyculp,0.0,-0.3818,It's days being tracked.  It usually takes more than 1 patient for WHO to start watching.RTFC,"Updated charts that compare 2019-nCoV, SARS, and the 2009 swine flu. Links to sources in the comments.",2020-01-29 12:37:30,/r/Coronavirus/comments/evstoj/updated_charts_that_compare_2019ncov_sars_and_the/
ffyxhb3,-0.8853,-0.3818,"Masks alone are insufficient b/c it can infect through the eyes.According to Zerohedge (quoting the mayor of Wuhan) 5 million people left Wuhan prior to the quarantine.  Also, b/c it takes roughly 7-10 days for symptoms to appear you have asymptomatic people traveling around.  This is what happened in Chicago.  Chinese woman flew to Chicago for a biz meeting.  She didn't present any symptoms until the plane ride home.  One of the guys attending the meeting became sick a few days later.With an R0 btwn 2.5-3.5 (experts can't agree on a number) and the delay in presentation of symptoms we really don't know how many people are truly infected.  The Total confirmed will lag the truly infected number.","Updated charts that compare 2019-nCoV, SARS, and the 2009 swine flu. Links to sources in the comments.",2020-01-29 12:37:30,/r/Coronavirus/comments/evstoj/updated_charts_that_compare_2019ncov_sars_and_the/
ffxqmp9,-0.2716,-0.2481,Look at the facts and if it spreads without symptoms what do you think..  yes it is very bad if this is the case and they are not telling us because they may not know enough.,Why is everyone exaggerating on this sub?!,2020-01-29 12:38:03,/r/Coronavirus/comments/evstz4/why_is_everyone_exaggerating_on_this_sub/
ffxqrga,-0.9001,-0.2481,"Fear of the unknown.“It is far too simplistic to take the 130 deaths and the 6,000 cases and come up with a death rate of 2%,” he wrote. “We're in the middle of the outbreak and thousands of those patients are still being treated. We don't know if they will live or die, so they can't be used in these calculations. We also don't know how many mild and undetected cases are out there.” -bbc correspondent James Gallagher",Why is everyone exaggerating on this sub?!,2020-01-29 12:38:03,/r/Coronavirus/comments/evstz4/why_is_everyone_exaggerating_on_this_sub/
ffxr3wn,-0.4657,-0.2481,"CCP has been know to lie about many things SARS cases, GDP,... this creates an athmosphere of uncertainty. So if we can't trust their words we have to look at their actions. What do we see? Largest quarantine in human history, partial lockdown of Shanghai and pretty much comitting economic suicide. If you know anything about the CCP, they are ruthlessly capitalistic and don't give a shit about their own citizens. So what kind of virus would spur them to such dramatic actions? Yeah....Look I am surprised people are this calm, so many things don't line up there. And all we can do is speculate and prepare for the worst.",Why is everyone exaggerating on this sub?!,2020-01-29 12:38:03,/r/Coronavirus/comments/evstz4/why_is_everyone_exaggerating_on_this_sub/
ffxrw3g,0.0,-0.2481,"Because we have so little reliable information, and there's stuff coming through the grapevine about the CCP censoring the actual figures.",Why is everyone exaggerating on this sub?!,2020-01-29 12:38:03,/r/Coronavirus/comments/evstz4/why_is_everyone_exaggerating_on_this_sub/
ffxrbq8,-0.6249,-0.2481,I'm also sick of those posts. At this point even if someone actually had inside information no one would be able to sort it out from the complete and utter bullshit.&#x200B;At the same time I think some of the posts about how bad it COULD get are relevant because it could get pretty bad (or be fine for most of the world). Some of the confirmed numbers are too low & even China admitted that there were more cases than reported but testing wasn't keeping up.,Why is everyone exaggerating on this sub?!,2020-01-29 12:38:03,/r/Coronavirus/comments/evstz4/why_is_everyone_exaggerating_on_this_sub/
ffxre7m,-0.3818,-0.2481,"Just because you are incapable of deciphering the severity of this situation and completely relying on what the news SAYS about what they are reporting, rather than what is actually being reported.Read between the lines",Why is everyone exaggerating on this sub?!,2020-01-29 12:38:03,/r/Coronavirus/comments/evstz4/why_is_everyone_exaggerating_on_this_sub/
ffxrlag,-0.9869,-0.2481,"No one knows how serious this is and that makes a lot of people nervous. It’s also well known that things that could cause mass panic are hidden from the public especially since this could be devastating for the global economy. China is  known for censoring everything, why would this be any different? Brand new cases are popping up all over the world and most people who have the virus are still in the incubation period.  There’s no way to test every person who could possibly infecting, not are there enough tests but how can we know someone is infected if they show no symptoms? Millions of people are on lock down, planes are being suspended, people are being quarantined on islands, for a lot of people this isn’t normal and indicates it’s serious. Just a week ago there were under 600 cases and now there’s over 6,000, that’s a fast growth. With all that said I do think that people are panicking more than they should which proves the point of hiding the truth so a mass panic doesn’t happen.  Some people are freaking out over the virus and their country doesn’t even have a case yet, that gets annoying. Everyone should be aware that this is a serious situation, keep track of it, be aware of the difference between fake news and real news coming out, and take the usual precautions to not get sick.",Why is everyone exaggerating on this sub?!,2020-01-29 12:38:03,/r/Coronavirus/comments/evstz4/why_is_everyone_exaggerating_on_this_sub/
ffycwvu,-0.8466,-0.2481,"It wasn't my uncle. Someone's uncle maybe, ban me CCP/spezThe dean of the university's medical school, Gabriel Leung, said his team has estimated that as of Saturday, some 44,000 people in Wuhan alone were likely to have been infected by the new virus.  [https://news.rthk.hk/rthk/en/component/k2/1505090-20200127.htm?spTabChangeable=0](https://news.rthk.hk/rthk/en/component/k2/1505090-20200127.htm?spTabChangeable=0)",Why is everyone exaggerating on this sub?!,2020-01-29 12:38:03,/r/Coronavirus/comments/evstz4/why_is_everyone_exaggerating_on_this_sub/
ffxrgig,0.0,-0.2481,[removed],Why is everyone exaggerating on this sub?!,2020-01-29 12:38:03,/r/Coronavirus/comments/evstz4/why_is_everyone_exaggerating_on_this_sub/
ffxuvhl,-0.4019,-0.2481,Doom porn.,Why is everyone exaggerating on this sub?!,2020-01-29 12:38:03,/r/Coronavirus/comments/evstz4/why_is_everyone_exaggerating_on_this_sub/
ffxwk96,-0.7579,-0.2481,All of the fear mongers obviously failed biology in highschool.,Why is everyone exaggerating on this sub?!,2020-01-29 12:38:03,/r/Coronavirus/comments/evstz4/why_is_everyone_exaggerating_on_this_sub/
ffyb8vz,0.3612,-0.2481,Yea but the thing is how fast the number's growing. few days ago it was 10. now over 100. do u want to be next?,Why is everyone exaggerating on this sub?!,2020-01-29 12:38:03,/r/Coronavirus/comments/evstz4/why_is_everyone_exaggerating_on_this_sub/
ffyxxri,0.0,-0.2481,Because it's a shithole infested with brigading neo-nazis. Nazis gonna do nazi things.,Why is everyone exaggerating on this sub?!,2020-01-29 12:38:03,/r/Coronavirus/comments/evstz4/why_is_everyone_exaggerating_on_this_sub/
ffz6obr,-0.5096,-0.2481,"""3,6 Roentgen - not great, not terrible"".Does that sound familiar?",Why is everyone exaggerating on this sub?!,2020-01-29 12:38:03,/r/Coronavirus/comments/evstz4/why_is_everyone_exaggerating_on_this_sub/
ffzb9xk,-0.8805,-0.2481,Right?? Prob going to leave the sub for that reason.. There was some nice valid info at first but now .. conspiracy galore! Panic everywhere!,Why is everyone exaggerating on this sub?!,2020-01-29 12:38:03,/r/Coronavirus/comments/evstz4/why_is_everyone_exaggerating_on_this_sub/
ffxqn99,-0.3612,-0.2481,Because everyone wants to feel like they’re living in a movie.  Or just shit posters in general? Idk,Why is everyone exaggerating on this sub?!,2020-01-29 12:38:03,/r/Coronavirus/comments/evstz4/why_is_everyone_exaggerating_on_this_sub/
ffxr1ee,-0.4939,-0.2481,The facts can be scary..,Why is everyone exaggerating on this sub?!,2020-01-29 12:38:03,/r/Coronavirus/comments/evstz4/why_is_everyone_exaggerating_on_this_sub/
ffylmu2,0.8462,-0.2481,"I want that link. It's an obvious point that I keep see getting made but not yet in a major publication, and my friends and family keep repeating the 2% number.Edit: Thanks kkc, also found on the beeb just now:https://www.bbc.com/news/health-51048366",Why is everyone exaggerating on this sub?!,2020-01-29 12:38:03,/r/Coronavirus/comments/evstz4/why_is_everyone_exaggerating_on_this_sub/
ffxti7y,-0.1449,-0.2481,"I live in Shanghai and we are not under lockdown…yet…But…they highly suggest you to stay homeSince yesterday they started rationing the amount of face masks one individual can buy, they sell out pretty quick anywayMuseums, some parks and other places where people could gathered have been closedIntercity bus transport has been haltedCan still take trains and planes, they just check your tempAbout the planes only some not Chinese airlines stopped their service, do you know how much does it cost to fly empty planes everyday? of course the contagion factor is no second…""Experts"" says the next couple weeks will be crucial since everyone is supposed to go back to work.The only calm people are the one that still believe in the party lies, most of the rest are worried but they are aware that they can do nothing",Why is everyone exaggerating on this sub?!,2020-01-29 12:38:03,/r/Coronavirus/comments/evstz4/why_is_everyone_exaggerating_on_this_sub/
ffxv573,0.0,0.0,"Same here in the Nordics, it's not something the pharmacy has on stock. You can probably get half face mask from hardware store that catch 99,9% with replacable filters for 20euro if you really need one. Or a full face mask for about 100euro.",Masks sold out in germany.,2020-01-29 13:13:30,/r/Coronavirus/comments/evtebx/masks_sold_out_in_germany/
ffxv7s8,0.5106,0.0,You might want to check at a home improvement store and pick up a respirator with a n100 or n95 filter on it.,Masks sold out in germany.,2020-01-29 13:13:30,/r/Coronavirus/comments/evtebx/masks_sold_out_in_germany/
ffxugw9,0.0,0.0,They only last a day anyway.,Masks sold out in germany.,2020-01-29 13:13:30,/r/Coronavirus/comments/evtebx/masks_sold_out_in_germany/
ffxuyvp,0.0,0.0,Most of them were bought by asian tourists.,Masks sold out in germany.,2020-01-29 13:13:30,/r/Coronavirus/comments/evtebx/masks_sold_out_in_germany/
ffy128y,0.0,0.0,If it gets to the point of masks I just ain't leaving the house.  I got enough food for a few weeks and enough money to quit my job.,Masks sold out in germany.,2020-01-29 13:13:30,/r/Coronavirus/comments/evtebx/masks_sold_out_in_germany/
ffxuc51,0.4588,0.0,I tried to buy face masks before this whole outbreak. They where impossible to find in pharmacies then (in the uk) Are you sure they even stocked them before this whole thing? I had to order of amazon a year ago.,Masks sold out in germany.,2020-01-29 13:13:30,/r/Coronavirus/comments/evtebx/masks_sold_out_in_germany/
ffxv4w8,0.0,0.0,"Kauf lackiermasken, da gibt es genug noch, daran denkt keiner. Gibt 1000 hersteller Atemschutzmaske NASUM Schutz Halbmaske für Farbspritz, Staub, Chemikalien, Schutz Geruchsminderung für Sprüh-, Sanierungs-,Lackier- und Schleifarbeiten https://www.amazon.de/dp/B07RXTD8H8/ref=cm_sw_r_cp_apa_i_XEFmEbNVWYGC5",Masks sold out in germany.,2020-01-29 13:13:30,/r/Coronavirus/comments/evtebx/masks_sold_out_in_germany/
ffy4k8y,-0.5267,0.0,What's the point of buying it if not wearing? I see no one using a mask. Literally no one.,Masks sold out in germany.,2020-01-29 13:13:30,/r/Coronavirus/comments/evtebx/masks_sold_out_in_germany/
ffy1t6x,0.5859,0.0,Make sure to thank your politicians,Masks sold out in germany.,2020-01-29 13:13:30,/r/Coronavirus/comments/evtebx/masks_sold_out_in_germany/
ffy26gn,-0.1655,0.0,"Hoarding. In the US, the stores themselves are hoarding the stock. Next stage is price gouging.  Amazon has temporarily banned sale of N95 repirators in the US (since Jan 26). P100s are still available but would you dare step out in public now in those?",Masks sold out in germany.,2020-01-29 13:13:30,/r/Coronavirus/comments/evtebx/masks_sold_out_in_germany/
ffypnk4,0.4588,0.0,Try a home improvement store or hardware store. Check the paint Dept.,Masks sold out in germany.,2020-01-29 13:13:30,/r/Coronavirus/comments/evtebx/masks_sold_out_in_germany/
fg0ejyi,0.0,0.0,"its been days since masks in pharmacies have been sold out globally. Hardware store is the way to go, plus you don't have to keep throwing those away.",Masks sold out in germany.,2020-01-29 13:13:30,/r/Coronavirus/comments/evtebx/masks_sold_out_in_germany/
ffy4gg5,0.09,0.0,"They Re selling out on Amazon, but i got a 50 pack coming in a few days",Masks sold out in germany.,2020-01-29 13:13:30,/r/Coronavirus/comments/evtebx/masks_sold_out_in_germany/
ffy6ku0,0.504,0.0,What's the difference between N95 and ffp2/3 masks? Will ffp2 be good enough? I'm buying masks tomorrow and we don't have any n95,Masks sold out in germany.,2020-01-29 13:13:30,/r/Coronavirus/comments/evtebx/masks_sold_out_in_germany/
ffy8vcp,-0.3816,0.0,"Same in the Netherlands. I went looking for masks on Friday the 24th, went to 6(!) different stores, including the pharmacy at the hospital, and it was already sold out everywhere. The pharmacist looked slightly annoyed when I asked for it. I’ve only seen one student at Uni wear a mask so I wonder where they all went.",Masks sold out in germany.,2020-01-29 13:13:30,/r/Coronavirus/comments/evtebx/masks_sold_out_in_germany/
ffy9yzb,0.3382,0.0,Oh MY God! I went today to 5 pharmacies in germany (town) and they said they are sold out and dont have any idea when they will get new masks in stock,Masks sold out in germany.,2020-01-29 13:13:30,/r/Coronavirus/comments/evtebx/masks_sold_out_in_germany/
ffygmgh,-0.5859,0.0,Bullshit 13 eurohttps://www.amazon.de/Atemschutzmaske-NASUM-Chemikalien-Geruchsminderung-Schleifarbeiten,Masks sold out in germany.,2020-01-29 13:13:30,/r/Coronavirus/comments/evtebx/masks_sold_out_in_germany/
ffyma84,0.4404,0.0,"Make one, it’s better than nothing.",Masks sold out in germany.,2020-01-29 13:13:30,/r/Coronavirus/comments/evtebx/masks_sold_out_in_germany/
ffypkll,0.5719,0.0,"I'm just curious (not trying to be a dick) what's your definition of ""unreasonable"" price for a face mask of you believe that will keep you safe.  I never understood what that means. Can you elaborate what's your peoce equivalent for safety",Masks sold out in germany.,2020-01-29 13:13:30,/r/Coronavirus/comments/evtebx/masks_sold_out_in_germany/
