Comment ID,Comment_VS,Title_VS,Comment,Title,Publish Date,Permalink
ffwp7lt,0.0,0.0,Half face mask,Does anyone know what mask is this?,2020-01-29 06:17:38,/r/Coronavirus/comments/evng0x/does_anyone_know_what_mask_is_this/
ffyl50w,0.0,0.0,3M 3200  it's N95,Does anyone know what mask is this?,2020-01-29 06:17:38,/r/Coronavirus/comments/evng0x/does_anyone_know_what_mask_is_this/
ffwtgzr,-0.1689,0.0,"It's just a reusable respirator.For the average person this is more of a pain.  You would need to chemically disinfect every surface of the mask each time you used it.  You would also have to dispose of the filter properly. That said - they obviously work better than the cloth masks.Friend of mine has 20,000 of the N95 masks in his warehouse (paint supply business).  I think he told me yesterday his cost on them was  $0.40 CAD for the valveless and $0.95 CAD for the ones with a valve.  They are currently selling up up to $20/mask here.If you're looking for N95 masks I'd try the local paint stores (not the big box).  They are likely to have some in stock.",Does anyone know what mask is this?,2020-01-29 06:17:38,/r/Coronavirus/comments/evng0x/does_anyone_know_what_mask_is_this/
ffx9lfq,0.0,0.0,Causticc,Does anyone know what mask is this?,2020-01-29 06:17:38,/r/Coronavirus/comments/evng0x/does_anyone_know_what_mask_is_this/
ffwts8c,-0.4404,0.0,He throws chairs. :(,Does anyone know what mask is this?,2020-01-29 06:17:38,/r/Coronavirus/comments/evng0x/does_anyone_know_what_mask_is_this/
ffwzrfy,0.4404,0.0,"Goddamnit that was funny and exactly what I needed today. Take your silver, sir.",Does anyone know what mask is this?,2020-01-29 06:17:38,/r/Coronavirus/comments/evng0x/does_anyone_know_what_mask_is_this/
ffxxlz2,0.0,0.0,Bingo. They use filters which need to be changed,Does anyone know what mask is this?,2020-01-29 06:17:38,/r/Coronavirus/comments/evng0x/does_anyone_know_what_mask_is_this/
ffyoygx,0.5859,0.0,"Today I bought a 6200, seems pretty solid",Does anyone know what mask is this?,2020-01-29 06:17:38,/r/Coronavirus/comments/evng0x/does_anyone_know_what_mask_is_this/
ffwx9fy,0.3612,0.0,Or you could sterilize the filter with UVc light or heat and throw the mask in some sanitizer water for 20 minutes. I've been thinking on ways to disinfect the filters and mask myself.  The half masks actually fot where the paper ones you almost have to hold on your face for proper fit most times,Does anyone know what mask is this?,2020-01-29 06:17:38,/r/Coronavirus/comments/evng0x/does_anyone_know_what_mask_is_this/
ffxkje0,-0.3129,0.0,And my axe!!!,Does anyone know what mask is this?,2020-01-29 06:17:38,/r/Coronavirus/comments/evng0x/does_anyone_know_what_mask_is_this/
ffwwi18,0.0,0.0,But this time he throws corona,Does anyone know what mask is this?,2020-01-29 06:17:38,/r/Coronavirus/comments/evng0x/does_anyone_know_what_mask_is_this/
ffx4cd7,0.8402,0.0,Wow thanks :-),Does anyone know what mask is this?,2020-01-29 06:17:38,/r/Coronavirus/comments/evng0x/does_anyone_know_what_mask_is_this/
ffwx8qv,0.0,0.4215,right on.. they can fix it !!,Coronavirus hits the Middle East. First cases reported in the United Arab Emirates.,2020-01-29 06:23:04,/r/Coronavirus/comments/evnibl/coronavirus_hits_the_middle_east_first_cases/
ffx0lnl,-0.8555,0.4215,They need to isolate the country with no one going in or out. Sounds harsh but it’s not worth riskin the global world to be infected with the virus. Would’ve been a better concerntrated resource in one area/country than spreading it everywhere. Australia is already fked enough with the fire already and they did a damn well job with recreating the virus as a step to formulating a vaccine.,Coronavirus hits the Middle East. First cases reported in the United Arab Emirates.,2020-01-29 06:23:04,/r/Coronavirus/comments/evnibl/coronavirus_hits_the_middle_east_first_cases/
ffwri79,-0.8679,0.4215,Just reviewing your posts and I’m not surprised you would say something ignorant like that. Guessing sad middle aged white man with a low IQ. Stop trolling and get a life - people are suffering.,Coronavirus hits the Middle East. First cases reported in the United Arab Emirates.,2020-01-29 06:23:04,/r/Coronavirus/comments/evnibl/coronavirus_hits_the_middle_east_first_cases/
ffwsh2o,-0.5574,0.4215,This isn’t the place for your shitty American politics,Coronavirus hits the Middle East. First cases reported in the United Arab Emirates.,2020-01-29 06:23:04,/r/Coronavirus/comments/evnibl/coronavirus_hits_the_middle_east_first_cases/
ffwsw6b,-0.4019,0.0,The problem is they cant confirm without test kits.,20k confirmed cases within the next five days? What do you guys think?,2020-01-29 06:39:50,/r/Coronavirus/comments/evnpm7/20k_confirmed_cases_within_the_next_five_days/
ffwr22w,0.4588,0.0,Yes of course its going to explodeIf 1 person infects 2-3 the number is going to get bigger and bigger,20k confirmed cases within the next five days? What do you guys think?,2020-01-29 06:39:50,/r/Coronavirus/comments/evnpm7/20k_confirmed_cases_within_the_next_five_days/
ffwr7o2,0.0,0.0,You can probably expect 50 to 90k cases before this is over my dude.,20k confirmed cases within the next five days? What do you guys think?,2020-01-29 06:39:50,/r/Coronavirus/comments/evnpm7/20k_confirmed_cases_within_the_next_five_days/
ffwtkgd,0.0,0.0,"I heard it was 100,000 a week ago",20k confirmed cases within the next five days? What do you guys think?,2020-01-29 06:39:50,/r/Coronavirus/comments/evnpm7/20k_confirmed_cases_within_the_next_five_days/
ffwtq74,-0.4939,0.0,"I think there will be at least 20,000 confirmed cases by Feb 2nd.[The Head of Epidemiology at Yale School of Public Health](https://www.youtube.com/watch?v=mHwS4FJt5eg&feature=emb_title) said some of the models show that as of Jan 28, 100,000 people have been infected. Symptoms to show in a week to two weeks.",20k confirmed cases within the next five days? What do you guys think?,2020-01-29 06:39:50,/r/Coronavirus/comments/evnpm7/20k_confirmed_cases_within_the_next_five_days/
ffwrgs4,0.0,0.0,I reckon 3 days,20k confirmed cases within the next five days? What do you guys think?,2020-01-29 06:39:50,/r/Coronavirus/comments/evnpm7/20k_confirmed_cases_within_the_next_five_days/
ffwu0jh,-0.4939,0.0,Remember the first confirmed case infected 14 docotrs,20k confirmed cases within the next five days? What do you guys think?,2020-01-29 06:39:50,/r/Coronavirus/comments/evnpm7/20k_confirmed_cases_within_the_next_five_days/
ffwtta2,0.7195,0.0,"Maybe, but this number is irrelevant. Since this virus is new and the production of test kits too slow, the number of actual cases will dwarf it by several orders of magnitude by that point. You might as well say it's 5 cases because the confirmed cases will give more information on how behind and incompetent the CCP is rather then giving you a clear picture.",20k confirmed cases within the next five days? What do you guys think?,2020-01-29 06:39:50,/r/Coronavirus/comments/evnpm7/20k_confirmed_cases_within_the_next_five_days/
ffwykgu,0.0,0.0,Look it up,20k confirmed cases within the next five days? What do you guys think?,2020-01-29 06:39:50,/r/Coronavirus/comments/evnpm7/20k_confirmed_cases_within_the_next_five_days/
ffx0pb7,0.2479,0.0,"70,000 to 100,000 cases right now likely, so yes, in China's rigged distribution of the status we'll see that by end of week.",20k confirmed cases within the next five days? What do you guys think?,2020-01-29 06:39:50,/r/Coronavirus/comments/evnpm7/20k_confirmed_cases_within_the_next_five_days/
ffyb1t9,0.6705,0.0,What do you think of fitting it to a logistic growth function. I think it should yield better results - what we are really trying to predict is the inflection point and the upper limit.,20k confirmed cases within the next five days? What do you guys think?,2020-01-29 06:39:50,/r/Coronavirus/comments/evnpm7/20k_confirmed_cases_within_the_next_five_days/
ffxri6f,0.0,0.0,"It’s not the production of test kits, but rather the long duration and strict environment needed for the test kits.  They can only go through about 2000 / day in Wuhan few days ago.  But news said they are catching up",20k confirmed cases within the next five days? What do you guys think?,2020-01-29 06:39:50,/r/Coronavirus/comments/evnpm7/20k_confirmed_cases_within_the_next_five_days/
ffwvgul,0.0,0.0,Which they are practically out of in china.,20k confirmed cases within the next five days? What do you guys think?,2020-01-29 06:39:50,/r/Coronavirus/comments/evnpm7/20k_confirmed_cases_within_the_next_five_days/
ffy28qs,-0.6705,0.0,"That’s just US media man, China’s leaked media before the mods deleted them were saying 1 person infected 14 staff members.",20k confirmed cases within the next five days? What do you guys think?,2020-01-29 06:39:50,/r/Coronavirus/comments/evnpm7/20k_confirmed_cases_within_the_next_five_days/
ffwrj80,0.0,0.0,"If this continues the same rate, it will be one million in 1 month, because it is exponential.",20k confirmed cases within the next five days? What do you guys think?,2020-01-29 06:39:50,/r/Coronavirus/comments/evnpm7/20k_confirmed_cases_within_the_next_five_days/
ffwrkrj,0.0,0.0,Hmmmm why would it be over after 50k to 90k?,20k confirmed cases within the next five days? What do you guys think?,2020-01-29 06:39:50,/r/Coronavirus/comments/evnpm7/20k_confirmed_cases_within_the_next_five_days/
ffxswhq,0.2263,0.0,No that is a later case. That was the super spreader around December 9. The first case was a stall vendor in the seafood market around December 1.,20k confirmed cases within the next five days? What do you guys think?,2020-01-29 06:39:50,/r/Coronavirus/comments/evnpm7/20k_confirmed_cases_within_the_next_five_days/
ffxrula,-0.5609,0.0,"Not true. There is one case infected 14 doctors, but not the first confirmed case.  The patient went through a neurosurgical operation without knowing he’s infected with the virus, all 14 personal (doctors and nurses) were infected as result the surgery",20k confirmed cases within the next five days? What do you guys think?,2020-01-29 06:39:50,/r/Coronavirus/comments/evnpm7/20k_confirmed_cases_within_the_next_five_days/
ffx5v06,0.0,0.0,If it's in Finland of all places then it's all over Europe.,Finland’s first corona virus case confirmed. - 32 year old Chinese tourist from Wuhan.,2020-01-29 07:35:37,/r/Coronavirus/comments/evof8t/finlands_first_corona_virus_case_confirmed_32/
ffwxj7c,-0.5423,0.0,"Fuck me, Scandinavia next?",Finland’s first corona virus case confirmed. - 32 year old Chinese tourist from Wuhan.,2020-01-29 07:35:37,/r/Coronavirus/comments/evof8t/finlands_first_corona_virus_case_confirmed_32/
ffxe76s,0.4501,0.0,Why in the name of god are Wuhan tourists not quarantined ffs???I am in no way a medical doctor or something like that but if the some can Cary it up to 14 days without a symptom and spread it?! Why not quarantine???,Finland’s first corona virus case confirmed. - 32 year old Chinese tourist from Wuhan.,2020-01-29 07:35:37,/r/Coronavirus/comments/evof8t/finlands_first_corona_virus_case_confirmed_32/
ffwxr12,-0.0772,0.0,The story is still developing and the article is being updated frequently. At least 15 people exposed. Traveller had left Wuhan 5 days ago and had respiratory symptoms for 2 days.,Finland’s first corona virus case confirmed. - 32 year old Chinese tourist from Wuhan.,2020-01-29 07:35:37,/r/Coronavirus/comments/evof8t/finlands_first_corona_virus_case_confirmed_32/
ffwws7y,0.4215,0.0,Nice job reporting,Finland’s first corona virus case confirmed. - 32 year old Chinese tourist from Wuhan.,2020-01-29 07:35:37,/r/Coronavirus/comments/evof8t/finlands_first_corona_virus_case_confirmed_32/
ffxd882,0.7003,0.0,Ei sitte tavata torilla tällä kertaa perkele. Hope santa is safe.,Finland’s first corona virus case confirmed. - 32 year old Chinese tourist from Wuhan.,2020-01-29 07:35:37,/r/Coronavirus/comments/evof8t/finlands_first_corona_virus_case_confirmed_32/
ffwxr5t,0.34,0.0,Luckily there are mostly reindeers in Ivalo. Unless they stopped @ helsinki on the way.,Finland’s first corona virus case confirmed. - 32 year old Chinese tourist from Wuhan.,2020-01-29 07:35:37,/r/Coronavirus/comments/evof8t/finlands_first_corona_virus_case_confirmed_32/
ffx3xdk,0.4885,0.0,Alright!!! Way to cross the Finniah line! And in record time too!,Finland’s first corona virus case confirmed. - 32 year old Chinese tourist from Wuhan.,2020-01-29 07:35:37,/r/Coronavirus/comments/evof8t/finlands_first_corona_virus_case_confirmed_32/
ffxmyw1,-0.6486,0.0,"The Chinese are spreading it all over the world, they are scared of the virus and travel to be safe. But forgot they are infected...",Finland’s first corona virus case confirmed. - 32 year old Chinese tourist from Wuhan.,2020-01-29 07:35:37,/r/Coronavirus/comments/evof8t/finlands_first_corona_virus_case_confirmed_32/
ffxowr5,-0.7579,0.0,China is lying. The corona virus is worse than what they say.,Finland’s first corona virus case confirmed. - 32 year old Chinese tourist from Wuhan.,2020-01-29 07:35:37,/r/Coronavirus/comments/evof8t/finlands_first_corona_virus_case_confirmed_32/
ffxekhj,-0.8971,0.0,"Why they go out and expose other innocent people with this deadly virus when they are very well aware that they have been already exposed and hence are potentially hosts of the virus?It seems they just don't care whether others could suffer or even die because of them. It seems more important for them is enjoying tour regardless how much harm they could make to others from the virus they carry. They just seem not to want to lose their money by canceling flights and reservations and NOT interested in protecting other innocent people from their disease, who would have never been exposed if they were reasonable and responsible.I find it extremely selfies and irresponsible",Finland’s first corona virus case confirmed. - 32 year old Chinese tourist from Wuhan.,2020-01-29 07:35:37,/r/Coronavirus/comments/evof8t/finlands_first_corona_virus_case_confirmed_32/
ffxanvw,0.0,0.0,[deleted],Finland’s first corona virus case confirmed. - 32 year old Chinese tourist from Wuhan.,2020-01-29 07:35:37,/r/Coronavirus/comments/evof8t/finlands_first_corona_virus_case_confirmed_32/
ffwynav,0.9005,0.0,"This is the best tl;dr I could make, [original](https://yle.fi/uutiset/osasto/news/finlands_first_coronavirus_case_confirmed_in_lapland/11182855) reduced by 76%. (I'm a bot)*****> A Chinese tourist who was admitted to hospital for tests after showing symptoms was confirmed to have the deadly new strain of coronavirus that has so far killed more than a hundred people in China.> Tests conducted in Helsinki confirmed the infection.> Health officials from the Lapland hospital district as well as local health officials will continue to manage the situation in collaboration with the THL. &quot;Finland is prepared for possible cases. The health care system and laboratories have operating systems in place. Hospitals are also prepared to investigate and care for coronavirus infections in isolation wards,&quot; Salminen added.*****[**Extended Summary**](http://np.reddit.com/r/autotldr/comments/evotvu/finlands_first_coronavirus_case_confirmed_in/) | [FAQ](http://np.reddit.com/r/autotldr/comments/31b9fm/faq_autotldr_bot/ ""Version 2.02, ~463244 tl;drs so far."") | [Feedback](http://np.reddit.com/message/compose?to=%23autotldr ""PM's and comments are monitored, constructive feedback is welcome."") | *Top* *keywords*: **health**^#1 **infection**^#2 **hospital**^#3 **symptoms**^#4 **THL**^#5",Finland’s first corona virus case confirmed. - 32 year old Chinese tourist from Wuhan.,2020-01-29 07:35:37,/r/Coronavirus/comments/evof8t/finlands_first_corona_virus_case_confirmed_32/
ffxm97e,0.0,0.0,"If you think it won’t be in your country/ state by Valentine’s Day, I have a bridge to sell you.",Finland’s first corona virus case confirmed. - 32 year old Chinese tourist from Wuhan.,2020-01-29 07:35:37,/r/Coronavirus/comments/evof8t/finlands_first_corona_virus_case_confirmed_32/
ffx50ws,0.0,0.0,Too many chinese tourists...,Finland’s first corona virus case confirmed. - 32 year old Chinese tourist from Wuhan.,2020-01-29 07:35:37,/r/Coronavirus/comments/evof8t/finlands_first_corona_virus_case_confirmed_32/
ffx84ke,-0.6808,0.0,You do know the virus can be killed by heat im in my sauna chilling,Finland’s first corona virus case confirmed. - 32 year old Chinese tourist from Wuhan.,2020-01-29 07:35:37,/r/Coronavirus/comments/evof8t/finlands_first_corona_virus_case_confirmed_32/
ffxqwzt,0.0,0.0,Have we got a date of their travel?,Finland’s first corona virus case confirmed. - 32 year old Chinese tourist from Wuhan.,2020-01-29 07:35:37,/r/Coronavirus/comments/evof8t/finlands_first_corona_virus_case_confirmed_32/
ffxodbq,0.2263,0.0,I swear to god they are just doing it on purpose at this point,Finland’s first corona virus case confirmed. - 32 year old Chinese tourist from Wuhan.,2020-01-29 07:35:37,/r/Coronavirus/comments/evof8t/finlands_first_corona_virus_case_confirmed_32/
ffxttpc,0.0,0.0,But Finland isn’t even real!,Finland’s first corona virus case confirmed. - 32 year old Chinese tourist from Wuhan.,2020-01-29 07:35:37,/r/Coronavirus/comments/evof8t/finlands_first_corona_virus_case_confirmed_32/
ffxv4f7,0.2023,0.0,"“Funny” how a couple of days it was supposed to be very unlikely that it would be corona infection, they said in the local news the chances would be a one out of tens of thousands or even millions.",Finland’s first corona virus case confirmed. - 32 year old Chinese tourist from Wuhan.,2020-01-29 07:35:37,/r/Coronavirus/comments/evof8t/finlands_first_corona_virus_case_confirmed_32/
ffwx5eb,-0.1969,0.0,"Censorship and supressing information are their number one priority right now, so it doesnt surprise me.",Just something small I noticed,2020-01-29 07:38:18,/r/Coronavirus/comments/evogle/just_something_small_i_noticed/
ffwwbph,0.0,0.0,Theyve been down for days. I noticed the same. Remaining cameras are 'wildlife views'.,Just something small I noticed,2020-01-29 07:38:18,/r/Coronavirus/comments/evogle/just_something_small_i_noticed/
ffx22p6,0.0,0.0,Probably shut off the entire internet in the area,Just something small I noticed,2020-01-29 07:38:18,/r/Coronavirus/comments/evogle/just_something_small_i_noticed/
ffxmskz,-0.3612,0.0,Interesting how information can be dangerous to an autocratic state. [And cut the phone lines. Contain the spread of misinformation.”](https://youtu.be/1cG3PlcSiLA),Just something small I noticed,2020-01-29 07:38:18,/r/Coronavirus/comments/evogle/just_something_small_i_noticed/
ffwxf64,-0.069,0.0,Hmm. I would expect that all do be done by automated systems at this point as far as recording and broadcasting... and that it definitely have to be conscious choice to turn it off. Definitely doesnt help ease anyone's minds skeptical of the official story.,Just something small I noticed,2020-01-29 07:38:18,/r/Coronavirus/comments/evogle/just_something_small_i_noticed/
ffx0jgv,0.0,0.0,[removed],Just something small I noticed,2020-01-29 07:38:18,/r/Coronavirus/comments/evogle/just_something_small_i_noticed/
ffy3mgf,0.2415,0.0,Dude just go to the snap map and look at the public stories.A lot of non Chinese People are giving daily updates. Well they are not really updates because it are just some normal stories.You can literally see a black dude dancing and singing in one story. (if it is still up this was 2 days ago)And there is absolutely nothing interesting to see in those stories. (they are watching netflix etc),Just something small I noticed,2020-01-29 07:38:18,/r/Coronavirus/comments/evogle/just_something_small_i_noticed/
ffx1gj7,0.0,0.0,What,Just something small I noticed,2020-01-29 07:38:18,/r/Coronavirus/comments/evogle/just_something_small_i_noticed/
ffyk9ny,0.6124,0.0,Wuhan has like 11 million people right? I just took a look and saw like 3 different peoples stories and that’s it....for 11 million people,Just something small I noticed,2020-01-29 07:38:18,/r/Coronavirus/comments/evogle/just_something_small_i_noticed/
ffx85r5,0.0,0.0,r/Whooosh,Just something small I noticed,2020-01-29 07:38:18,/r/Coronavirus/comments/evogle/just_something_small_i_noticed/
ffyop99,-0.2732,0.0,Yup snapchat is blocked in china. (same as facebook etc)Thats why you only see stories from non chinese people which are using vpn's.,Just something small I noticed,2020-01-29 07:38:18,/r/Coronavirus/comments/evogle/just_something_small_i_noticed/
ffx61u3,-0.9841,-0.4939,"I'm a Chinese person myself, most Chinese people are not like this at all. Only a small amount of Chinese people eat different kinds of animals, we do not eat whatever wild animal it finds around. I am not for the Chinese regime, as a child to my parents who migrated from China to Europe years ago because of the regime I find it very hard to not be upset at these kinds of posts. All my life i've been visiting family in China, living there for periods of time and I can confirm that most Chinese people are very polite, hygienic and do most definitely not eat wild animals that they can find. ''We cannot rely on a country that eats whatever wild animal it finds around'' is such a disturbing statement, you group and entire population of people who cannot do anything about the Chinese regime as disgusting people. Again i'm not saying I don't agree with all the other things you've said in your post, but please do understand that it's upsetting to see people that you love and care for be treated so harshly based on stereotype. I live in the Netherlands right now, i've been treated as if i'm disgusting before because they think I eat wild animals.  The feeling sucks, it's hurtful and upsetting. I'm sorry if my english is not that good in my text, it's not my native language.Edit:What i'm trying to say that putting a population of more than 1 bil people inside a group that eats unsanitary weird animals etc is wrong. It affects many asian people on a daily basis (not only Chinese people, Koreans, Japanese, Vietnamese etc are often also affected by these stereotypes), asians are often talked to as if they are disgusting or weird because of  food stereotypes many people think about us.","China will continue to be a hotbed for new illnesses, shut itself down, and destabilize the global economy.",2020-01-29 07:42:38,/r/Coronavirus/comments/evoioe/china_will_continue_to_be_a_hotbed_for_new/
ffxetke,-0.7832,-0.4939,"Why does this post have so many upvotes? Overpopulation and growing urban areas is a global problem - not just in China. The Chinese are people trying to get by in this thing called life, just like everyone else in the world. I don’t think we should be putting so much blame on the Chinese themselves. Perhaps their government is at fault but it is very rude for you to say “We cannot rely on a country that eats whatever wild animal it finds around.” Way to completely generalize an entire population of people.","China will continue to be a hotbed for new illnesses, shut itself down, and destabilize the global economy.",2020-01-29 07:42:38,/r/Coronavirus/comments/evoioe/china_will_continue_to_be_a_hotbed_for_new/
ffwxuk5,-0.6182,-0.4939,"It's the CCP who are the culprits not the chinese people. The chinese people are the biggest victims here, even after the outbreak they have to deal with an oppresive regime they can't do anything against. The modernization of China happened at a rapid pace in comparison to other countries and a lot of the older generation still have the cultural revolution in their mindsets. Don't be selfish and think this only affects the west, as much as I am worried about the epidemic, they have it much worse.","China will continue to be a hotbed for new illnesses, shut itself down, and destabilize the global economy.",2020-01-29 07:42:38,/r/Coronavirus/comments/evoioe/china_will_continue_to_be_a_hotbed_for_new/
ffwww1w,0.0258,-0.4939,"As of now, the market means nothing to anyone. This is an epidemic that is starting and shot is going to hit the fan.Stocks won’t matter for a long time","China will continue to be a hotbed for new illnesses, shut itself down, and destabilize the global economy.",2020-01-29 07:42:38,/r/Coronavirus/comments/evoioe/china_will_continue_to_be_a_hotbed_for_new/
ffxtduz,-0.6249,-0.4939,"How about they just ban the eating and sale of bats first? First SARS, then MERS, now this. That’s strike 1, 2, and 3. Take action.","China will continue to be a hotbed for new illnesses, shut itself down, and destabilize the global economy.",2020-01-29 07:42:38,/r/Coronavirus/comments/evoioe/china_will_continue_to_be_a_hotbed_for_new/
