Comment ID,Comment_VS,Title_VS,Comment,Title,Publish Date,Permalink
ffyqjh8,0.6083,0.1531,"Yup. I’m told not to panic too much because there hasn’t been a case here in The Netherlands yet. While that is true, I have no doubt that this will become a pandemic at one point. Incubation time still allows cases to pop up here. There are a lot of Chinese who went abroad for new year and came back here. Meanwhile, I’m the only one who has a bunch of FFP3 face masks, and I’m buying a shitload of nitrile gloves tomorrow when they’re on sale at Lidl (or Aldi?). I’m also filling up my pantry with canned food, get more face masks, get a large plastic tub, a sprayer, a few bottles od bleach and whatever else might be good to have in the event that it comes here. I don’t want it to come here. But when it does, I want to be able to lock myself in for as long as possible. And I get that this all may sound alarmist, but I’m not playing with my life.",Is anyone else finding it increasingly hard to convince family of the potential magnitude of all this ?,2020-01-29 17:08:06,/r/Coronavirus/comments/evwwa4/is_anyone_else_finding_it_increasingly_hard_to/
ffyp9sf,0.7402,0.1531,Sadly- most of my friends and family seem to trust msm says at face value. There is obviously a massive coverup of cases in the west.,Is anyone else finding it increasingly hard to convince family of the potential magnitude of all this ?,2020-01-29 17:08:06,/r/Coronavirus/comments/evwwa4/is_anyone_else_finding_it_increasingly_hard_to/
ffypti8,0.25,0.1531,Yes. I told my dad to go to a work store to get more N95 masks and he wasn’t taking me seriously saying they’ll restock them at the drugstore. I’m just gonna go buy a lot myself tomorrow.,Is anyone else finding it increasingly hard to convince family of the potential magnitude of all this ?,2020-01-29 17:08:06,/r/Coronavirus/comments/evwwa4/is_anyone_else_finding_it_increasingly_hard_to/
ffyolb9,-0.7184,-0.4767,Aside mostly:  You can be healthy and asymptomatic with the flu and still infect the vulnerable as a transmitter.  That’s one of the lesser but important reasons to get a flu shot.  More to the point the “stealth carrier” thing is not unique to Kung Flu.,"Children With ""Stealth"" Coronavirus Infections Raise Fears Of 'Community Outbreaks'",2020-01-29 17:26:19,/r/Coronavirus/comments/evx697/children_with_stealth_coronavirus_infections/
ffyvczi,0.0,-0.4767,Everyone should be aware that [ZeroHedge is not a reliable source.](https://mediabiasfactcheck.com/zero-hedge/),"Children With ""Stealth"" Coronavirus Infections Raise Fears Of 'Community Outbreaks'",2020-01-29 17:26:19,/r/Coronavirus/comments/evx697/children_with_stealth_coronavirus_infections/
ffz2pqy,-0.6436,-0.4767,"This is [almost certainly engineered in a lab](https://mobile.twitter.com/GuoLibrary/status/1221580367062237185). I think if you actually research the virus, the timeline, location (only BSL-4 lab in China), it starts to become apparent.The “what” is no longer a mystery but the “why” and “how” still might be. I think it’s very obvious that China did not expect this to get out in their own backyard and are desperately trying to contain it, even if poorly.Would it surprise anyone that superpowers are researching and concocting bioweapons? And would it surprise anyone that China would have a leak or mishap involving one? Forgetting SARS so quickly?So how would a country engineer one? Perhaps “humanely” as not target women and children. Ironic indeed to create a cruel plague with a sliver of mercy.","Children With ""Stealth"" Coronavirus Infections Raise Fears Of 'Community Outbreaks'",2020-01-29 17:26:19,/r/Coronavirus/comments/evx697/children_with_stealth_coronavirus_infections/
ffz7lvf,-0.9896,-0.4767,"If it is a bio weapon, it is not a very good one. What would you really use it for?  It kills way too slow and not nearly enough to be useful in a war. Your normal everyday Anthrax already has a lethality of 90% untreated. Even with world class treatment it is still at 45%. Compared to that, you drop a corona bomb and the enemy keeps fighting for 14 days like nothing happened AND you give them an excuse to pull out anything they have in stock? Rubbish.  If you are crossing that line, just drop nerve agent. The entire enemy entrenchment would be dead in 5 minutes flat and there is no chance of it spreading back to your country. Since using it is political suicide, the only real use is a deterrent. Deterrents only work if people know you have the weapon. And as far as deterrents go, you can't really beat nuclear weapons anyway.","Children With ""Stealth"" Coronavirus Infections Raise Fears Of 'Community Outbreaks'",2020-01-29 17:26:19,/r/Coronavirus/comments/evx697/children_with_stealth_coronavirus_infections/
ffz9jx7,0.25,-0.4767,"I feel like it's more to crowd control china. The riots recently and big population, leaving mainly kids and women it would be a lot easier to control the masses.","Children With ""Stealth"" Coronavirus Infections Raise Fears Of 'Community Outbreaks'",2020-01-29 17:26:19,/r/Coronavirus/comments/evx697/children_with_stealth_coronavirus_infections/
ffzbvle,-0.7184,-0.4767,Yes of course. After you infected and killed all your male soldiers. Which is 95% of the Chinese military.,"Children With ""Stealth"" Coronavirus Infections Raise Fears Of 'Community Outbreaks'",2020-01-29 17:26:19,/r/Coronavirus/comments/evx697/children_with_stealth_coronavirus_infections/
ffykit5,0.8221,-0.8658,"Twitter is generally an unreliable source. If possible, please re-submit with a link to a reliable source or the direct article.Note that you may also resubmit as a text post, just add a link and some explanatory text. Thank you for helping us keep information in /r/Conoravirus reliable!*I am a bot, and this action was performed automatically. Please [contact the moderators of this subreddit](/message/compose/?to=/r/Coronavirus) if you have any questions or concerns.*","BREAKING: Update on #CoronaVirus - 7,811 infected. - 12,167 suspected cases. - 170 dead. - 1370 in serious condition.",2020-01-29 17:43:30,/r/Coronavirus/comments/evxfs0/breaking_update_on_coronavirus_7811_infected/
ffyksu7,0.0,-0.8658,NBC reporting same numbers. https://www.nbcnews.com/news/us-news/plane-carrying-americans-coronavirus-hit-china-lands-alaska-n1125306,"BREAKING: Update on #CoronaVirus - 7,811 infected. - 12,167 suspected cases. - 170 dead. - 1370 in serious condition.",2020-01-29 17:43:30,/r/Coronavirus/comments/evxfs0/breaking_update_on_coronavirus_7811_infected/
ffz1cmm,-0.34,-0.8658,"Yesterday was 6,000 😦","BREAKING: Update on #CoronaVirus - 7,811 infected. - 12,167 suspected cases. - 170 dead. - 1370 in serious condition.",2020-01-29 17:43:30,/r/Coronavirus/comments/evxfs0/breaking_update_on_coronavirus_7811_infected/
ffyum18,0.0,-0.8658,Would it be unreasonable to multiply these figures by 10?,"BREAKING: Update on #CoronaVirus - 7,811 infected. - 12,167 suspected cases. - 170 dead. - 1370 in serious condition.",2020-01-29 17:43:30,/r/Coronavirus/comments/evxfs0/breaking_update_on_coronavirus_7811_infected/
ffyngr7,0.4019,-0.8658,"Road to #100k continues, will be an interesting watch xdMaybe we will hit 1 million?","BREAKING: Update on #CoronaVirus - 7,811 infected. - 12,167 suspected cases. - 170 dead. - 1370 in serious condition.",2020-01-29 17:43:30,/r/Coronavirus/comments/evxfs0/breaking_update_on_coronavirus_7811_infected/
ffyueot,-0.4404,-0.8658,1370 serious.... this site lists 310 critical:https://bnonews.com/index.php/2020/01/the-latest-coronavirus-cases/....difference between serious and critical?,"BREAKING: Update on #CoronaVirus - 7,811 infected. - 12,167 suspected cases. - 170 dead. - 1370 in serious condition.",2020-01-29 17:43:30,/r/Coronavirus/comments/evxfs0/breaking_update_on_coronavirus_7811_infected/
ffzhq8q,0.431,-0.8658,It's not that bad..,"BREAKING: Update on #CoronaVirus - 7,811 infected. - 12,167 suspected cases. - 170 dead. - 1370 in serious condition.",2020-01-29 17:43:30,/r/Coronavirus/comments/evxfs0/breaking_update_on_coronavirus_7811_infected/
ffz4y14,0.0,-0.8658,What is going on in the city of Wenzhou??It's the city with more cases outside of Hubei (162) and they had 112 new cases in just 2 days. A new outbreak?,"BREAKING: Update on #CoronaVirus - 7,811 infected. - 12,167 suspected cases. - 170 dead. - 1370 in serious condition.",2020-01-29 17:43:30,/r/Coronavirus/comments/evxfs0/breaking_update_on_coronavirus_7811_infected/
ffzjbv5,-0.05,-0.8658,"""it's just a normal flu guys don't worry""","BREAKING: Update on #CoronaVirus - 7,811 infected. - 12,167 suspected cases. - 170 dead. - 1370 in serious condition.",2020-01-29 17:43:30,/r/Coronavirus/comments/evxfs0/breaking_update_on_coronavirus_7811_infected/
fg07ldv,0.0,-0.8658,And 141 people are recovered.,"BREAKING: Update on #CoronaVirus - 7,811 infected. - 12,167 suspected cases. - 170 dead. - 1370 in serious condition.",2020-01-29 17:43:30,/r/Coronavirus/comments/evxfs0/breaking_update_on_coronavirus_7811_infected/
ffzor6o,-0.6249,-0.8658,"It’s more than that, there’s at least 48,000 hospital beds in wuhan alone they wouldn’t need to do anywhere near the response they’ve done for this unless it was something far worse than they’re admitting","BREAKING: Update on #CoronaVirus - 7,811 infected. - 12,167 suspected cases. - 170 dead. - 1370 in serious condition.",2020-01-29 17:43:30,/r/Coronavirus/comments/evxfs0/breaking_update_on_coronavirus_7811_infected/
fg0iniv,0.7783,-0.8658,Hope the bat soup was worth it :),"BREAKING: Update on #CoronaVirus - 7,811 infected. - 12,167 suspected cases. - 170 dead. - 1370 in serious condition.",2020-01-29 17:43:30,/r/Coronavirus/comments/evxfs0/breaking_update_on_coronavirus_7811_infected/
ffz1d97,0.0,-0.8658,[deleted],"BREAKING: Update on #CoronaVirus - 7,811 infected. - 12,167 suspected cases. - 170 dead. - 1370 in serious condition.",2020-01-29 17:43:30,/r/Coronavirus/comments/evxfs0/breaking_update_on_coronavirus_7811_infected/
ffyo5am,0.0,-0.8658,[deleted],"BREAKING: Update on #CoronaVirus - 7,811 infected. - 12,167 suspected cases. - 170 dead. - 1370 in serious condition.",2020-01-29 17:43:30,/r/Coronavirus/comments/evxfs0/breaking_update_on_coronavirus_7811_infected/
ffz6xu6,0.0,-0.8658,"CDC reports 5 confirmed cases in the US, 92 are awaiting lab results. https://www.cdc.gov/coronavirus/2019-ncov/cases-in-us.html","BREAKING: Update on #CoronaVirus - 7,811 infected. - 12,167 suspected cases. - 170 dead. - 1370 in serious condition.",2020-01-29 17:43:30,/r/Coronavirus/comments/evxfs0/breaking_update_on_coronavirus_7811_infected/
ffzfs0x,-0.4574,-0.8658,"Lol 100k?!   That was a week ago.   Many.. MANY doctors / medical staff reported that the government of China is purposely underreporting statistics.     Many doctors and nurses have gone to the internet to share that on or before January 21st there was a minimum of 120k cases of infection.   Couple that with the 5 million that have left areas of China prior to the quarantine... and it’s safe to say that the cases of infected is far more high. Especially so because 1) The infected can be asymptomatic for up to 2 weeks. (Show Zero signs for 2 weeks) 2) the infected can infect others via peer to peer contact, even by means of droplets (coughing in the air... and their minute saliva being inhaled by others)","BREAKING: Update on #CoronaVirus - 7,811 infected. - 12,167 suspected cases. - 170 dead. - 1370 in serious condition.",2020-01-29 17:43:30,/r/Coronavirus/comments/evxfs0/breaking_update_on_coronavirus_7811_infected/
ffz6edc,0.3612,-0.8658,"Definitely got “*like, subscribe, and leave a comment under this video*” vibes off this comment.","BREAKING: Update on #CoronaVirus - 7,811 infected. - 12,167 suspected cases. - 170 dead. - 1370 in serious condition.",2020-01-29 17:43:30,/r/Coronavirus/comments/evxfs0/breaking_update_on_coronavirus_7811_infected/
ffyy60p,0.1531,0.0,THIS IS 100% REAL wanna know why? The ambulance uniform jackets are TORONTO paramedic uniform jackets (that mean this plane is IN Toronto not China)  (flying from China to Toronto) because Air Canada has banned flights going to China so you can only assume that yes.. this is a flight straight from China....,Is this real ? Air Canada flight with people on stretchers.,2020-01-29 18:40:33,/r/Coronavirus/comments/evy9hw/is_this_real_air_canada_flight_with_people_on/
ffyrab5,-0.2732,0.0,Any other sources confirming this? Feel like if a planeful was being quarantined we’d hear about it. Also they need to stop letting people leave quarantines just because they have no current symptoms.,Is this real ? Air Canada flight with people on stretchers.,2020-01-29 18:40:33,/r/Coronavirus/comments/evy9hw/is_this_real_air_canada_flight_with_people_on/
ffyr7qn,0.5994,0.0,That certainly does look like the air Canada symbol in the preferred seating area.,Is this real ? Air Canada flight with people on stretchers.,2020-01-29 18:40:33,/r/Coronavirus/comments/evy9hw/is_this_real_air_canada_flight_with_people_on/
ffz17sw,0.4404,0.0,Thanks got it earlier as a friend's daughter was on this arriving flight from HK earlier this evening....someone has high fever so a medical was sent on board to sanitize before deplanning was allowed.,Is this real ? Air Canada flight with people on stretchers.,2020-01-29 18:40:33,/r/Coronavirus/comments/evy9hw/is_this_real_air_canada_flight_with_people_on/
ffz7d3v,0.0356,0.0,"Can confirm that a plane landed today in Toronto with several passengers showing symptoms of fever ect. Heard over ATC as the pilots were communicating about the issue. Not sure of the entire plane was quarantined, or just certain people.. 😷😷",Is this real ? Air Canada flight with people on stretchers.,2020-01-29 18:40:33,/r/Coronavirus/comments/evy9hw/is_this_real_air_canada_flight_with_people_on/
ffyvp4d,0.0,0.0,It's in Ottawa according to the other video on his channel (same content but shows Walkley / McCarthy location which is an intersection next to Ottawa International Airport)[https://www.youtube.com/watch?v=TK0\_MuMlBXc](https://www.youtube.com/watch?v=TK0_MuMlBXc)&#x200B;EDIT: Maybe not. Same youtube poster's FB comment says plane landed in Toronto. [https://www.facebook.com/jesse.morotti/posts/10157763657548847](https://www.facebook.com/jesse.morotti/posts/10157763657548847),Is this real ? Air Canada flight with people on stretchers.,2020-01-29 18:40:33,/r/Coronavirus/comments/evy9hw/is_this_real_air_canada_flight_with_people_on/
ffz7jfi,-0.5859,0.0,WHO or a health official in your country has to declare a health emergency before your country stop taking flights from China. For “political coverage” reasons. North Korea and Russia have outright shut their borders..,Is this real ? Air Canada flight with people on stretchers.,2020-01-29 18:40:33,/r/Coronavirus/comments/evy9hw/is_this_real_air_canada_flight_with_people_on/
ffz9j69,-0.5106,0.0,The Canadian government is failing us with its lax attitude towards this..,Is this real ? Air Canada flight with people on stretchers.,2020-01-29 18:40:33,/r/Coronavirus/comments/evy9hw/is_this_real_air_canada_flight_with_people_on/
fg2cg2q,-0.4939,0.0,Debunked. Patient being stretched off suffered from non Coronavirus issues.https://www.blogto.com/city/2020/01/toronto-misinformation-coronavirus/,Is this real ? Air Canada flight with people on stretchers.,2020-01-29 18:40:33,/r/Coronavirus/comments/evy9hw/is_this_real_air_canada_flight_with_people_on/
fg05px0,0.4939,0.0,Can confirm this. My friend works at the Toronto airport for West Jet. Last night he messaged our group chat saying he saw men in hazmat suits taking passengers off the plane from an Air Canada flight; coming from terminal 1If you guys have any questions let me know and I’ll ask him,Is this real ? Air Canada flight with people on stretchers.,2020-01-29 18:40:33,/r/Coronavirus/comments/evy9hw/is_this_real_air_canada_flight_with_people_on/
ffytrvj,0.4404,0.0,"Better question is, 240p? We are in 2020, why this ain't in 4k",Is this real ? Air Canada flight with people on stretchers.,2020-01-29 18:40:33,/r/Coronavirus/comments/evy9hw/is_this_real_air_canada_flight_with_people_on/
ffz3bms,0.0,0.0," Definitively Air Canada, look at the Maple Leaf and words ""Préférence  Preferred"", and Air Canada web page advertising this service:  [https://www.aircanada.com/content/aircanada/ca/fr/aco/home/book/business-travel/corporate-rewards/offers/preferred-seats.html](https://www.youtube.com/redirect?q=https%3A%2F%2Fwww.aircanada.com%2Fcontent%2Faircanada%2Fca%2Ffr%2Faco%2Fhome%2Fbook%2Fbusiness-travel%2Fcorporate-rewards%2Foffers%2Fpreferred-seats.html&redir_token=M4tRI8BfvXk-aa9CKxgauvg_tXF8MTU4MDQ0ODkyNUAxNTgwMzYyNTI1&event=comments&stzid=UgyZLUn9yTQOuXI-kOF4AaABAg.94OsWTQf-Ep94P9wCI815W)",Is this real ? Air Canada flight with people on stretchers.,2020-01-29 18:40:33,/r/Coronavirus/comments/evy9hw/is_this_real_air_canada_flight_with_people_on/
ffz5b4i,-0.7227,0.0,"The media outlet is working to confirm the case. But preliminary review on the footage seems legit. Paramedic uniform confirms that its Toronto Emergency Medical Service Unit. It was very recently shot, as panics of coronavirus have reflected on Medical staff and passengers all wearing masks. It's still unknown which flight number this flight was from, but it does look like it landed at Pearson International Airport.There was an unconfirmed chat stating that there were 7 others with similar symptoms. This flight was said to be AC32 from Beijing to Toronto (unconfirmed) that arrived at YYZ 18:20 Jan 29th, 2019.",Is this real ? Air Canada flight with people on stretchers.,2020-01-29 18:40:33,/r/Coronavirus/comments/evy9hw/is_this_real_air_canada_flight_with_people_on/
ffyx5z4,0.0,0.0,Wasn’t this in the news yesterday or the day before? That flights were coming into Toronto and would be completely quarantined? This is likely footage of one of those flights.,Is this real ? Air Canada flight with people on stretchers.,2020-01-29 18:40:33,/r/Coronavirus/comments/evy9hw/is_this_real_air_canada_flight_with_people_on/
fg0gncs,0.0,0.0,"This post as of 13:00 on 30 Jan 2020, is 95% upvoted. I can't understand why 5% would be downvoting it.",Is this real ? Air Canada flight with people on stretchers.,2020-01-29 18:40:33,/r/Coronavirus/comments/evy9hw/is_this_real_air_canada_flight_with_people_on/
ffyyv9m,0.1431,0.0,I saw the video and wondered why governments are allowing planes to come back and not quarantining people? I wonder if it has anything to do with Agenda  21 and one of its main focuses being to cut the global population by a huge percentage of people?,Is this real ? Air Canada flight with people on stretchers.,2020-01-29 18:40:33,/r/Coronavirus/comments/evy9hw/is_this_real_air_canada_flight_with_people_on/
ffyvwwz,0.4404,0.0,"I’ll rewatch, thanks for the intel",Is this real ? Air Canada flight with people on stretchers.,2020-01-29 18:40:33,/r/Coronavirus/comments/evy9hw/is_this_real_air_canada_flight_with_people_on/
ffywniw,-0.4215,0.0,Different plane but same thing https://www.bbc.com/news/world-us-canada-51299635Edit-wait no they can go home,Is this real ? Air Canada flight with people on stretchers.,2020-01-29 18:40:33,/r/Coronavirus/comments/evy9hw/is_this_real_air_canada_flight_with_people_on/
ffywz9p,0.0,0.0,https://imgur.com/FTFdNbzSo it is an Air Canada plane I guess?,Is this real ? Air Canada flight with people on stretchers.,2020-01-29 18:40:33,/r/Coronavirus/comments/evy9hw/is_this_real_air_canada_flight_with_people_on/
ffyppsn,0.5859,-0.2732,It sure seems like it.,Anyone know if the internet is being cut off to Wuhan?,2020-01-29 18:40:36,/r/Coronavirus/comments/evy9in/anyone_know_if_the_internet_is_being_cut_off_to/
ffyptlf,-0.296,-0.2732,There is no open internet anyway.It's China.,Anyone know if the internet is being cut off to Wuhan?,2020-01-29 18:40:36,/r/Coronavirus/comments/evy9in/anyone_know_if_the_internet_is_being_cut_off_to/
ffyq5av,-0.5106,-0.2732,I watch an Irish guy on YouTube ~ he is in Wuhan and is posting daily.I think China is taking down videos of the hospital or of a panic tone.,Anyone know if the internet is being cut off to Wuhan?,2020-01-29 18:40:36,/r/Coronavirus/comments/evy9in/anyone_know_if_the_internet_is_being_cut_off_to/
ffypxkp,0.6318,-0.2732,"Needless to say, China is definitely censoring the people. They’ve had for a long time. Allegedly, WeChat has enforced strict rules on their platform to help prevent the spread of “rumors” regarding the coronavirus.Edit: https://imgur.com/gallery/TNXCwFTI can’t find the official source but this is a screenshot from the video I’ve watched on YouTube. Take this with a grain of salt because I’m not sure if this is confirmed yet.YouTube vid: https://youtu.be/hSIt496d82sTimestamp: 9:23 for better quality.",Anyone know if the internet is being cut off to Wuhan?,2020-01-29 18:40:36,/r/Coronavirus/comments/evy9in/anyone_know_if_the_internet_is_being_cut_off_to/
ffyth8b,0.1027,-0.2732,"I was thinking the something, initially this sub was like having direct contact with people in Vuhan. Over the time the updates died down, then lots of posts started getting deleted. Note most of the posts are either repost’s or seem like filtered by the chinese media",Anyone know if the internet is being cut off to Wuhan?,2020-01-29 18:40:36,/r/Coronavirus/comments/evy9in/anyone_know_if_the_internet_is_being_cut_off_to/
ffyqkja,-0.4404,-0.2732,https://twitter.com/netblocks/status/1220839409408450566 On the 22nd they began curfew-like outages that have likely expanded as the situation worsened.,Anyone know if the internet is being cut off to Wuhan?,2020-01-29 18:40:36,/r/Coronavirus/comments/evy9in/anyone_know_if_the_internet_is_being_cut_off_to/
ffyrdma,0.4215,-0.2732,"Lol if you go on snapmap on Snapchat and view Snapchat stories from wuhan, you will not get any Snapchat stories from actual Chinese people. It’s just trolls that set their gps location to wuhan",Anyone know if the internet is being cut off to Wuhan?,2020-01-29 18:40:36,/r/Coronavirus/comments/evy9in/anyone_know_if_the_internet_is_being_cut_off_to/
ffyu7bi,0.7021,-0.2732,There one Scottish guy posting to YouTube named Ben Govna? Honestly not sure of his name but he’s way to relaxed and downplaying the situation. Seems sketchy to me.,Anyone know if the internet is being cut off to Wuhan?,2020-01-29 18:40:36,/r/Coronavirus/comments/evy9in/anyone_know_if_the_internet_is_being_cut_off_to/
ffzgk33,0.2263,-0.2732,No.If u know Chinese u can find a lot of information from Wuhan on Weibo and other media platforms.Actually many people whose relatives refused to be admitted by hispotals saught help on the Internet,Anyone know if the internet is being cut off to Wuhan?,2020-01-29 18:40:36,/r/Coronavirus/comments/evy9in/anyone_know_if_the_internet_is_being_cut_off_to/
ffz86yh,-0.0934,-0.2732,"I have a friend there who sent me a message yesterday. He's really bored, stuck at home. He and his family are all healthy (apart from the boredom!).",Anyone know if the internet is being cut off to Wuhan?,2020-01-29 18:40:36,/r/Coronavirus/comments/evy9in/anyone_know_if_the_internet_is_being_cut_off_to/
fg0oidh,0.0,-0.2732,"About a week ago I had reports that several of our sites were suddenly not available in China, and we couldn't figure out why. I think that was the beginning of the lockdown.",Anyone know if the internet is being cut off to Wuhan?,2020-01-29 18:40:36,/r/Coronavirus/comments/evy9in/anyone_know_if_the_internet_is_being_cut_off_to/
ffyzj1z,-0.1531,-0.2732,The virus checker is stopping the internet traffic?,Anyone know if the internet is being cut off to Wuhan?,2020-01-29 18:40:36,/r/Coronavirus/comments/evy9in/anyone_know_if_the_internet_is_being_cut_off_to/
ffza3k5,0.128,-0.2732,The chinese government has the ability to isolate access basically to any place or any device not on a satellite service.,Anyone know if the internet is being cut off to Wuhan?,2020-01-29 18:40:36,/r/Coronavirus/comments/evy9in/anyone_know_if_the_internet_is_being_cut_off_to/
ffzoepy,0.0,-0.2732,Why? Just go to the snap map some none european people are making daily stories tho,Anyone know if the internet is being cut off to Wuhan?,2020-01-29 18:40:36,/r/Coronavirus/comments/evy9in/anyone_know_if_the_internet_is_being_cut_off_to/
ffzohpg,0.6124,-0.2732,"For what it's worth, my friends and colleagues who have relatives in Wuhan/Hubei province have not had any issues remaining in contact with their families.",Anyone know if the internet is being cut off to Wuhan?,2020-01-29 18:40:36,/r/Coronavirus/comments/evy9in/anyone_know_if_the_internet_is_being_cut_off_to/
ffypzou,0.0,-0.2732,I was just thinking the same thing.,Anyone know if the internet is being cut off to Wuhan?,2020-01-29 18:40:36,/r/Coronavirus/comments/evy9in/anyone_know_if_the_internet_is_being_cut_off_to/
ffyq0g2,-0.5365,-0.2732,"I have only seen a few videos of footage from Wuhan and heard that people were being threatened with going to jail for posting video. I am not sure if that is true, it would explain the lack of flow of information",Anyone know if the internet is being cut off to Wuhan?,2020-01-29 18:40:36,/r/Coronavirus/comments/evy9in/anyone_know_if_the_internet_is_being_cut_off_to/
ffyyw23,0.7849,-0.2732,"Yeah starting to think he is a paid shill since he works for 4news or something. He makes it look like everything is fine there. Having a kings meal, not being scared anything etc.",Anyone know if the internet is being cut off to Wuhan?,2020-01-29 18:40:36,/r/Coronavirus/comments/evy9in/anyone_know_if_the_internet_is_being_cut_off_to/
