Comment ID,Comment_VS,Title_VS,Comment,Title,Publish Date,Permalink
ffw8ei0,0.0,-0.3818,"He said *up to* 100,000...","If you disagree with the assertion that there's already at least 100,000 infections, then you're basically saying that you think you know more about this than the Head of Epidemiology at Yale. Think about that.",2020-01-29 00:19:24,/r/Coronavirus/comments/evk4q2/if_you_disagree_with_the_assertion_that_theres/
ffw6amq,0.4927,-0.3818,That’s a very good point.,"If you disagree with the assertion that there's already at least 100,000 infections, then you're basically saying that you think you know more about this than the Head of Epidemiology at Yale. Think about that.",2020-01-29 00:19:24,/r/Coronavirus/comments/evk4q2/if_you_disagree_with_the_assertion_that_theres/
ffw6p5l,-0.128,-0.3818,"Thank you. I’m worried it’s reached 200,000 if not more though with 5 million people missing from Wuhan.","If you disagree with the assertion that there's already at least 100,000 infections, then you're basically saying that you think you know more about this than the Head of Epidemiology at Yale. Think about that.",2020-01-29 00:19:24,/r/Coronavirus/comments/evk4q2/if_you_disagree_with_the_assertion_that_theres/
ffw7acw,-0.9652,-0.3818,"The current 2% fatality estimate is based on 106 deaths in 4,500 infected. If the actual infection rate is 100,000 then the fatality rate is only .01% If China had statistics to show it was 100,000 infected they would share those with the WHO. That makes it just a mild flu, with no reason to quarantine 50 million people, ban air travel & build a huge series of hospitals.","If you disagree with the assertion that there's already at least 100,000 infections, then you're basically saying that you think you know more about this than the Head of Epidemiology at Yale. Think about that.",2020-01-29 00:19:24,/r/Coronavirus/comments/evk4q2/if_you_disagree_with_the_assertion_that_theres/
ffwyisb,0.1531,-0.3818,I ain’t afraid of no PhD....but he’s right. Lol,"If you disagree with the assertion that there's already at least 100,000 infections, then you're basically saying that you think you know more about this than the Head of Epidemiology at Yale. Think about that.",2020-01-29 00:19:24,/r/Coronavirus/comments/evk4q2/if_you_disagree_with_the_assertion_that_theres/
ffwz6nu,0.5423,-0.3818,I love how he just couldn’t get it out and said fuck it the numbers are true.,"If you disagree with the assertion that there's already at least 100,000 infections, then you're basically saying that you think you know more about this than the Head of Epidemiology at Yale. Think about that.",2020-01-29 00:19:24,/r/Coronavirus/comments/evk4q2/if_you_disagree_with_the_assertion_that_theres/
ffx2r6b,0.0,-0.3818,"By second week of Feb, we should get a much clearer picture.","If you disagree with the assertion that there's already at least 100,000 infections, then you're basically saying that you think you know more about this than the Head of Epidemiology at Yale. Think about that.",2020-01-29 00:19:24,/r/Coronavirus/comments/evk4q2/if_you_disagree_with_the_assertion_that_theres/
ffxe60c,0.7947,-0.3818,"I mean, there are highly-qualified experts claiming a much lower estimate, and by insisting there cannot be less than 100,000, you're basically saying you think you know more about this than those highly-qualified experts.This isn’t a matter of confirmed facts at this stage. There are a range of well-informed guesses and a range of uninformed guesses. Picking which informed guess you agree with based on your own uninformed perspective doesn’t necessarily mean you think you are smarter than the people behind the other informed guesses. You would have a point if this were something where there is expert consensus and there were people denying that consensus without evidence, but we are pretty far off from that stage.Edit: To be clear, I personally think 100,000 sounds perfectly plausible. I just don't think it's fair to be so aggressively critical of people who would prefer to believe a more conservative number until more concrete information emerges.","If you disagree with the assertion that there's already at least 100,000 infections, then you're basically saying that you think you know more about this than the Head of Epidemiology at Yale. Think about that.",2020-01-29 00:19:24,/r/Coronavirus/comments/evk4q2/if_you_disagree_with_the_assertion_that_theres/
ffwi96r,0.0,-0.3818,"In fact, he said there ""may be up to"" 100,000 infections.  So, the epidemiologist's assertion is categorically different from OP's ""assertion that there's already at least 100,000 infections.""","If you disagree with the assertion that there's already at least 100,000 infections, then you're basically saying that you think you know more about this than the Head of Epidemiology at Yale. Think about that.",2020-01-29 00:19:24,/r/Coronavirus/comments/evk4q2/if_you_disagree_with_the_assertion_that_theres/
ffw8kf9,0.5719,-0.3818,"Good point, important point, will try to edit now. Apologies.","If you disagree with the assertion that there's already at least 100,000 infections, then you're basically saying that you think you know more about this than the Head of Epidemiology at Yale. Think about that.",2020-01-29 00:19:24,/r/Coronavirus/comments/evk4q2/if_you_disagree_with_the_assertion_that_theres/
ffwsmlz,-0.6908,-0.3818,"I'd believe it to be near 100,000.The U.S. alone has 1 case (and a potential 2nd) in Chicago, 1 in Seattle and 2 in L.A.3 of the biggest airports in the U.S. have had sick and possibly infectious people moving in and out of THOUSANDS of people as they traveled.France has 4 cases that flew in through Paris...another absolutely enormous airport...UAE just reported 4 cases that came in through Dubai...This thing is going to be everywhere already...it's just a matter of waiting for the incubation period to end and the cases start flowing in...Edit: and I saw some people worrying about people outside of China dying from the disease...one of the cases in France has gone from stable to Serious at the moment...praying they pull through.","If you disagree with the assertion that there's already at least 100,000 infections, then you're basically saying that you think you know more about this than the Head of Epidemiology at Yale. Think about that.",2020-01-29 00:19:24,/r/Coronavirus/comments/evk4q2/if_you_disagree_with_the_assertion_that_theres/
ffx3hnk,0.4215,-0.3818,So only 1 is possibility... nice,"If you disagree with the assertion that there's already at least 100,000 infections, then you're basically saying that you think you know more about this than the Head of Epidemiology at Yale. Think about that.",2020-01-29 00:19:24,/r/Coronavirus/comments/evk4q2/if_you_disagree_with_the_assertion_that_theres/
ffw8w25,0.3818,-0.3818,How do you know for sure that 106 deaths is the real and accounted for number?,"If you disagree with the assertion that there's already at least 100,000 infections, then you're basically saying that you think you know more about this than the Head of Epidemiology at Yale. Think about that.",2020-01-29 00:19:24,/r/Coronavirus/comments/evk4q2/if_you_disagree_with_the_assertion_that_theres/
ffwkvrg,-0.9209,-0.3818,"Your thinking is flawed. The time is delayed. People who were infected 3 weeks ago are dying now. So you need to look and see how many cases there were back then. If there were only 1,000 then 106  / 1000 is about 10% fatality rate. (Just an example. I've seen calculations using this method vary from 5% to 15%).Right now there are over 6,000 infected globally. So in a week or two, we might see another 600 from that group die but, if the rate of infection remains stable (+50%/day), there could be a million people with Coronavirus within the next two weeks.The issue is that death rate increases as medical staff and resources are depleted. And underreporting becomes a huge issue. Right now, we're not seeing a lot of new data come out of China because they're out of test kits. So the numbers they're tracking are ""\~6,000 confirmed cases, \~10,000 suspected cases"". The suspected cases started to sky rocket two days ago when the kits started running out.","If you disagree with the assertion that there's already at least 100,000 infections, then you're basically saying that you think you know more about this than the Head of Epidemiology at Yale. Think about that.",2020-01-29 00:19:24,/r/Coronavirus/comments/evk4q2/if_you_disagree_with_the_assertion_that_theres/
ffw6mzj,0.8519,0.2577,People need to download these and reupload them too so they can’t be taken down like the others ones.China is desperate to cover up the the truth.Bless everyone who is trying to help and share the truth of the coronavirusStay safe everyone,SOMEONE PLS TRANSLATE VIDEO of NURSE/DOCTOR IN WUHAN,2020-01-29 00:26:24,/r/Coronavirus/comments/evk6yr/someone_pls_translate_video_of_nursedoctor_in/
ffw82sw,-0.7198,0.2577,"I've translated some comments through google translate and found this:It may be a medical staff who crouches on the ground wearing a hat, because she said: What do you think of our infection department? Inaudible in some places, but probably as follows: A-lady on the floor, B-lady standing.A: None of them know how to driveB: You have to wait in line, now a bunch of patients (persuasion tone)A: XXX (not heard) is a display. I am following the normal procedure. I am holding my stomach. I also line up one by one. I will go to the doctor and ask him to prescribe XX (not heard).B: If you have diarrhea, you should take some medicine for diarrhea first. . . . The disease in your lungs is not serious.A stands up: Why isn't it heavy if I cough for 6 days? You try to say this again (waving your finger to B), you try to say this sentence again.B whispering: What's the use of howling? (Persuasion)A: I coughed 5 or 6 days ago. What do you think of our infection department? (Call and squat)B said to the people next to her: all spread out, all spread out, she doesn't know if there is this disease yet, why are you all standing so close?A squatted on the ground and called: The head nurse of XXX said that you (referring to A) did not hand in the leave note within an hour, even if you were absent from work.The video is over.Pay tribute to medical staff, folks in Wuhan, come on! !!",SOMEONE PLS TRANSLATE VIDEO of NURSE/DOCTOR IN WUHAN,2020-01-29 00:26:24,/r/Coronavirus/comments/evk6yr/someone_pls_translate_video_of_nursedoctor_in/
ffw8ire,0.1957,0.2577,"The title says that in the 5th Hospital of Wuhan, this person is having fever and coughing for many days but still can’t get a spot at the hospital. I’m not totally sure if this is referring to the nurse in the video or just people in general. If we trust the video title, then it seems like the nurse is the one that’s sick. I’m not very familiar with the Wuhan dialect, but from what I can understand she starts by saying that someone is “dying for no good reason” and then goes on to ask/yell at the other nurse “how can you make me do this kind of job?”Hope that helps and other people can add on to make a complete translation.",SOMEONE PLS TRANSLATE VIDEO of NURSE/DOCTOR IN WUHAN,2020-01-29 00:26:24,/r/Coronavirus/comments/evk6yr/someone_pls_translate_video_of_nursedoctor_in/
ffw6ovl,0.0,0.2577,Who is the uploader. This way I can follow him too,SOMEONE PLS TRANSLATE VIDEO of NURSE/DOCTOR IN WUHAN,2020-01-29 00:26:24,/r/Coronavirus/comments/evk6yr/someone_pls_translate_video_of_nursedoctor_in/
ffwl7yj,0.296,0.2577,I've translated one of his other videos. Please watch and look at the comments for giant blobs of English:https://www.youtube.com/watch?v=3VOugb6KDBYI cannot translate this current one because the lady is hysterical and also I don't understand the Wuhan dialect.,SOMEONE PLS TRANSLATE VIDEO of NURSE/DOCTOR IN WUHAN,2020-01-29 00:26:24,/r/Coronavirus/comments/evk6yr/someone_pls_translate_video_of_nursedoctor_in/
ffwk5gb,-0.5574,0.2577,Does China want all of us to die?,SOMEONE PLS TRANSLATE VIDEO of NURSE/DOCTOR IN WUHAN,2020-01-29 00:26:24,/r/Coronavirus/comments/evk6yr/someone_pls_translate_video_of_nursedoctor_in/
ffxpk9d,0.2846,0.2577,"It is the nurse. She got infected working but is told to petition to be hospitalized just like everyone else. There is a bureaucratic process for beds in Wuhan right now. You have to do a lot of paper work and get in line, impossible to get without connections and backdoors.",SOMEONE PLS TRANSLATE VIDEO of NURSE/DOCTOR IN WUHAN,2020-01-29 00:26:24,/r/Coronavirus/comments/evk6yr/someone_pls_translate_video_of_nursedoctor_in/
ffw6pu9,0.0,0.2577,https://www.youtube.com/channel/UCv361SF6FKznoGPKEFG9Yhw,SOMEONE PLS TRANSLATE VIDEO of NURSE/DOCTOR IN WUHAN,2020-01-29 00:26:24,/r/Coronavirus/comments/evk6yr/someone_pls_translate_video_of_nursedoctor_in/
ffxohui,-0.6207,0.2577,It says restricted mode has hidden comments. I'm on mobile so idk if it's a setting on my end or if it's been censored,SOMEONE PLS TRANSLATE VIDEO of NURSE/DOCTOR IN WUHAN,2020-01-29 00:26:24,/r/Coronavirus/comments/evk6yr/someone_pls_translate_video_of_nursedoctor_in/
ffwpx79,-0.8225,0.2577,I mean it’s not new that they want the western world civilization dead and don’t give a shit about any other country nor their own people anyway,SOMEONE PLS TRANSLATE VIDEO of NURSE/DOCTOR IN WUHAN,2020-01-29 00:26:24,/r/Coronavirus/comments/evk6yr/someone_pls_translate_video_of_nursedoctor_in/
ffxabe1,-0.2112,0.2577,"Mostly people in Hong Kong but yeah, if there were less people the debt wouldn't be as big an issue and there'd be more economic opportunity after a bunch of people died.",SOMEONE PLS TRANSLATE VIDEO of NURSE/DOCTOR IN WUHAN,2020-01-29 00:26:24,/r/Coronavirus/comments/evk6yr/someone_pls_translate_video_of_nursedoctor_in/
fg5xqja,0.6908,0.2577,commie honor is greater than life itself,SOMEONE PLS TRANSLATE VIDEO of NURSE/DOCTOR IN WUHAN,2020-01-29 00:26:24,/r/Coronavirus/comments/evk6yr/someone_pls_translate_video_of_nursedoctor_in/
ffxpq4q,0.9266,0.2577,"Hello, this is Qiushi. Right now it’s January 27, about 9 in the morning. Yesterday, that is the second day of the [Lunar] New Year, I did the following things. During the day, a local Wuhan web friend took me to go shopping at a large local Wuhan supermarket. I saw locally that there is still a very adequate supply of common necessities such as meat, poultry, eggs, milk, oil, salt, soy sauce, and vinegar. The prices were also very reasonable, no cause for situations of mad plundering. However, many drugstores were not open so buying masks and disinfectant was a big problem. Later at night, I went to the infamous Huanan Seafood Market. The whole place has been sealed off. There was caution tape put up and security on patrol. So I talked to the security guard. Security says the shop fronts overlooking the street here generally sell seafood, but the stalls further inside…those are bustling and lively with things like foxes, monkeys, pangolins, anything and everything. Furthermore, the local nouveau riche indeed have the practice of consuming wild game for nourishment [and building up vitality]. Also, the security guard said, “Aren’t you afraid to be here? Even the Wuhan folks are too afraid to come here. Don’t you see the cars going around [to avoid this place]?” And then I discussed with the security guard a bit of gossip about the owner of the Hunan Seafood Market. He said the owner has a lot of clout. Look at how close this place is to the train station at the center of the city. He was able to secure this place and open an urban farmer’s market. For so many years, people wanted it torn down but just couldn’t do it. Just some gossip.And then at 11:30 or so at night, I went back to Wuhan No. 11 Hospital. Why did I go back to the same hospital? Because the transportation is paralyzed, I couldn’t get a ride. I am using Mobike [an app-based bicycle-rental company] bicycles as transportation, so I could only cover a range within these few kilometers. I’m very sorry. When I got to the hospital, I found out that on the second day of the [Lunar] New Year, that is yesterday, the number of patients looking to get treated clearly reduced by a lot compared to the day before yesterday, first day of the New Year. The long queue disappeared. And also, there was a lot of empty seats. The hundreds of little red plastic stools that were used from before were stacked up to the side. The doctors and nurses had more free time so I took some more time to chat with them. So I asked the nurse, which day had the most people? The doctor said, “well that’s the 28th and 29th of the twelfth (and last) month of the [Lunar] year. It was like everyone went insane! Thousands upon thousands of people were piled up here.” And the nurse said, “That day, someone even hit me.” I asked, “Why did they hit you?” She said, “That patient was very irritated. She spent many hours in line for registration, many hours in line to get diagnosed, many hours in line to pick up medicine, then spent many hours to get an injection. So you would imagine how agitated she must have been. She insisted on being hospitalized. I said ‘For your situation, you just have to go home and take your medicine. You don’t have to be so anxious to be hospitalized. Moreover, even if you were to be admitted, I don’t have any beds. I don’t have any beds. Where would you stay?’ So then the lady hit me. I said, ‘You even have the strength to hit me, what do you mean, you need to be hospitalized?’",SOMEONE PLS TRANSLATE VIDEO of NURSE/DOCTOR IN WUHAN,2020-01-29 00:26:24,/r/Coronavirus/comments/evk6yr/someone_pls_translate_video_of_nursedoctor_in/
ffxoc60,-0.296,0.2577, howdoes letting their own people die from a virus help them achieve that goal?,SOMEONE PLS TRANSLATE VIDEO of NURSE/DOCTOR IN WUHAN,2020-01-29 00:26:24,/r/Coronavirus/comments/evk6yr/someone_pls_translate_video_of_nursedoctor_in/
