Comment ID,Comment_VS,Title_VS,Comment,Title,Publish Date,Permalink
fg4u3k2,-0.4782,-0.0772,"Maybe they should be, but they can' t be because there aren't that many tests or people to give them and even if there were that many samples would get so backlogged it would take so long to process them all that it wouldn't do any good.","Anyone with flu symptoms in the US should be given a Novel Corona test, not just people recently in from Wuhan or their close contacts, since direct flights from Wuhan were rolling in all Dec. and odds are this thing had been around since at least Nov, since patient 1 was diagnosed Dec. 8th.",2020-01-31 12:22:43,/r/Coronavirus/comments/ewub8m/anyone_with_flu_symptoms_in_the_us_should_be/
fg4xyp3,0.0,-0.0772,"The first cases, they called the pneumonic plague and we're reported on the 13th of November!!","Anyone with flu symptoms in the US should be given a Novel Corona test, not just people recently in from Wuhan or their close contacts, since direct flights from Wuhan were rolling in all Dec. and odds are this thing had been around since at least Nov, since patient 1 was diagnosed Dec. 8th.",2020-01-31 12:22:43,/r/Coronavirus/comments/ewub8m/anyone_with_flu_symptoms_in_the_us_should_be/
fg4uijy,0.5389,-0.0772,"What exactly does this accomplish other than better numbers? Given the incubation period and symptoms that are slow to appear, I am not sure this would do anything to stop the spread. It’s not like we are capable of quarantining 25 percent of the country(usa) after all.","Anyone with flu symptoms in the US should be given a Novel Corona test, not just people recently in from Wuhan or their close contacts, since direct flights from Wuhan were rolling in all Dec. and odds are this thing had been around since at least Nov, since patient 1 was diagnosed Dec. 8th.",2020-01-31 12:22:43,/r/Coronavirus/comments/ewub8m/anyone_with_flu_symptoms_in_the_us_should_be/
fg5dl22,-0.9061,-0.0772,I’ve been sick on and off with flu symptoms for the two weeks. My doctor just said it’s a really bad cold and flu season this time around.,"Anyone with flu symptoms in the US should be given a Novel Corona test, not just people recently in from Wuhan or their close contacts, since direct flights from Wuhan were rolling in all Dec. and odds are this thing had been around since at least Nov, since patient 1 was diagnosed Dec. 8th.",2020-01-31 12:22:43,/r/Coronavirus/comments/ewub8m/anyone_with_flu_symptoms_in_the_us_should_be/
fg5fix6,-0.6419,-0.0772,"As far as symptoms, I've heard there is NOT much runny nose, sneezing going in with coronavirus--that it's more high fever, cough, and difficulty breathing.Is this accurate? If so, this would be very noticeably different from the usual sore throat,  101 degree fever, cough, runny nose, and ear infection that I usually get in the winter. I've never had trouble breathing with the flu.","Anyone with flu symptoms in the US should be given a Novel Corona test, not just people recently in from Wuhan or their close contacts, since direct flights from Wuhan were rolling in all Dec. and odds are this thing had been around since at least Nov, since patient 1 was diagnosed Dec. 8th.",2020-01-31 12:22:43,/r/Coronavirus/comments/ewub8m/anyone_with_flu_symptoms_in_the_us_should_be/
fg5ka6h,0.4404,-0.0772,"Oh shitHadn't thought of that. Out of curiosity, would it be better to get it now, and recover. Than to get it in say... 6months after it's mutated?","Anyone with flu symptoms in the US should be given a Novel Corona test, not just people recently in from Wuhan or their close contacts, since direct flights from Wuhan were rolling in all Dec. and odds are this thing had been around since at least Nov, since patient 1 was diagnosed Dec. 8th.",2020-01-31 12:22:43,/r/Coronavirus/comments/ewub8m/anyone_with_flu_symptoms_in_the_us_should_be/
fg5vyqk,0.0,-0.0772,That's 21 million people. Not happening.,"Anyone with flu symptoms in the US should be given a Novel Corona test, not just people recently in from Wuhan or their close contacts, since direct flights from Wuhan were rolling in all Dec. and odds are this thing had been around since at least Nov, since patient 1 was diagnosed Dec. 8th.",2020-01-31 12:22:43,/r/Coronavirus/comments/ewub8m/anyone_with_flu_symptoms_in_the_us_should_be/
fg5x4p0,0.5984,-0.0772,"Disagree.  Overwhelming the CDC with unneccessary tests will only delay diagnosis for those patients who are actually infected with coronavirus which delays tracking down their contacts, which ultimately delays containment and promotes spread of the infection.  Trust the CDC.  They have very smart people with advanced science and medical degrees and they know what they are doing.  They are the experts tracking infectious diseases.  Be calm and carry on.","Anyone with flu symptoms in the US should be given a Novel Corona test, not just people recently in from Wuhan or their close contacts, since direct flights from Wuhan were rolling in all Dec. and odds are this thing had been around since at least Nov, since patient 1 was diagnosed Dec. 8th.",2020-01-31 12:22:43,/r/Coronavirus/comments/ewub8m/anyone_with_flu_symptoms_in_the_us_should_be/
fg5j6mr,-0.7309,-0.0772,"This is going to sound so ignorant. I received a package from China a week ago. Well I’ve been sick the last 2 days. Just congestion and chest feels heavy, hard to breath. I tweeted at the CDC and they replied with they really don’t know if they virus can reach the US or anywhere from imported goods. I’m a little freaked","Anyone with flu symptoms in the US should be given a Novel Corona test, not just people recently in from Wuhan or their close contacts, since direct flights from Wuhan were rolling in all Dec. and odds are this thing had been around since at least Nov, since patient 1 was diagnosed Dec. 8th.",2020-01-31 12:22:43,/r/Coronavirus/comments/ewub8m/anyone_with_flu_symptoms_in_the_us_should_be/
fg4o0hs,-0.4588,-0.0772,"I agree.    The virus symptoms mimic the flu.    The virus was rampant in China all of January.    The US had many visitors from China until the shut down January 23rd.    The virus is contagious for days before it is symptomatic.    As those visitors have spread out through the US, how do we know they are not spreading the virus as they go?  People think they have the flu and they end up spreading it as well to family members, co-workers etc.","Anyone with flu symptoms in the US should be given a Novel Corona test, not just people recently in from Wuhan or their close contacts, since direct flights from Wuhan were rolling in all Dec. and odds are this thing had been around since at least Nov, since patient 1 was diagnosed Dec. 8th.",2020-01-31 12:22:43,/r/Coronavirus/comments/ewub8m/anyone_with_flu_symptoms_in_the_us_should_be/
fg4fvaf,0.0,-0.0772,"If the first patient was diagnosed Dec 8, he could've been spreading it within 14 days prior to the diagnosis as the virus can be transmitted even during the asymptomatic stage.","Anyone with flu symptoms in the US should be given a Novel Corona test, not just people recently in from Wuhan or their close contacts, since direct flights from Wuhan were rolling in all Dec. and odds are this thing had been around since at least Nov, since patient 1 was diagnosed Dec. 8th.",2020-01-31 12:22:43,/r/Coronavirus/comments/ewub8m/anyone_with_flu_symptoms_in_the_us_should_be/
fg5l6yn,0.6433,-0.0772,"This would be an impossible criteria to accomplish. Of course it's easy to say we should test everyone for this specific disease... But that is technology that a good medical, anthropology, etc etc type universities have or can access along with some government health agencies and federally qualified healthcare may have. Limited. So tests are limited as well.","Anyone with flu symptoms in the US should be given a Novel Corona test, not just people recently in from Wuhan or their close contacts, since direct flights from Wuhan were rolling in all Dec. and odds are this thing had been around since at least Nov, since patient 1 was diagnosed Dec. 8th.",2020-01-31 12:22:43,/r/Coronavirus/comments/ewub8m/anyone_with_flu_symptoms_in_the_us_should_be/
fg4fnxp,0.0,0.0,What R0 means?,New Paper: Coronavirus more transmissible than previously thought. R0 is possibly 4.08. That would make it completely uncontainable.,2020-01-31 12:22:59,/r/Coronavirus/comments/ewubdo/new_paper_coronavirus_more_transmissible_than/
fg4klv0,-0.2144,0.0,"This is from a scientific paper that’s unreviewed by peers.It seems pretty legit if you see what’s written in the report, but due to the lack of time to have it assessed by peers, it’s unreviewed so may be unreliable.",New Paper: Coronavirus more transmissible than previously thought. R0 is possibly 4.08. That would make it completely uncontainable.,2020-01-31 12:22:59,/r/Coronavirus/comments/ewubdo/new_paper_coronavirus_more_transmissible_than/
fg599ml,-0.3818,0.0,Hey so I made a post earlier today about how you should take anything on BioRxiv with a grain of salt. This is the medical paper version of that.We’ve seen multiple R0 values proposed. There’s no reason to think this one is right and all the others are wrong.,New Paper: Coronavirus more transmissible than previously thought. R0 is possibly 4.08. That would make it completely uncontainable.,2020-01-31 12:22:59,/r/Coronavirus/comments/ewubdo/new_paper_coronavirus_more_transmissible_than/
fg4ko92,-0.872,0.0,It also says fatality rate is 6.5%Ok we are fucked,New Paper: Coronavirus more transmissible than previously thought. R0 is possibly 4.08. That would make it completely uncontainable.,2020-01-31 12:22:59,/r/Coronavirus/comments/ewubdo/new_paper_coronavirus_more_transmissible_than/
fg5dbix,0.2541,0.0,Looks like the data is basing R0 based on speed of cases ramping up of the numbers thst China CDC provided. But there is reason to believe these numbers aren’t real. They ramped up their testing speed and results so the growth LOOKS insane but it’s not as much as it is. Do I make a point on this?,New Paper: Coronavirus more transmissible than previously thought. R0 is possibly 4.08. That would make it completely uncontainable.,2020-01-31 12:22:59,/r/Coronavirus/comments/ewubdo/new_paper_coronavirus_more_transmissible_than/
fg4w3o8,-0.4939,0.0,This fear is not being reflected in numbers.,New Paper: Coronavirus more transmissible than previously thought. R0 is possibly 4.08. That would make it completely uncontainable.,2020-01-31 12:22:59,/r/Coronavirus/comments/ewubdo/new_paper_coronavirus_more_transmissible_than/
fg54s7j,0.0,0.0,How long does it take to get peer reviewed?,New Paper: Coronavirus more transmissible than previously thought. R0 is possibly 4.08. That would make it completely uncontainable.,2020-01-31 12:22:59,/r/Coronavirus/comments/ewubdo/new_paper_coronavirus_more_transmissible_than/
fg5ey4l,0.9246,0.0,"Looks like a better paper than the other one floating around that has been debunked into the last decade.  Though I would like to know why they threw out most of the available data.Key point for you fearmongers (yeah, you know who you are):>Our study also suggests that by reducing the average infectious period to <2.3 days,the resulting R will decease to a value less than 1, meaning the epidemic can be effectively    controlled.",New Paper: Coronavirus more transmissible than previously thought. R0 is possibly 4.08. That would make it completely uncontainable.,2020-01-31 12:22:59,/r/Coronavirus/comments/ewubdo/new_paper_coronavirus_more_transmissible_than/
fg5ggvw,0.0772,0.0,"Uncontainable isn't a word.R0 is not a static figure, it varies based on a number of things.",New Paper: Coronavirus more transmissible than previously thought. R0 is possibly 4.08. That would make it completely uncontainable.,2020-01-31 12:22:59,/r/Coronavirus/comments/ewubdo/new_paper_coronavirus_more_transmissible_than/
fg4fo3i,0.6486,0.0,"Thank you for posting this. I can’t post anything anymore. Even scientific journals, lol.",New Paper: Coronavirus more transmissible than previously thought. R0 is possibly 4.08. That would make it completely uncontainable.,2020-01-31 12:22:59,/r/Coronavirus/comments/ewubdo/new_paper_coronavirus_more_transmissible_than/
fg5r49p,0.4898,0.0,Hmm... The whole simulation in the paper is based on 6 (!!!) data points. I would take any numbers there with a huge grain of salt. The inaccuracy may be very large.,New Paper: Coronavirus more transmissible than previously thought. R0 is possibly 4.08. That would make it completely uncontainable.,2020-01-31 12:22:59,/r/Coronavirus/comments/ewubdo/new_paper_coronavirus_more_transmissible_than/
fg630ku,-0.6124,0.0,"We had a Chinese workshop leader infect two Germans, who infected at least four more colleagues, one of whom flew to Spanish territory, the other infected his kid and very likely his other two kids and wife (all have symptoms), the kid that tested positive had been in kindergarten.I no longer believe in containment.",New Paper: Coronavirus more transmissible than previously thought. R0 is possibly 4.08. That would make it completely uncontainable.,2020-01-31 12:22:59,/r/Coronavirus/comments/ewubdo/new_paper_coronavirus_more_transmissible_than/
fg5h28f,0.0,0.0,Measles r0 is 12 to 18.,New Paper: Coronavirus more transmissible than previously thought. R0 is possibly 4.08. That would make it completely uncontainable.,2020-01-31 12:22:59,/r/Coronavirus/comments/ewubdo/new_paper_coronavirus_more_transmissible_than/
fg5qkvp,0.0,0.0,This is pure speculation and un-peer reviewed.,New Paper: Coronavirus more transmissible than previously thought. R0 is possibly 4.08. That would make it completely uncontainable.,2020-01-31 12:22:59,/r/Coronavirus/comments/ewubdo/new_paper_coronavirus_more_transmissible_than/
fg66rpf,-0.3182,0.0,They are keeping us in the dark and feeding us bullshit like we are mushrooms.,New Paper: Coronavirus more transmissible than previously thought. R0 is possibly 4.08. That would make it completely uncontainable.,2020-01-31 12:22:59,/r/Coronavirus/comments/ewubdo/new_paper_coronavirus_more_transmissible_than/
fg6diqd,-0.4939,0.0,Another fear monger...,New Paper: Coronavirus more transmissible than previously thought. R0 is possibly 4.08. That would make it completely uncontainable.,2020-01-31 12:22:59,/r/Coronavirus/comments/ewubdo/new_paper_coronavirus_more_transmissible_than/
fjn3au9,0.0,0.0,This seems to be accurate to the reality of the case right now,New Paper: Coronavirus more transmissible than previously thought. R0 is possibly 4.08. That would make it completely uncontainable.,2020-01-31 12:22:59,/r/Coronavirus/comments/ewubdo/new_paper_coronavirus_more_transmissible_than/
fg4g45r,0.0,0.0,Can’t open link - can you screenshot?,New Paper: Coronavirus more transmissible than previously thought. R0 is possibly 4.08. That would make it completely uncontainable.,2020-01-31 12:22:59,/r/Coronavirus/comments/ewubdo/new_paper_coronavirus_more_transmissible_than/
fg4h1mt,0.0,0.0,Link not working on mobile,New Paper: Coronavirus more transmissible than previously thought. R0 is possibly 4.08. That would make it completely uncontainable.,2020-01-31 12:22:59,/r/Coronavirus/comments/ewubdo/new_paper_coronavirus_more_transmissible_than/
fg5dc27,0.2541,0.0,Looks like the data is basing R0 based on speed of cases ramping up of the numbers thst China CDC provided. But there is reason to believe these numbers aren’t real. They ramped up their testing speed and results so the growth LOOKS insane but it’s not as much as it is. Do I make a point on this?,New Paper: Coronavirus more transmissible than previously thought. R0 is possibly 4.08. That would make it completely uncontainable.,2020-01-31 12:22:59,/r/Coronavirus/comments/ewubdo/new_paper_coronavirus_more_transmissible_than/
fg4v4ea,0.0,0.2023,That country is practically the Dodo bird of Europe.,"The 15 people being flown in from the virus epicentre to Sweden will not be quarantined, only recommended to stay home for 2 weeks.",2020-01-31 12:23:16,/r/Coronavirus/comments/ewubj4/the_15_people_being_flown_in_from_the_virus/
fg4f1sh,0.0,0.2023,[deleted],"The 15 people being flown in from the virus epicentre to Sweden will not be quarantined, only recommended to stay home for 2 weeks.",2020-01-31 12:23:16,/r/Coronavirus/comments/ewubj4/the_15_people_being_flown_in_from_the_virus/
fg4ycth,0.0,0.2023,They're all going to be tested before and after the flight and they'll have continuous contact with doctors. Obviously they're going to be quarantined if they have the virus.Don't get people riled up.,"The 15 people being flown in from the virus epicentre to Sweden will not be quarantined, only recommended to stay home for 2 weeks.",2020-01-31 12:23:16,/r/Coronavirus/comments/ewubj4/the_15_people_being_flown_in_from_the_virus/
fg4jd5y,0.0,0.2023,HOWTO: purge refugees in Sweden,"The 15 people being flown in from the virus epicentre to Sweden will not be quarantined, only recommended to stay home for 2 weeks.",2020-01-31 12:23:16,/r/Coronavirus/comments/ewubj4/the_15_people_being_flown_in_from_the_virus/
fg5t7v4,0.0,0.2023,Stayed it here : https://youtu.be/ndRk63UmelQ,"The 15 people being flown in from the virus epicentre to Sweden will not be quarantined, only recommended to stay home for 2 weeks.",2020-01-31 12:23:16,/r/Coronavirus/comments/ewubj4/the_15_people_being_flown_in_from_the_virus/
fg4xfcw,0.5095,0.2023,So glad I’m not living there.,"The 15 people being flown in from the virus epicentre to Sweden will not be quarantined, only recommended to stay home for 2 weeks.",2020-01-31 12:23:16,/r/Coronavirus/comments/ewubj4/the_15_people_being_flown_in_from_the_virus/
fg5dwo7,-0.4588,0.2023,"Any country that proclaims itself a ""moral superpower"" is likely to be severely lacking in common sense.","The 15 people being flown in from the virus epicentre to Sweden will not be quarantined, only recommended to stay home for 2 weeks.",2020-01-31 12:23:16,/r/Coronavirus/comments/ewubj4/the_15_people_being_flown_in_from_the_virus/
fg4hrws,0.1027,0.2023,That sucks ... stay safe. Makes zero sense.,"The 15 people being flown in from the virus epicentre to Sweden will not be quarantined, only recommended to stay home for 2 weeks.",2020-01-31 12:23:16,/r/Coronavirus/comments/ewubj4/the_15_people_being_flown_in_from_the_virus/
fg57s16,0.1027,0.2023,US just admitted tests produce false negs,"The 15 people being flown in from the virus epicentre to Sweden will not be quarantined, only recommended to stay home for 2 weeks.",2020-01-31 12:23:16,/r/Coronavirus/comments/ewubj4/the_15_people_being_flown_in_from_the_virus/
fg5ivgf,-0.2732,0.2023,We don’t know enough about the virus to ensure that a negative test when symptoms are not presenting is accurate.,"The 15 people being flown in from the virus epicentre to Sweden will not be quarantined, only recommended to stay home for 2 weeks.",2020-01-31 12:23:16,/r/Coronavirus/comments/ewubj4/the_15_people_being_flown_in_from_the_virus/
fg4lnf9,0.0,0.2023,[deleted],"The 15 people being flown in from the virus epicentre to Sweden will not be quarantined, only recommended to stay home for 2 weeks.",2020-01-31 12:23:16,/r/Coronavirus/comments/ewubj4/the_15_people_being_flown_in_from_the_virus/
fg4qxxl,0.0,0.2023,I used the refugees to purge the refugees,"The 15 people being flown in from the virus epicentre to Sweden will not be quarantined, only recommended to stay home for 2 weeks.",2020-01-31 12:23:16,/r/Coronavirus/comments/ewubj4/the_15_people_being_flown_in_from_the_virus/
fg5qxad,-0.4585,0.2023,"Quick search turns up nothing of the sort. Other people were repeating this around here, but that doesn't make it true","The 15 people being flown in from the virus epicentre to Sweden will not be quarantined, only recommended to stay home for 2 weeks.",2020-01-31 12:23:16,/r/Coronavirus/comments/ewubj4/the_15_people_being_flown_in_from_the_virus/
fg5vpon,-0.2681,0.2023,False negs occurr in many different tests so that's nothing surprising. Statistically that's rather more expected.,"The 15 people being flown in from the virus epicentre to Sweden will not be quarantined, only recommended to stay home for 2 weeks.",2020-01-31 12:23:16,/r/Coronavirus/comments/ewubj4/the_15_people_being_flown_in_from_the_virus/
fg4syrq,0.0,0.2023,Depends who gets treated first or most,"The 15 people being flown in from the virus epicentre to Sweden will not be quarantined, only recommended to stay home for 2 weeks.",2020-01-31 12:23:16,/r/Coronavirus/comments/ewubj4/the_15_people_being_flown_in_from_the_virus/
fg5z8pa,0.9223,0.2023,"Yea trust me it wont be the swedes... Refugees always gets to pass in front of the line no matter what, housing, healthcare, subsidy. Can't risk people thinking you're one of them raycusts. We already have 3 month healt care queues because immigrant families filling up the hospitals when they hear their neighbor sneezing. I assume the lack of receptors in the lungs and the immune system will keep the swedes safe, it wont be our health care or ""preparedness""","The 15 people being flown in from the virus epicentre to Sweden will not be quarantined, only recommended to stay home for 2 weeks.",2020-01-31 12:23:16,/r/Coronavirus/comments/ewubj4/the_15_people_being_flown_in_from_the_virus/
fg4jk2r,0.431,0.0,"""his employee is based in Chicago and visited the Cleveland office on January 14th. According to the Ohio Department of Health, this individual was not symptomatic..."" too bad it's spreading while asymptomatic","Man Diagnosed With Coronavirus Worked at Chicago Company, Traveled to Ohio in Recent Weeks",2020-01-31 12:47:02,/r/Coronavirus/comments/ewuoja/man_diagnosed_with_coronavirus_worked_at_chicago/
fg4j872,-0.296,0.0,"No word if he took the metra to employer’s downtown Chicago office, nor any other information on places the couple may have visited.","Man Diagnosed With Coronavirus Worked at Chicago Company, Traveled to Ohio in Recent Weeks",2020-01-31 12:47:02,/r/Coronavirus/comments/ewuoja/man_diagnosed_with_coronavirus_worked_at_chicago/
fg4o6dg,-0.5106,0.0,Where a school just shut down for 650 people calling in sick.,"Man Diagnosed With Coronavirus Worked at Chicago Company, Traveled to Ohio in Recent Weeks",2020-01-31 12:47:02,/r/Coronavirus/comments/ewuoja/man_diagnosed_with_coronavirus_worked_at_chicago/
fg5ozqg,0.0,0.0,https://www.google.com/amp/s/detroit.cbslocal.com/2020/01/30/school-district-closes-for-two-days-after-600-students-call-in-sick/amp/,"Man Diagnosed With Coronavirus Worked at Chicago Company, Traveled to Ohio in Recent Weeks",2020-01-31 12:47:02,/r/Coronavirus/comments/ewuoja/man_diagnosed_with_coronavirus_worked_at_chicago/
