Comment ID,Comment_VS,Title_VS,Comment,Title,Publish Date,Permalink
fg54qgw,0.4767,0.0,That’s a relief.,An analysis of the recent paper about HIV proteins found in 2019-nCoV,2020-01-31 16:13:47,/r/Coronavirus/comments/ewxne6/an_analysis_of_the_recent_paper_about_hiv/
fg5636j,0.3774,0.0,Thx--keep posting on Reddit with any more updates please,An analysis of the recent paper about HIV proteins found in 2019-nCoV,2020-01-31 16:13:47,/r/Coronavirus/comments/ewxne6/an_analysis_of_the_recent_paper_about_hiv/
fg56bpv,-0.765,0.0,That shit is heartbreaking.,A Message from someone in need,2020-01-31 16:51:08,/r/Coronavirus/comments/ewy5d4/a_message_from_someone_in_need/
fg5dtnw,-0.1263,0.0,"F to our dude who’s about to get door kicked. Good video though, very sad.",A Message from someone in need,2020-01-31 16:51:08,/r/Coronavirus/comments/ewy5d4/a_message_from_someone_in_need/
fg5l0mz,0.7096,0.0,"Everyone should share this video, he is spitting the truth and is at risk of getting caught by the gov, he wants everyone outside of China to share and getting more attention because the Chinese gov is trying to suppress the truth.",A Message from someone in need,2020-01-31 16:51:08,/r/Coronavirus/comments/ewy5d4/a_message_from_someone_in_need/
fg6syyx,-0.7719,0.0,"If I wasn't going to trust a news Network due to fear mongering it would be the one named ""News Monger""",A Message from someone in need,2020-01-31 16:51:08,/r/Coronavirus/comments/ewy5d4/a_message_from_someone_in_need/
fg566i9,-0.7105,0.1779,"It was disingenuous of them to not recommend travel restrictions. They had to know that once they announced the emergency that countries would impose travel bans. Once countries started having cases spread  without symptoms and without contact of a person who is from China, they would react by shutting this down as much as possible.",I love how everyone basically ignored the WHOs recommendation for no travel restrictions,2020-01-31 17:00:51,/r/Coronavirus/comments/ewy9wv/i_love_how_everyone_basically_ignored_the_whos/
fg56ly1,0.4951,0.1779,They’re too busy playing political games rather than caring for world health. The name “World Health Organisation” is more ironic than representative.,I love how everyone basically ignored the WHOs recommendation for no travel restrictions,2020-01-31 17:00:51,/r/Coronavirus/comments/ewy9wv/i_love_how_everyone_basically_ignored_the_whos/
fg5l4v7,0.8357,0.1779,The best was one group of pilots going on strike to ground all their companies flights. Fucking beautiful piece of work.,I love how everyone basically ignored the WHOs recommendation for no travel restrictions,2020-01-31 17:00:51,/r/Coronavirus/comments/ewy9wv/i_love_how_everyone_basically_ignored_the_whos/
fg56pgz,-0.296,0.1779,I believe the majority of the travel bans started to kick in as soon as we discovered that you can be infectious while being asymptomatic so screening people for fevers became useless and that the safest option is a full restriction,I love how everyone basically ignored the WHOs recommendation for no travel restrictions,2020-01-31 17:00:51,/r/Coronavirus/comments/ewy9wv/i_love_how_everyone_basically_ignored_the_whos/
fg5lpzh,-0.9794,0.1779,"problem with these kind of situations is you'll do wrong whatever you do.*you call for a travel ban trying to anticipate the problem and it's effective.* Result: people will tell nothng happened, there was no need to overreact, next time people will ignore it cause you can't stop the world every time someone has a fever.   *you call for a travel ban, is not effective:* see, you are incompetent, you should have called it sooner.*you don't call for a travel ban, the disease spread:* you should have called for a travel ban.*you don't call for a travel ban and nothing happens, the disease dies out.* Nobody will care.doing the right thing at the right time producing the optimal result is just impossible.",I love how everyone basically ignored the WHOs recommendation for no travel restrictions,2020-01-31 17:00:51,/r/Coronavirus/comments/ewy9wv/i_love_how_everyone_basically_ignored_the_whos/
fg5up7b,0.5859,0.1779,"The WHO director also praised China for how they handled the disease. Madness.This was hard to watch:https://youtu.be/6D-WDcxssEM""I will praise China again and again...""China lied about the virus to wuhan residents at the beginning, saying it wasn't infectious. WHO is all about politics.",I love how everyone basically ignored the WHOs recommendation for no travel restrictions,2020-01-31 17:00:51,/r/Coronavirus/comments/ewy9wv/i_love_how_everyone_basically_ignored_the_whos/
fg5hnf6,-0.9045,0.1779,"Travel bans have pro and cons. If a country not banned china, then they know when a flight/ship come from China.If a country banned china, then people who need to travel may travel to another country first to get to the final destination and may worsen the situation because now they are not monitored.So yeah... Unless every country reject travel  from China its tricky. And tbh to isolate a country as big as China is no easy feat...Just contributing some thoughts here",I love how everyone basically ignored the WHOs recommendation for no travel restrictions,2020-01-31 17:00:51,/r/Coronavirus/comments/ewy9wv/i_love_how_everyone_basically_ignored_the_whos/
fg5lt5f,0.0,0.1779,"Trump administration bombing Baghdad? I’m a liberal, but let’s get real here..",I love how everyone basically ignored the WHOs recommendation for no travel restrictions,2020-01-31 17:00:51,/r/Coronavirus/comments/ewy9wv/i_love_how_everyone_basically_ignored_the_whos/
fg5u7wt,-0.7003,0.1779,"The reason air lines has been shutdown routes to china even prior to the WHO statement is because they cant fill the planes and just use it as a bad excuse.  Naive to think they are doing it to safe the world contrary to WHO or government statements, or it should be some big conspiracy where ""they are in the know"" and are working together with ""New World Order"".Its simply business/money",I love how everyone basically ignored the WHOs recommendation for no travel restrictions,2020-01-31 17:00:51,/r/Coronavirus/comments/ewy9wv/i_love_how_everyone_basically_ignored_the_whos/
fg5ub0v,-0.0523,0.1779,"it's a hard question  how to prevent infection without create panic,  panic that will cause far more damage than the virus itself",I love how everyone basically ignored the WHOs recommendation for no travel restrictions,2020-01-31 17:00:51,/r/Coronavirus/comments/ewy9wv/i_love_how_everyone_basically_ignored_the_whos/
fg5waip,-0.8911,0.1779,"Other than Carrie Lam and her utterly useless administration here in Hong Kong. She even specifically cherrypicked that WHO didnt issue recommend restrictions, and their disgusting praises of China as excuses not to close the border, despite hundreds of cases just in direct neighbour Shenzhen alone. Hong Kong is fucked",I love how everyone basically ignored the WHOs recommendation for no travel restrictions,2020-01-31 17:00:51,/r/Coronavirus/comments/ewy9wv/i_love_how_everyone_basically_ignored_the_whos/
fg5yi1f,0.0,0.1779,"I guess because the WHO already know there woule be lackluster response anyway, since they're all controlled by the same group of people",I love how everyone basically ignored the WHOs recommendation for no travel restrictions,2020-01-31 17:00:51,/r/Coronavirus/comments/ewy9wv/i_love_how_everyone_basically_ignored_the_whos/
fg64jro,0.504,0.1779,WHO are they that we should follow their recommendations?  Do they have a good record?,I love how everyone basically ignored the WHOs recommendation for no travel restrictions,2020-01-31 17:00:51,/r/Coronavirus/comments/ewy9wv/i_love_how_everyone_basically_ignored_the_whos/
fg6qw2c,-0.4078,0.1779,Many flights to China are being suspended because just because there is no demand.,I love how everyone basically ignored the WHOs recommendation for no travel restrictions,2020-01-31 17:00:51,/r/Coronavirus/comments/ewy9wv/i_love_how_everyone_basically_ignored_the_whos/
fg5omn4,0.719,0.1779,i love how much everyone in the whole world loves to travel in airplanes all the goshdarned time. i live under a flight path so ive come to really dislike air travel of all kinds in every way possible >\_\_<,I love how everyone basically ignored the WHOs recommendation for no travel restrictions,2020-01-31 17:00:51,/r/Coronavirus/comments/ewy9wv/i_love_how_everyone_basically_ignored_the_whos/
fg5ybhs,0.0,0.1779,Private multinational companies are also “limiting” business trips to China. And so it should be.,I love how everyone basically ignored the WHOs recommendation for no travel restrictions,2020-01-31 17:00:51,/r/Coronavirus/comments/ewy9wv/i_love_how_everyone_basically_ignored_the_whos/
fg655ul,-0.3612,0.1779,"I suppose it comes down to the WHO's focus on health and it's risks / consequences.Government have to worry not only about health, but also economic (the direct impact and on consumer sentiment), the will of the population....etc",I love how everyone basically ignored the WHOs recommendation for no travel restrictions,2020-01-31 17:00:51,/r/Coronavirus/comments/ewy9wv/i_love_how_everyone_basically_ignored_the_whos/
fg6q2vi,0.5563,0.1779,"The general safety of a nation is more important than bringing a small number of people who are in the affected area back, into the country",I love how everyone basically ignored the WHOs recommendation for no travel restrictions,2020-01-31 17:00:51,/r/Coronavirus/comments/ewy9wv/i_love_how_everyone_basically_ignored_the_whos/
fg6qfkm,-0.9339,0.1779,"I hate how Japan is doing exactly that and no can nor controls =|The funny thing is, the very first country to ignore WHO directive is China. As they quarantine cities and blocked people from leaving it traveling.According to WHO:> The Committee does not recommend any travel or trade restriction based on the current information available.",I love how everyone basically ignored the WHOs recommendation for no travel restrictions,2020-01-31 17:00:51,/r/Coronavirus/comments/ewy9wv/i_love_how_everyone_basically_ignored_the_whos/
fg5wrgg,-0.928,0.1779,"it's always conveniently ""too late"".... Doesn't matter what nation either..This shit is weaponized IMO, It can species hop now apparently, can live up to 5 days outside of a host, has a 1 - 14 day incubation, it's loose in the wild and it can kill you, that's basically all you really need to know about it, Oh there is no vaccine yet but I'm sure that too will come magically too late after it mutates and become resistant..Downplay it so you don't create a panic - Censor news, script it to make the flu sound worse, hire plants to make posts in social media to down play it or down vote a comment that makes sense, report posts and videos to have them removes, etc.. it's all from the Government cold war tactics for dummies handbook series - ""How to Cover Up X for Dummies"" and we are the dummies for believing the ""official"" run of crap..Population control people.. The wing nuts like Alex Jones have been saying it for years and we laughed at them but some of us did get prompted to prepare for a general range of crisis across the board whether they happen or not, it's always a good idea to be safe than sorry. It's still not too late either but that clock is ticking down.. It may not kill everyone, only the old and sickly but still, it can kill  and it's does not care what your agenda is either.. Not trying to fear monger or issue a tin foil hat but it's pretty obvious at whats going on if you read the stories and between the lines. .. But what do I know, I only lived through the last decade of the cold war..",I love how everyone basically ignored the WHOs recommendation for no travel restrictions,2020-01-31 17:00:51,/r/Coronavirus/comments/ewy9wv/i_love_how_everyone_basically_ignored_the_whos/
fg59830,-0.7579,-0.3818,"What gets me is they say ""public health emergency"" and then stress it poses a low risk.You are sending mixed signals, here bro.","The US now has declared ""public health emergency""",2020-01-31 17:21:59,/r/Coronavirus/comments/ewyjth/the_us_now_has_declared_public_health_emergency/
fg585sp,0.0,-0.3818,PR?,"The US now has declared ""public health emergency""",2020-01-31 17:21:59,/r/Coronavirus/comments/ewyjth/the_us_now_has_declared_public_health_emergency/
fg57qcv,0.0,-0.3818,source.,"The US now has declared ""public health emergency""",2020-01-31 17:21:59,/r/Coronavirus/comments/ewyjth/the_us_now_has_declared_public_health_emergency/
fg57nxo,-0.6369,-0.3818,Is the flu a public health emergency in America?,"The US now has declared ""public health emergency""",2020-01-31 17:21:59,/r/Coronavirus/comments/ewyjth/the_us_now_has_declared_public_health_emergency/
fg5d91w,-0.3612,-0.3818,"In this case they have to declare a PHE to enact the travel ban. That's really the only reason they're doing it for now. We haven't seen sustained transmission here yet, which is surprising given the fact that you can transmit it asymptomatically.","The US now has declared ""public health emergency""",2020-01-31 17:21:59,/r/Coronavirus/comments/ewyjth/the_us_now_has_declared_public_health_emergency/
fg5fmh4,0.5577,-0.3818,"Meaning : be aware, be prepared, do not panic.","The US now has declared ""public health emergency""",2020-01-31 17:21:59,/r/Coronavirus/comments/ewyjth/the_us_now_has_declared_public_health_emergency/
fg587xe,0.0,-0.3818,Permanent Resident!,"The US now has declared ""public health emergency""",2020-01-31 17:21:59,/r/Coronavirus/comments/ewyjth/the_us_now_has_declared_public_health_emergency/
fg58bsh,0.0,-0.3818,https://www.google.com/amp/s/www.hhs.gov/about/news/2020/01/31/secretary-azar-declares-public-health-emergency-us-2019-novel-coronavirus.html%3famphttps://www.google.com/amp/s/amp.usatoday.com/amp/4625299002https://www.google.com/amp/s/amp.cnn.com/cnn/2020/01/31/health/us-coronavirus-friday/index.htmlhttps://www.google.com/amp/s/abcnews.go.com/amp/Health/delta-suspends-us-flights-china-amid-coronavirus/story%3fid=68666037https://www.google.com/amp/s/www.cbsnews.com/amp/live-updates/coronavirus-outbreak-china-evacuations-wuhan-death-toll-today-flights-us-cases-2020-01-31/,"The US now has declared ""public health emergency""",2020-01-31 17:21:59,/r/Coronavirus/comments/ewyjth/the_us_now_has_declared_public_health_emergency/
fg58eg0,-0.25,-0.3818,"No, though it’s been a lot ‘stronger’ (for the lack of better word) this flu season.","The US now has declared ""public health emergency""",2020-01-31 17:21:59,/r/Coronavirus/comments/ewyjth/the_us_now_has_declared_public_health_emergency/
fg5b6ga,0.0,-0.3818,Not even the type 2 diabetes is a PHE in the US. 🤷,"The US now has declared ""public health emergency""",2020-01-31 17:21:59,/r/Coronavirus/comments/ewyjth/the_us_now_has_declared_public_health_emergency/
fg5gs9a,0.0665,-0.3818,"Yes, that means it is a problem and then say No, it's not a real problem.  Like the fuck, bro.","The US now has declared ""public health emergency""",2020-01-31 17:21:59,/r/Coronavirus/comments/ewyjth/the_us_now_has_declared_public_health_emergency/
fg5a8bo,-0.3818,-0.3818,You goofus.I'm talking about our government literally declaring this a public health emergency.,"The US now has declared ""public health emergency""",2020-01-31 17:21:59,/r/Coronavirus/comments/ewyjth/the_us_now_has_declared_public_health_emergency/
fg59esz,0.3612,-0.3818,Thank you.,"The US now has declared ""public health emergency""",2020-01-31 17:21:59,/r/Coronavirus/comments/ewyjth/the_us_now_has_declared_public_health_emergency/
fg58dgx,0.8012,0.0,"That trajectory though couldn’t be steeper without going backwards, and with underreported cases. Awesome charts in this article!  I especially like the one on contagiousness compared to influenza.",Look at this NY Times chart,2020-01-31 17:23:20,/r/Coronavirus/comments/ewykft/look_at_this_ny_times_chart/
fg59cxq,-0.6523,0.0,HO LEE SHIT. The WHO kept this under wraps?,Look at this NY Times chart,2020-01-31 17:23:20,/r/Coronavirus/comments/ewykft/look_at_this_ny_times_chart/
fg57zjs,0.0,0.0,I don’t understand how Ebola has similar contagiousness,Look at this NY Times chart,2020-01-31 17:23:20,/r/Coronavirus/comments/ewykft/look_at_this_ny_times_chart/
fg5b5tw,-0.2411,0.0,"First cases were in Dec 13th, folks.  I am not sure why we don't understand this.",Look at this NY Times chart,2020-01-31 17:23:20,/r/Coronavirus/comments/ewykft/look_at_this_ny_times_chart/
fgoi2ls,-0.2263,0.0,"Yup. I wonder how steep the SARS line would look if if it were limited to just it's first 30-40 days, as the 2019-nCoV line is?",Look at this NY Times chart,2020-01-31 17:23:20,/r/Coronavirus/comments/ewykft/look_at_this_ny_times_chart/
fg5avbt,0.296,0.0,"Yep, first case started almost eight weeks ago",Look at this NY Times chart,2020-01-31 17:23:20,/r/Coronavirus/comments/ewykft/look_at_this_ny_times_chart/
fg5j26y,-0.5859,0.0,Ebola is only contagious when you have symptoms.  This new virus is contagious when you don’t have symptoms (according to what we now know).  Which makes it harder to contain.,Look at this NY Times chart,2020-01-31 17:23:20,/r/Coronavirus/comments/ewykft/look_at_this_ny_times_chart/
fg5bbwc,0.0,0.0,[deleted],Look at this NY Times chart,2020-01-31 17:23:20,/r/Coronavirus/comments/ewykft/look_at_this_ny_times_chart/
fg63dvr,0.0,0.0,I’ve seen Dec. 1st was earliest documented,Look at this NY Times chart,2020-01-31 17:23:20,/r/Coronavirus/comments/ewykft/look_at_this_ny_times_chart/
fg5btv5,-0.3875,0.0,why doesn't anyone care about this?,Look at this NY Times chart,2020-01-31 17:23:20,/r/Coronavirus/comments/ewykft/look_at_this_ny_times_chart/
fg6f121,-0.6752,0.0,I know.  But on the chart it says they are similar so that seems wrong.,Look at this NY Times chart,2020-01-31 17:23:20,/r/Coronavirus/comments/ewykft/look_at_this_ny_times_chart/
fg5c99h,0.6597,0.0,"That would have been like 2 weeks later and then China lock down happened.Frankly in terms of infection issues, knowing it was Dec 13 this started popping up and was moving around undetected, is vitally important.",Look at this NY Times chart,2020-01-31 17:23:20,/r/Coronavirus/comments/ewykft/look_at_this_ny_times_chart/
fg63qht,-0.4939,0.0,That's a scary thought..Do we have confirmed source on that?,Look at this NY Times chart,2020-01-31 17:23:20,/r/Coronavirus/comments/ewykft/look_at_this_ny_times_chart/
fgcpqq0,-0.34,0.0,Contagiousness and when you are contagious are different things.,Look at this NY Times chart,2020-01-31 17:23:20,/r/Coronavirus/comments/ewykft/look_at_this_ny_times_chart/
fgcag05,-0.2144,0.0,"I believe it was reputable.. if I come across it again I’ll link it. Could be a good thing though, if it’s been spreading around longer, then it may be far less infectious than it appears. But also it could be all over the world by now, in tons of cities, hiding 🥴",Look at this NY Times chart,2020-01-31 17:23:20,/r/Coronavirus/comments/ewykft/look_at_this_ny_times_chart/
fgctynw,0.0,0.0,Which does the chart show ?,Look at this NY Times chart,2020-01-31 17:23:20,/r/Coronavirus/comments/ewykft/look_at_this_ny_times_chart/
fgcd0zw,0.3231,0.0,"Oh, it's definitely hiding around.Whether it has over taken us all or not, is another matter.It really does not surprise me anymore that new case after new case keep popping up.  That's going to continue to happen until we effectively contain it.",Look at this NY Times chart,2020-01-31 17:23:20,/r/Coronavirus/comments/ewykft/look_at_this_ny_times_chart/
fgfvjbm,0.0,0.0,Contagiousness,Look at this NY Times chart,2020-01-31 17:23:20,/r/Coronavirus/comments/ewykft/look_at_this_ny_times_chart/
fg5cw7r,-0.7717,0.6369,"What a scummy company. You should be permanently branded as the company trying to take advantage of an international health crisis to sell some crappy software. Way to go, guys.",Company Offers Solution To Containing The Coronavirus: Make Working From Home Easy For Everyone,2020-01-31 18:12:40,/r/Coronavirus/comments/ewz6lb/company_offers_solution_to_containing_the/
fg5c6qp,0.7067,0.6369,Perfect!!! I'll tell the nurses and doctors in Wuhan!!!!,Company Offers Solution To Containing The Coronavirus: Make Working From Home Easy For Everyone,2020-01-31 18:12:40,/r/Coronavirus/comments/ewz6lb/company_offers_solution_to_containing_the/
fg5kpyi,-0.4588,0.6369,"I ask my boss to work from home today. She said that since i have my new title since less then 6 months , the policy dictate that i can't. I told her, ok I'm find with that, and told her that anyway she'll  probably ask me to work from home soon I was only tring to prepare for what is coming. She didn't understood. Some companies are just doomed.",Company Offers Solution To Containing The Coronavirus: Make Working From Home Easy For Everyone,2020-01-31 18:12:40,/r/Coronavirus/comments/ewz6lb/company_offers_solution_to_containing_the/
fg6hp8r,0.4939,0.6369,"This doesn't work for manual labor jobs, equipment operators, health care workers, etc.",Company Offers Solution To Containing The Coronavirus: Make Working From Home Easy For Everyone,2020-01-31 18:12:40,/r/Coronavirus/comments/ewz6lb/company_offers_solution_to_containing_the/
fg5ejjn,0.5204,-0.3182,This may be of interest:  [https://www.youtube.com/watch?v=L9Di-UVC-\_4](https://www.youtube.com/watch?v=L9Di-UVC-_4),Does anyone else find it odd that China's only BSL-4 lab's location on Google Maps was altered within the previous few days?,2020-01-31 18:28:51,/r/Coronavirus/comments/ewzdmd/does_anyone_else_find_it_odd_that_chinas_only/
fg5efc5,0.9081,-0.3182,"Yes, I saw that. The original article was on [medium.com](https://medium.com) (wish I would have noted the original author). I'm curious as well - I'll see if I can find it in my internet history.",Does anyone else find it odd that China's only BSL-4 lab's location on Google Maps was altered within the previous few days?,2020-01-31 18:28:51,/r/Coronavirus/comments/ewzdmd/does_anyone_else_find_it_odd_that_chinas_only/
fg5hesi,0.0,-0.3182,Juicy,Does anyone else find it odd that China's only BSL-4 lab's location on Google Maps was altered within the previous few days?,2020-01-31 18:28:51,/r/Coronavirus/comments/ewzdmd/does_anyone_else_find_it_odd_that_chinas_only/
fg6154o,-0.5334,-0.3182,Zoom into the spot on google map and you can still find the building and label listed. The map search just isn't giving a good result now. This is as of 2/1/2020 3 am central standard time.,Does anyone else find it odd that China's only BSL-4 lab's location on Google Maps was altered within the previous few days?,2020-01-31 18:28:51,/r/Coronavirus/comments/ewzdmd/does_anyone_else_find_it_odd_that_chinas_only/
fg5suc8,-0.296,-0.3182,"Is Hong Kong considered China in this conversation? Because we were in HK last year and had no issues with google maps, depended on it and was never let down.",Does anyone else find it odd that China's only BSL-4 lab's location on Google Maps was altered within the previous few days?,2020-01-31 18:28:51,/r/Coronavirus/comments/ewzdmd/does_anyone_else_find_it_odd_that_chinas_only/
fg5dpdo,0.6486,-0.3182,"Yeah, it seems suspicious, but I wouldn’t start believing this was man made or anything like that until there’s significant evidence",Does anyone else find it odd that China's only BSL-4 lab's location on Google Maps was altered within the previous few days?,2020-01-31 18:28:51,/r/Coronavirus/comments/ewzdmd/does_anyone_else_find_it_odd_that_chinas_only/
fg5pksd,0.204,-0.3182,"http://english.whiov.cas.cn/News/Events/201502/t20150203_135923.htmlTheir website is still up though, which is a little surprising.",Does anyone else find it odd that China's only BSL-4 lab's location on Google Maps was altered within the previous few days?,2020-01-31 18:28:51,/r/Coronavirus/comments/ewzdmd/does_anyone_else_find_it_odd_that_chinas_only/
fg68wd8,0.0,-0.3182,There's a BSL 3 university close by the 4,Does anyone else find it odd that China's only BSL-4 lab's location on Google Maps was altered within the previous few days?,2020-01-31 18:28:51,/r/Coronavirus/comments/ewzdmd/does_anyone_else_find_it_odd_that_chinas_only/
fhaqy9e,-0.5893,-0.3182,"If I'd caused all this trouble, I'd go hide in the woods too 😉",Does anyone else find it odd that China's only BSL-4 lab's location on Google Maps was altered within the previous few days?,2020-01-31 18:28:51,/r/Coronavirus/comments/ewzdmd/does_anyone_else_find_it_odd_that_chinas_only/
fg5dvrp,0.0,-0.3182,Whaaaaat????,Does anyone else find it odd that China's only BSL-4 lab's location on Google Maps was altered within the previous few days?,2020-01-31 18:28:51,/r/Coronavirus/comments/ewzdmd/does_anyone_else_find_it_odd_that_chinas_only/
fg5f9pi,0.0,-0.3182,This.,Does anyone else find it odd that China's only BSL-4 lab's location on Google Maps was altered within the previous few days?,2020-01-31 18:28:51,/r/Coronavirus/comments/ewzdmd/does_anyone_else_find_it_odd_that_chinas_only/
fg5j7zn,-0.5574,-0.3182,"Holy shit, that makes sense actually.  Can’t get cruise missiled if ppl don’t know where things are.",Does anyone else find it odd that China's only BSL-4 lab's location on Google Maps was altered within the previous few days?,2020-01-31 18:28:51,/r/Coronavirus/comments/ewzdmd/does_anyone_else_find_it_odd_that_chinas_only/
