Comment ID,Comment_VS,Title_VS,Comment,Title,Publish Date,Permalink
fg30h2c,0.4336,0.0,Seemed fishy to me too. My impression is that China was being difficult with sharing info with the WHO so now theyre kissing ass for better access. They hinted that there were still statistics they wanted that they didnt have.  If they piss off China they will get nothing.,Something fishy is going on!,2020-01-31 00:08:06,/r/Coronavirus/comments/ewl790/something_fishy_is_going_on/
fg2wmia,0.7783,0.0,"As others have said, money. If you close flights down to save lifes, business slow down, and the filthy rich get less money. They cant have that.",Something fishy is going on!,2020-01-31 00:08:06,/r/Coronavirus/comments/ewl790/something_fishy_is_going_on/
fg2w66b,0.0,0.0,"Go to work, make money, spend that money so that I can make money.That's all it is, bro.  Just the sniffles bro.  Go make that money.IDIOTS.",Something fishy is going on!,2020-01-31 00:08:06,/r/Coronavirus/comments/ewl790/something_fishy_is_going_on/
fg2xfht,0.2293,0.0,"2 reasons. Social chaos can cause more damage then the virus itself, so while they need to send a strong alert message they should be careful to not make things worse by creating public panic. Second it is absolutely true China is way more powerful and prepared to deal with this situation then other countries, and I mean other developed countries... The outbreak really went out of control in Wuhan but they are trying to take it back, it might work. Not sure any other country would be able to handle it.",Something fishy is going on!,2020-01-31 00:08:06,/r/Coronavirus/comments/ewl790/something_fishy_is_going_on/
fg38wi5,-0.7184,0.0,"Government policies being set by the health of executive stock profiles is why this will be a global pandemic. Interesting coincidences this week, with an acclaimed Harvard scientist arrested and accused of lying about ties to Wuhan's level 4 bioweapons lab, the only one in China. https://www.npr.org/2020/01/28/800442646/acclaimed-harvard-scientist-is-arrested-accused-of-lying-about-ties-to-china",Something fishy is going on!,2020-01-31 00:08:06,/r/Coronavirus/comments/ewl790/something_fishy_is_going_on/
fg2xkef,0.5988,0.0,Because the are hanging out the back of China who have vast amounts of money in big pharma. And WHO works for big Pharma not our interests. Is a few bucks worth lives ?  Yes lots of them. As long as it doesn’t get their workforce. Make no mistake.,Something fishy is going on!,2020-01-31 00:08:06,/r/Coronavirus/comments/ewl790/something_fishy_is_going_on/
fg2w3jn,0.0,0.0,Shhh. Let them get their paycheques first Shhh.,Something fishy is going on!,2020-01-31 00:08:06,/r/Coronavirus/comments/ewl790/something_fishy_is_going_on/
fg33kj9,0.0,0.0,Event 201: [https://www.youtube.com/watch?v=AoLw-Q8X174](https://www.youtube.com/watch?v=AoLw-Q8X174)&#x200B;Anything seem fishy now?,Something fishy is going on!,2020-01-31 00:08:06,/r/Coronavirus/comments/ewl790/something_fishy_is_going_on/
fg3ih4m,-0.4445,0.0,This is nothing new. WHO has historically tiptoed around China. It was predicted. WHO has no real authority in any country. None zip zeroThey are invited guests in every country they are in. They can and have been asked to leave countries in the past. No country is required to cooperate with themChina has a history with WHO of hiding needed information during past outbreaks or close calls. WHO is treading lightly and ass kissing China to get information. They have decided some information is better than nothing,Something fishy is going on!,2020-01-31 00:08:06,/r/Coronavirus/comments/ewl790/something_fishy_is_going_on/
fg3qhdg,0.765,0.0,Might be worth the mention that the WHO general-director who praised “China’s efforts” is also an Ethiopian politician. Ethiopia has taken in something like 12 billion dollars from the Chinese govt and they’re in the red for 29 billion ....,Something fishy is going on!,2020-01-31 00:08:06,/r/Coronavirus/comments/ewl790/something_fishy_is_going_on/
fk5e3d6,-0.6496,0.0,"To add into the fish pile, The fact that South by Southwest was canceled in Austin by the Democratic mayor. But UT classes were not cancelled. Other major concert events were not cancelled. International flights continue to arrive in Austin. And basically any other large gatherings are still going on here, it's ONLY South by Southwest, the one event guaranteed to make international headlines, as well as majorly affect the local and state economy that's cancelled. Very strange. And absolutely no explanation from the mayor their office has gone quiet, not making any comments, not answering any questions, ever since the announcement to cancel. This silence persists despite everybody in town being like ""what the fuck"". Basically, the people who count on that money feel robbed of important income which will very soon impact the national economy.",Something fishy is going on!,2020-01-31 00:08:06,/r/Coronavirus/comments/ewl790/something_fishy_is_going_on/
flg2lbe,-0.8439,0.0,Thank God I'm not the only one - there is something going on and everyone is Hoodwinked I was starting to feel I was going mad - the government is lying - it's a big Lie - where I live they were shutting roads off in a very obstructive from November and I sensed something was up then - feels like a takeover - the Scarry thing is that everyone is believing it like it's done kind of mass hypnosis through the use of sky and all the media it isn't real - the British government are lying to the public and restricting civil liberties and freedom.Its connected to China maybe Russia and they are going something very sinister - It is good to know that I'm not the only one who can see it is a mass deception. If anyone dies probably from terror when they see what is going on.its a combination of the book 1984-the Lord of the Rings- the Lion the witch and the wardrobe - personally I'm beginning to think it's witchcraft plus Freemasonry - the two are the same - Freemasonry is a satanic cult - a Roman Catholic who becomes or is a Freemason is excommunicated - this man doesn't even believe in God -,Something fishy is going on!,2020-01-31 00:08:06,/r/Coronavirus/comments/ewl790/something_fishy_is_going_on/
fg2w1qj,0.0,0.0,SSHHHH,Something fishy is going on!,2020-01-31 00:08:06,/r/Coronavirus/comments/ewl790/something_fishy_is_going_on/
fg3imp8,-0.6908,0.0,Bingo. WHO and China have a rocky past. WHO has missed China ass for at least a decade and a half,Something fishy is going on!,2020-01-31 00:08:06,/r/Coronavirus/comments/ewl790/something_fishy_is_going_on/
fg35rde,0.0,0.0,what?,Something fishy is going on!,2020-01-31 00:08:06,/r/Coronavirus/comments/ewl790/something_fishy_is_going_on/
fg3iwqg,-0.836,0.0,WHO doesn't work for big pharma. Our Senators and Congress do. They have been bought and paid for. WHO has no real power or authority. They are toothless and mostly useless. Big pharma spent need to waste money buying them.,Something fishy is going on!,2020-01-31 00:08:06,/r/Coronavirus/comments/ewl790/something_fishy_is_going_on/
fg34a4w,0.0,0.0,[deleted],Something fishy is going on!,2020-01-31 00:08:06,/r/Coronavirus/comments/ewl790/something_fishy_is_going_on/
fg35tkf,-0.1134,0.0,It's mocking people who keep saying this isn't a problem.,Something fishy is going on!,2020-01-31 00:08:06,/r/Coronavirus/comments/ewl790/something_fishy_is_going_on/
fg34fvb,0.0735,0.0,> https://youtu.be/TsyujjitOFMYeah no kidding. This shit seems to be connected in some way. I am in NO WAY a conspiracy theorist but this seems tantamount to drawing a roadmap for this ensuing pandemic. And the level of happiness they each express during that show is utterly creepy.,Something fishy is going on!,2020-01-31 00:08:06,/r/Coronavirus/comments/ewl790/something_fishy_is_going_on/
fg3dqn8,0.6124,0.0,Ok I think I finally read it how you intended it to be read lol,Something fishy is going on!,2020-01-31 00:08:06,/r/Coronavirus/comments/ewl790/something_fishy_is_going_on/
fg2zo6i,0.7926,0.0,"It's true, Germany isn't prepared for a greater outbreak, our hospitals are already overwhelmed with the seasonal flu.My friend who also is a nurse has not even received any instructions yet. Coronavirus is not treated as a thread at all, an outbreak is not even discussed as a possibility by medical staff (at least where he works).",Talked to a doctor 5 minutes ago /Germany/Nuremberg,2020-01-31 01:06:14,/r/Coronavirus/comments/ewlq5s/talked_to_a_doctor_5_minutes_ago_germanynuremberg/
fg3019l,0.4963,0.0,This is sort of like fan fiction now,Talked to a doctor 5 minutes ago /Germany/Nuremberg,2020-01-31 01:06:14,/r/Coronavirus/comments/ewlq5s/talked_to_a_doctor_5_minutes_ago_germanynuremberg/
fg2zziw,0.0,0.0,Schreib deinen Reddit Namen auf ein Blatt Papier halt es so das man erkennt das du auf der Arbeit bist und poste es hier rein (du musst ja kein Gesicht oder Namen zeigen),Talked to a doctor 5 minutes ago /Germany/Nuremberg,2020-01-31 01:06:14,/r/Coronavirus/comments/ewlq5s/talked_to_a_doctor_5_minutes_ago_germanynuremberg/
fg31q8e,-0.1388,0.0,"If this is true I don't know, but in your comment history I see u posted a year ago, u work in healthcare.. so that's legit.What u are saying I'm not sure.",Talked to a doctor 5 minutes ago /Germany/Nuremberg,2020-01-31 01:06:14,/r/Coronavirus/comments/ewlq5s/talked_to_a_doctor_5_minutes_ago_germanynuremberg/
fg2yz67,-0.343,0.0,"No proof, no sources be careful, don't trust someone who tells whatever he/she wants.",Talked to a doctor 5 minutes ago /Germany/Nuremberg,2020-01-31 01:06:14,/r/Coronavirus/comments/ewlq5s/talked_to_a_doctor_5_minutes_ago_germanynuremberg/
fg3fqxi,0.2263,0.0,"We(Germany) are already lacking medical personnel, why do People actually believe that we are prepared? I don't.",Talked to a doctor 5 minutes ago /Germany/Nuremberg,2020-01-31 01:06:14,/r/Coronavirus/comments/ewlq5s/talked_to_a_doctor_5_minutes_ago_germanynuremberg/
fg2yvxv,0.0,0.0,do you have any proof you are a german nurse?,Talked to a doctor 5 minutes ago /Germany/Nuremberg,2020-01-31 01:06:14,/r/Coronavirus/comments/ewlq5s/talked_to_a_doctor_5_minutes_ago_germanynuremberg/
fg31y2i,0.8462,0.0,"I mean, it's 50/50 fake, but you might as well keep us updated. It's better to have some info that ""might"" be true than to not have at all.",Talked to a doctor 5 minutes ago /Germany/Nuremberg,2020-01-31 01:06:14,/r/Coronavirus/comments/ewlq5s/talked_to_a_doctor_5_minutes_ago_germanynuremberg/
fg3gt1h,0.0772,0.0,No country is ready for this kind of possible surge.,Talked to a doctor 5 minutes ago /Germany/Nuremberg,2020-01-31 01:06:14,/r/Coronavirus/comments/ewlq5s/talked_to_a_doctor_5_minutes_ago_germanynuremberg/
fg3i3u3,0.3919,0.0,"I know a lot of users are sceptical, but read OPs post history. She claimed a year ago she's a medical worker, and her German is native. Sounds like the real deal.",Talked to a doctor 5 minutes ago /Germany/Nuremberg,2020-01-31 01:06:14,/r/Coronavirus/comments/ewlq5s/talked_to_a_doctor_5_minutes_ago_germanynuremberg/
fg3adh6,-0.4939,0.0,I also have a German doctor contact who knows the doctor you're speaking of. He mentioned one doctor who always overreacts and I think I know exactly who he's talking about. Just outside of nuremburg right?Haha what a small world.,Talked to a doctor 5 minutes ago /Germany/Nuremberg,2020-01-31 01:06:14,/r/Coronavirus/comments/ewlq5s/talked_to_a_doctor_5_minutes_ago_germanynuremberg/
fg3blt5,0.5575,0.0,"I believe it. I'm not an idiot. If anyone has seen the endless accounts from china that all corroborate each other, all accounts just like this, euphemistically they are 'unverified' HOWEVER when you add 100s of them together that each corroborate different parts of the others you see, Wuhan is a disaster zone, the poor people are slow to realise it because they are staying at home, or going to grocery store.  &#x200B;These types of accounts are valuable for people who aren't retards, because you take it with salt, but then when you see another account or report from somewhere else that corroborates a part of it, then you say 'huh, that's interesting' and as things pile up you know a lot more than everyone else all while they shout 'unverified, unverified'.",Talked to a doctor 5 minutes ago /Germany/Nuremberg,2020-01-31 01:06:14,/r/Coronavirus/comments/ewlq5s/talked_to_a_doctor_5_minutes_ago_germanynuremberg/
fg3f36i,0.6369,0.0,\>  Going to hospital is like jumping into a shredder That's reassuring.,Talked to a doctor 5 minutes ago /Germany/Nuremberg,2020-01-31 01:06:14,/r/Coronavirus/comments/ewlq5s/talked_to_a_doctor_5_minutes_ago_germanynuremberg/
fg3fuex,-0.9667,0.0,"I'm not here to say whether this is a reliable source or not, but I absolutely hate it when governments saying they are ""well-prepared"" for this pandemic.Living here in Australia, a few days after the news broke out, we still had flights coming from Wuhan to Melbourne and Sydney. And boom, we got our first, second, and now 9th case. An infected person even boarded a plane to from Melb to Gold Coast! And as always, ""we are well-prepared"".We have been and are still two or three steps behind. We are still learning it via its symptoms, travel paths of those infected. Just as everyone said, this virus is new and unpredictable. We only starting to know that there is an incubation time for the symptoms start to show, then how do we know we are well-prepared???",Talked to a doctor 5 minutes ago /Germany/Nuremberg,2020-01-31 01:06:14,/r/Coronavirus/comments/ewlq5s/talked_to_a_doctor_5_minutes_ago_germanynuremberg/
fg3oaf2,0.3612,0.0,One old guy is scared and doesn’t want to go to work. Great story,Talked to a doctor 5 minutes ago /Germany/Nuremberg,2020-01-31 01:06:14,/r/Coronavirus/comments/ewlq5s/talked_to_a_doctor_5_minutes_ago_germanynuremberg/
fg3v5b7,-0.5423,0.0,Shut the fuck up sausage muncher,Talked to a doctor 5 minutes ago /Germany/Nuremberg,2020-01-31 01:06:14,/r/Coronavirus/comments/ewlq5s/talked_to_a_doctor_5_minutes_ago_germanynuremberg/
fg3zlug,0.5423,0.0,Thanks for this. Be careful.,Talked to a doctor 5 minutes ago /Germany/Nuremberg,2020-01-31 01:06:14,/r/Coronavirus/comments/ewlq5s/talked_to_a_doctor_5_minutes_ago_germanynuremberg/
fg45wzn,-0.866,0.0,"Who cares if this is from a doctor, nurse or donald duck. This is common sense, no society is ready / built for the worst case scenario.  Buy simple essentials and be prepared for the worst case - this prepping is the same if you are in a hurricane / earthquake or any other regular disaster area.  If there isnt a worst case scenario, you'll have plenty of canned food and bottled war to eat over the year.",Talked to a doctor 5 minutes ago /Germany/Nuremberg,2020-01-31 01:06:14,/r/Coronavirus/comments/ewlq5s/talked_to_a_doctor_5_minutes_ago_germanynuremberg/
fg4eclr,-0.296,0.0,"I went to see my doctor (M.D.) on Wednesday and asked him about it (U.S).  He said everything is overblown, and he sees some variant of coronaVirus every week, and that he isn’t worried in the slightest. Just FWIW.",Talked to a doctor 5 minutes ago /Germany/Nuremberg,2020-01-31 01:06:14,/r/Coronavirus/comments/ewlq5s/talked_to_a_doctor_5_minutes_ago_germanynuremberg/
fg30fng,0.3804,0.0,I am really curious what will happen to this flash community when the disease fizzles out in a few weeks.,Talked to a doctor 5 minutes ago /Germany/Nuremberg,2020-01-31 01:06:14,/r/Coronavirus/comments/ewlq5s/talked_to_a_doctor_5_minutes_ago_germanynuremberg/
fg2zjwl,0.8221,-0.2732,"Twitter is generally an unreliable source. If possible, please re-submit with a link to a reliable source or the direct article.Note that you may also resubmit as a text post, just add a link and some explanatory text. Thank you for helping us keep information in /r/Conoravirus reliable!*I am a bot, and this action was performed automatically. Please [contact the moderators of this subreddit](/message/compose/?to=/r/Coronavirus) if you have any questions or concerns.*","Australian University delays semester start, postpones exams due to coronavirus.",2020-01-31 01:32:34,/r/Coronavirus/comments/ewlzgo/australian_university_delays_semester_start/
fg35oyu,-0.2023,-0.2732,"I have exam next week Friday, will my exam be also postponed?","Australian University delays semester start, postpones exams due to coronavirus.",2020-01-31 01:32:34,/r/Coronavirus/comments/ewlzgo/australian_university_delays_semester_start/
fg33arq,0.0,-0.2732,About frickin' time.,"Australian University delays semester start, postpones exams due to coronavirus.",2020-01-31 01:32:34,/r/Coronavirus/comments/ewlzgo/australian_university_delays_semester_start/
fg38kyv,-0.4173,-0.2732,"I can confirm, this is legit, I attend, it's only a few weeks though so I doubt it would really do anything","Australian University delays semester start, postpones exams due to coronavirus.",2020-01-31 01:32:34,/r/Coronavirus/comments/ewlzgo/australian_university_delays_semester_start/
fg39vth,0.0,-0.2732,Here is a picture of the announcement:https://ibb.co/PNfCjCK,"Australian University delays semester start, postpones exams due to coronavirus.",2020-01-31 01:32:34,/r/Coronavirus/comments/ewlzgo/australian_university_delays_semester_start/
fg30uca,0.0,0.0,"I’m throwing a buffet in London for 40,000 people if anyone wants to come ?",First coronavirus cases confirmed in UK,2020-01-31 01:34:18,/r/Coronavirus/comments/ewm028/first_coronavirus_cases_confirmed_in_uk/
fg2zugo,0.2589,0.0,"Wasn't sure where to place this:https://twitter.com/jenniferatntd/status/1222590435740307457?fbclid=IwAR2vd6v2YP622SeDJDkUeJJm1pVPkZr5b92WreZtS3OMxaVeKLxPlARP0icIn #Wuhan , on Jan 18, when the #coronaravirus was already spreading rapidly and out of control, the government organized a grand “Eat Together “ event in which 40K families participated. 5 days later, the entire city was locked down, when 5 millions already fled.",First coronavirus cases confirmed in UK,2020-01-31 01:34:18,/r/Coronavirus/comments/ewm028/first_coronavirus_cases_confirmed_in_uk/
fg2zoh4,-0.6597,0.0,Whelp we’re fucked,First coronavirus cases confirmed in UK,2020-01-31 01:34:18,/r/Coronavirus/comments/ewm028/first_coronavirus_cases_confirmed_in_uk/
fg30e2t,-0.0772,0.0,"No mention of where and how they caught it. Instead a lot of ""the NHS is prepared"".",First coronavirus cases confirmed in UK,2020-01-31 01:34:18,/r/Coronavirus/comments/ewm028/first_coronavirus_cases_confirmed_in_uk/
fg2zxj8,0.3431,0.0,My lecture was cancelled today because the lecture has taken his daughter into hospital with pneumoniaI very very strongly doubt this is that but if it is it was nice knowing youI also strongly doubt it is as I’m in Newcastle and the rumours are the first cases are in Yorkshire but I’m not 100% on that,First coronavirus cases confirmed in UK,2020-01-31 01:34:18,/r/Coronavirus/comments/ewm028/first_coronavirus_cases_confirmed_in_uk/
fg2zxdg,0.7783,0.0,"I had heard from a friend yesterday that there was a suspected case at Blackburn Hospital, will be interesting to see if that was true",First coronavirus cases confirmed in UK,2020-01-31 01:34:18,/r/Coronavirus/comments/ewm028/first_coronavirus_cases_confirmed_in_uk/
fg30jxs,-0.1511,0.0,"Rumours flying round that they were sat in A&E for hours before being seen and treated, which isn't unbelievable in the slightest. Who knows how many people it could've been passed onto in that time",First coronavirus cases confirmed in UK,2020-01-31 01:34:18,/r/Coronavirus/comments/ewm028/first_coronavirus_cases_confirmed_in_uk/
fg327rr,0.0,0.0,Anyone know where you can buy surgical masks in London? All sold out online,First coronavirus cases confirmed in UK,2020-01-31 01:34:18,/r/Coronavirus/comments/ewm028/first_coronavirus_cases_confirmed_in_uk/
fg30qmm,0.8481,0.0,"This is the best tl;dr I could make, [original](https://www.bbc.co.uk/news/health-51325192) reduced by 60%. (I'm a bot)*****> At least 213 people in the China have died from the virus, mostly in Hubei, with almost 10,000 cases nationally.> There have been 98 cases of the virus in another 18 countries.> &quot;Prof Chris Whitty, chief medical officer for England said:&quot;The NHS is extremely well-prepared and used to managing infections and we are already working rapidly to identify any contacts the patients had, to prevent further spread. &quot;We have been preparing for UK cases of novel coronavirus and we have robust infection control measures in place to respond immediately,&quot; he added.*****[**Extended Summary**](http://np.reddit.com/r/autotldr/comments/ewm99q/first_coronavirus_cases_confirmed_in_uk/) | [FAQ](http://np.reddit.com/r/autotldr/comments/31b9fm/faq_autotldr_bot/ ""Version 2.02, ~463789 tl;drs so far."") | [Feedback](http://np.reddit.com/message/compose?to=%23autotldr ""PM's and comments are monitored, constructive feedback is welcome."") | *Top* *keywords*: **outbreak**^#1 **cases**^#2 **coronavirus**^#3 **chief**^#4 **medical**^#5",First coronavirus cases confirmed in UK,2020-01-31 01:34:18,/r/Coronavirus/comments/ewm028/first_coronavirus_cases_confirmed_in_uk/
fg3306e,-0.34,0.0,And... now i start worrying...,First coronavirus cases confirmed in UK,2020-01-31 01:34:18,/r/Coronavirus/comments/ewm028/first_coronavirus_cases_confirmed_in_uk/
fg3b0r9,0.0,0.0,First two cases also confirmed in Russia,First coronavirus cases confirmed in UK,2020-01-31 01:34:18,/r/Coronavirus/comments/ewm028/first_coronavirus_cases_confirmed_in_uk/
fg3npri,-0.296,0.0,Same here in Norway.. i am worried tbh..,First coronavirus cases confirmed in UK,2020-01-31 01:34:18,/r/Coronavirus/comments/ewm028/first_coronavirus_cases_confirmed_in_uk/
fg34iwg,0.0,0.0,Apparently it's two uni students who are from York but study at Newcastle.,First coronavirus cases confirmed in UK,2020-01-31 01:34:18,/r/Coronavirus/comments/ewm028/first_coronavirus_cases_confirmed_in_uk/
fg2zrw1,-0.3182,0.0,Is it the plane of people from Wuhan or an isolated case to that?,First coronavirus cases confirmed in UK,2020-01-31 01:34:18,/r/Coronavirus/comments/ewm028/first_coronavirus_cases_confirmed_in_uk/
fg32wbw,0.0,0.0,I fucking knew it.,First coronavirus cases confirmed in UK,2020-01-31 01:34:18,/r/Coronavirus/comments/ewm028/first_coronavirus_cases_confirmed_in_uk/
fg4g1bh,0.6072,0.0,"Thank god they're not in Europe anymore, amirite you guys??Jk..",First coronavirus cases confirmed in UK,2020-01-31 01:34:18,/r/Coronavirus/comments/ewm028/first_coronavirus_cases_confirmed_in_uk/
fg3340h,0.2732,0.0,God. From all other cities it had to be Newcastle ofc🥴,First coronavirus cases confirmed in UK,2020-01-31 01:34:18,/r/Coronavirus/comments/ewm028/first_coronavirus_cases_confirmed_in_uk/
fg318we,-0.296,0.0,Oh no,First coronavirus cases confirmed in UK,2020-01-31 01:34:18,/r/Coronavirus/comments/ewm028/first_coronavirus_cases_confirmed_in_uk/
fg39irf,0.4215,0.0,Two isolated cases not from the plane. Now in my city of Newcastle being treated at special secure diseases unit at the RVI.,First coronavirus cases confirmed in UK,2020-01-31 01:34:18,/r/Coronavirus/comments/ewm028/first_coronavirus_cases_confirmed_in_uk/
fg3b5vk,-0.3861,0.0,Oh no D:,First coronavirus cases confirmed in UK,2020-01-31 01:34:18,/r/Coronavirus/comments/ewm028/first_coronavirus_cases_confirmed_in_uk/
fg38cbo,0.2694,0.0,Damn those antibodies are so smart. And here I am making them without even knowing it!,Dr. John Campbell explains the simplicity of asymptomatic viral transmission in a way that even a politician could understand.,2020-01-31 01:49:20,/r/Coronavirus/comments/ewm5b3/dr_john_campbell_explains_the_simplicity_of/
fg36cu7,-0.2411,0.0,"If this all blows over as nothing huge, I've still learnt a lot.",Dr. John Campbell explains the simplicity of asymptomatic viral transmission in a way that even a politician could understand.,2020-01-31 01:49:20,/r/Coronavirus/comments/ewm5b3/dr_john_campbell_explains_the_simplicity_of/
fg3i1gy,0.4939,0.0,""" **in a way that even a politician could understand**"" 🤣",Dr. John Campbell explains the simplicity of asymptomatic viral transmission in a way that even a politician could understand.,2020-01-31 01:49:20,/r/Coronavirus/comments/ewm5b3/dr_john_campbell_explains_the_simplicity_of/
fg3394y,0.784,0.0,This is an excellent explanation. Thanks!,Dr. John Campbell explains the simplicity of asymptomatic viral transmission in a way that even a politician could understand.,2020-01-31 01:49:20,/r/Coronavirus/comments/ewm5b3/dr_john_campbell_explains_the_simplicity_of/
fg38bp3,0.7783,0.0,"I hope this gets played in all bio classes in all schools. Thank you for this Dr. Campbell, learn something new everyday day 👍🏻",Dr. John Campbell explains the simplicity of asymptomatic viral transmission in a way that even a politician could understand.,2020-01-31 01:49:20,/r/Coronavirus/comments/ewm5b3/dr_john_campbell_explains_the_simplicity_of/
fg3jwab,0.6597,0.0,Good information Dr Campbell. Thank you.,Dr. John Campbell explains the simplicity of asymptomatic viral transmission in a way that even a politician could understand.,2020-01-31 01:49:20,/r/Coronavirus/comments/ewm5b3/dr_john_campbell_explains_the_simplicity_of/
fg3c1la,0.2263,0.0,"The reddit title does not accurately describe the video. He only mentions that the disease is thought to be transmissable during the incubation phase (@ 18:15), not that this is confirmed. It's worth noting the NIH NIAID director [said](https://youtu.be/5DO91C3KvSo?t=3027),> ""The driver of outbreaks is always a symptomatic person. Even if there's a rare asymptomatic person that might transmit, an epidemic is not driven by asymptomatic carriers.""",Dr. John Campbell explains the simplicity of asymptomatic viral transmission in a way that even a politician could understand.,2020-01-31 01:49:20,/r/Coronavirus/comments/ewm5b3/dr_john_campbell_explains_the_simplicity_of/
