Comment ID,Comment_VS,Title_VS,Comment,Title,Publish Date,Permalink
fg5tlsu,0.0,-0.4939,The multiply Chinese figures by 10 seems to be a decent rule of thumb.,The Lancet Study: 75800 infected in Wuhan as of Jan. 25,2020-01-31 08:16:14,/r/Coronavirus/comments/ewqphq/the_lancet_study_75800_infected_in_wuhan_as_of/
fg60meu,-0.6486,-0.4939,"2% of 1B is 20 million, and China has a population of 1.7B, that’s gonna be a lot of dead people",The Lancet Study: 75800 infected in Wuhan as of Jan. 25,2020-01-31 08:16:14,/r/Coronavirus/comments/ewqphq/the_lancet_study_75800_infected_in_wuhan_as_of/
fg5jdj1,0.0,-0.4939,One needs only to take a cursory glance at the travel routes out of Wuhan to see just how quickly this could have spread........scary!,The Lancet Study: 75800 infected in Wuhan as of Jan. 25,2020-01-31 08:16:14,/r/Coronavirus/comments/ewqphq/the_lancet_study_75800_infected_in_wuhan_as_of/
fg5orep,0.5211,-0.4939,"I’m not trying to scare monger anyone but I was watching a Chinese YouTuber’s live stream & in the comment section someone said they heard a rumor that the real number of infected is closer to 90,000. They did  not provide any links or ways to fact check this number.  Please tell me this is just a rumor.  The last number I read from a trustworthy source was around 11,000 infected as of January 31st. To anyone affected by this virus I’m so sorry you have to go through this, especially during Chinese New Year which is the only time some families get to see each other. Stay safe everyone.",The Lancet Study: 75800 infected in Wuhan as of Jan. 25,2020-01-31 08:16:14,/r/Coronavirus/comments/ewqphq/the_lancet_study_75800_infected_in_wuhan_as_of/
fg4yf37,-0.2732,-0.4939,Maybe this is where those FEMA camps come in handy Alex Jones warned us about.....,The Lancet Study: 75800 infected in Wuhan as of Jan. 25,2020-01-31 08:16:14,/r/Coronavirus/comments/ewqphq/the_lancet_study_75800_infected_in_wuhan_as_of/
fg3rz9g,0.0,-0.3182,Finally.,Delta &amp; American Airlines suspend flights to China,2020-01-31 08:31:47,/r/Coronavirus/comments/ewqxb2/delta_american_airlines_suspend_flights_to_china/
fg40k97,-0.7964,-0.3182,"Airlines are incredibly expensive to operate.  They depend on cash flow, and the margins are rather thin. These companies have chosen to walk away from a lot of money, and it is going to hurt them.  I speculate that they foresee those flights getting shut down anyway, and that it would be a waste of resources to schedule flight crew, fuel, etc.  Definitely a sign that shit is getting real.",Delta &amp; American Airlines suspend flights to China,2020-01-31 08:31:47,/r/Coronavirus/comments/ewqxb2/delta_american_airlines_suspend_flights_to_china/
fg3txr3,0.0,-0.3182,But how many people between now and 02/06/2020 will be flying? a lot. 42 flights a week according to Delta go to and from China. Multiply that by a couple hundred on each flight and you're talking thousands of new possible spreaders of the virus going around the world....,Delta &amp; American Airlines suspend flights to China,2020-01-31 08:31:47,/r/Coronavirus/comments/ewqxb2/delta_american_airlines_suspend_flights_to_china/
fg4i2zy,-0.2732,-0.3182,"Agreed, we will see what comes next. It’s getting a bit Scary though...",Delta &amp; American Airlines suspend flights to China,2020-01-31 08:31:47,/r/Coronavirus/comments/ewqxb2/delta_american_airlines_suspend_flights_to_china/
fg3u0zu,0.3612,-0.3182,I agree. It might be too little too late.,Delta &amp; American Airlines suspend flights to China,2020-01-31 08:31:47,/r/Coronavirus/comments/ewqxb2/delta_american_airlines_suspend_flights_to_china/
fg3xq86,-0.998,-0.128,"BEIJING —  When Gao Fei warned members of his family about the deadly virus sweeping their way, he never suspected that they would laugh at him, or that he would end up being arrested.The migrant worker had left Hubei province last year to freelance as a welder in southern China. His family members stayed in their village in Qichun county less than two hours’ drive from Wuhan, the epicenter of a coronavirus outbreak that has killed more than 210 people and infected more than 9,700.Gao sensed something dangerous was coming. He had breached China’s firewall to follow online news of the coronavirus as it emerged this month. He immediately began messaging his parents and siblings, including his brother, who drove a taxi between their village and Wuhan every day.“Stock up on food, masks, disinfectant and medicine. Wash your hands. Don’t go to Wuhan!” he told them. They laughed. No one even knew of the virus in their hometown, they said, and nobody was wearing a mask. Gao, 33, sent a pack of surgical masks to his brother anyway. He felt helpless and enraged.ADVERTISEMENTGao was arrested Wednesday after tweeting that President Xi Jinping should resign over the government’s handling of the virus. The tweet about Xi disappeared, but [another one](https://twitter.com/3yOG87uDkHPs9KH/status/1221972586898190336)he’d written earlier, as authorities announced new penalties for “spreading rumors” about the virus outbreak, remained: “Bring it on. This is a confrontation between a government that neglects life and a people who are saving themselves. Truth is our greatest weapon for our own salvation.”Gao’s predictions have come to pass as the coronavirus spans continents and leaves China’s already overburdened medical system straining under a health emergency that has steadily accelerated. The communist leadership is entangled in its greatest medical and political crises in years, even as it attempts to assure other nations that all is under control.On Thursday, the World Health Organization, which had earlier praised China’s handling of the outbreak, declared the outbreak an international “public health emergency.”￼People wearing masks pose for photos in Beijing’s Jingshan Park on Jan. 24, 2020. China canceled Lunar New Year celebrations and venues including the Forbidden City, seen in background, were closed.(Wu Hong / EPA/Shutterstock)ADVERTISEMENTResidents, medical staff and relatives of those who are ill or have died in Hubei province are demanding help. Stories of family members stricken with coronavirus symptoms who died without being diagnosed reverberate through Chinese social media, raising suspicions that the government is underreporting the number of those infected.State TV aired video Thursday of a central inspection team questioning health officials in Huanggang, a district that includes Gao’s family home and now the city with the second-most infections and deaths after Wuhan. A top official was fired after being shamed on TV for failing to give answers on how many cases the city was dealing with and how many hospital beds it could provide.But, as Gao discovered, bureaucracy and a shortage of resources are slowing China’s response and increasing the risk of contagion. Even doctors, many of whom have no access to test kits to determine whether they have the virus or not, are falling ill with fevers and other symptoms as they treat patients. One doctor in Wuhan called China’s emergency hotline for ambulances to pick up urgent cases only to be told that 700 people were on a waiting list.It wasn’t until Zhong Nanshan, an 83-year-old doctor widely respected for having spoken truthfully during the SARS epidemic of 2003, said on TV on Jan. 20 that the virus was contagious between humans, that most Chinese people began to worry.That’s when Gao rushed home, taking a train to Hubei on Jan. 22. His grandfather and sister bought supplies while he was on the way, stockpiling enough food for two months at home. Their preparation came just in time. Wuhan was put on transportation lockdown on Jan. 23. Since then, China has quarantined at least 15 more cities that are home to more than 50 million people — more than double the populations of Los Angeles, New York, Chicago and London combined.Gao’s family village in Qichun county is enforcing its own blockade. Every morning, the village leader parks his van in the center of a road at the village entrance, blocking outsiders’ entry to limit the chances of virus exposure. But inside, villagers continue to meet in groups, especially to play mah-jongg, Gao said — many without wearing masks, unfazed because no one in their village has yet been infected.“They’re not looking at the news, just playing mah-jongg,” he said in a phone interview Wednesday. “It’s like we live in two worlds.”When he first arrived home, Gao urged government officials to distribute medical supplies and to prevent villagers from gathering for the Lunar New Year.ADVERTISEMENT“They said, ‘We don’t have orders from above,’” Gao said. Local officials refused to act without getting notice from their superiors, he said, and now, they are too overwhelmed monitoring people who’d been to Wuhan to care about potential contagion in mah-jongg groups.￼A worker moves medical waste containers past the entrance of the Wuhan Medical Treatment Center in China, where some coronavirus patients are being treated, on Jan. 22, 2020. (Associated Press )China’s bureaucratic medical system and underlings’ fear of handing party bosses bad news were significant obstacles. Officials, usually Communist Party cadres who are motivated by promotions for meeting superiors’ targets rather than accountability to the people they govern, are slow to respond to needs on the ground.Another urgent problem was the shortage of supplies. Wei Peng, a doctor in his 40s at a community hospital in Wuhan’s Qiaokou district, about two hours from Gao’s family home, said in a phone interview that at least 12 out of 59 doctors at his hospital, himself included, were working despite being sick with fevers, coughs and lung infections — symptoms of the coronavirus.“We don’t have the test kit, and we don’t have time for tests either,” Wei said.Wei suspects he became infected while treating a patient on Jan. 19, when Chinese authorities were insisting the disease, which is suspected to have started in a live animal market, was not transmissible between humans. Wei was wearing only a disposable surgical mask and no goggles when the patient coughed in his face.“As long as you’re not diagnosed, you must go to work,” said Wei. He and other doctors spend their nights at the hospital because of transportation shutdowns. “We know that we are causing risk of contagion to the patients. But if you don’t work, then what? There’s no one to replace you. Your colleagues must bear more, and they’re also infected.”The official tally of infection cases was “definitely not reliable,” Wei said. He noted: Too many patients are not being counted. There are not enough test kits. Not enough doctors. Not enough hospital beds. Not enough medicine. Not enough masks. Not enough cars to take patients to the hospital.ADVERTISEMENT“There are a lot of patients and they are anxious,” said Wei, who fashioned his own goggles out of plastic sheets. “Many are calling here and you can hear them shouting on the phone, ‘Save me, save me,’ and they are crying, and there’s nothing we can do.”￼Chinese welder Gao Fei warned family members in Hubei province of the impending coronavirus threat. When he criticized the government for its handling of the outbreak, he was arrested.( Gao Fei )In Qichun, Gao ventured out of his village Tuesday to visit the county hospital. A director there said they had 1,000 good surgical masks left, which would be gone in a matter of days. This week, the director said, armed police in Qichun were sent to a factory to confiscate any medical supplies they could find. They returned empty-handed.“All the country’s supplies are going to Wuhan, but what about us? What should we do? We wait to die?” Gao said. “Everyone is fighting for supplies, and they just try and take however much they can get. At this point, it’s a matter of survival.”Frustrated and worried, Gao [donated](https://twitter.com/3yOG87uDkHPs9KH/status/1222362654787784704) the last 10 face masks from his brother’s box to the Qichun county hospital on Wednesday. He sent out a flurry of tweets afterward, including one criticizing Xi Jinping’s arrogance in refusing help from abroad and calling for “removal of the head,” meaning the Chinese leader should resign.That’s when the police showed up.","L.A Times: Chinese migrant worker who tried to warn family about Coronavirus is laughed at, arrested by CCP.",2020-01-31 09:11:26,/r/Coronavirus/comments/ewri0w/la_times_chinese_migrant_worker_who_tried_to_warn/
fg3wea1,-0.0005,-0.128,Wish I wasnt out of free la times articles,"L.A Times: Chinese migrant worker who tried to warn family about Coronavirus is laughed at, arrested by CCP.",2020-01-31 09:11:26,/r/Coronavirus/comments/ewri0w/la_times_chinese_migrant_worker_who_tried_to_warn/
fg4tedn,-0.5096,-0.128,"Xi needs to step down. His system is broken. I'm in the USA, so I can say that without worry of having to fight off ccp pigs.","L.A Times: Chinese migrant worker who tried to warn family about Coronavirus is laughed at, arrested by CCP.",2020-01-31 09:11:26,/r/Coronavirus/comments/ewri0w/la_times_chinese_migrant_worker_who_tried_to_warn/
fg4vhhs,0.9049,-0.128,If someone really wanted to do real damage and on purpose as a bioweapon. Then spreading it during the Super Bowl in 2 days would be the PERFECT opportunity to do so. Luckily those kinda people and governments don't exist.,"L.A Times: Chinese migrant worker who tried to warn family about Coronavirus is laughed at, arrested by CCP.",2020-01-31 09:11:26,/r/Coronavirus/comments/ewri0w/la_times_chinese_migrant_worker_who_tried_to_warn/
fg471du,-0.7266,-0.128,"bs titleGao was arrested Wednesday after tweeting that President Xi Jinping should resign over the government’s handling of the virus. The tweet about Xi disappeared, but another onehe’d written earlier, as authorities announced new penalties for “spreading rumors” about the virus outbreak, remained: “Bring it on. This is a confrontation between a government that neglects life and a people who are saving themselves. Truth is our greatest weapon for our own salvation.”he was arrested for this, not for warning people about the outbreak","L.A Times: Chinese migrant worker who tried to warn family about Coronavirus is laughed at, arrested by CCP.",2020-01-31 09:11:26,/r/Coronavirus/comments/ewri0w/la_times_chinese_migrant_worker_who_tried_to_warn/
fg4jcrc,0.6597,-0.128,We would live in a better world if people like Gao Fei are in charge,"L.A Times: Chinese migrant worker who tried to warn family about Coronavirus is laughed at, arrested by CCP.",2020-01-31 09:11:26,/r/Coronavirus/comments/ewri0w/la_times_chinese_migrant_worker_who_tried_to_warn/
fg567e6,-0.6486,-0.128,He is probably already dead,"L.A Times: Chinese migrant worker who tried to warn family about Coronavirus is laughed at, arrested by CCP.",2020-01-31 09:11:26,/r/Coronavirus/comments/ewri0w/la_times_chinese_migrant_worker_who_tried_to_warn/
fg5aizq,-0.5423,-0.128,Fuck the Chinese Government,"L.A Times: Chinese migrant worker who tried to warn family about Coronavirus is laughed at, arrested by CCP.",2020-01-31 09:11:26,/r/Coronavirus/comments/ewri0w/la_times_chinese_migrant_worker_who_tried_to_warn/
fg4s3ke,-0.4588,-0.128,After all of this has passed China needs to have have a talk with everyone and be forced to turn into a democracy it's out of controll.,"L.A Times: Chinese migrant worker who tried to warn family about Coronavirus is laughed at, arrested by CCP.",2020-01-31 09:11:26,/r/Coronavirus/comments/ewri0w/la_times_chinese_migrant_worker_who_tried_to_warn/
fg42vk6,-0.5423,-0.128,You're the real MVP. Fuck paid articles,"L.A Times: Chinese migrant worker who tried to warn family about Coronavirus is laughed at, arrested by CCP.",2020-01-31 09:11:26,/r/Coronavirus/comments/ewri0w/la_times_chinese_migrant_worker_who_tried_to_warn/
fg4375v,0.3612,-0.128,Thank you,"L.A Times: Chinese migrant worker who tried to warn family about Coronavirus is laughed at, arrested by CCP.",2020-01-31 09:11:26,/r/Coronavirus/comments/ewri0w/la_times_chinese_migrant_worker_who_tried_to_warn/
fg59nbr,-0.5423,-0.128,"I've been told Twitter has been ""colluding"" with the Chinese government to suppress posts and messages that are considered by the Chinese government as ""negative"".  Twitter is no longer a trustworthy company as it's tainted by the power of the dark side.","L.A Times: Chinese migrant worker who tried to warn family about Coronavirus is laughed at, arrested by CCP.",2020-01-31 09:11:26,/r/Coronavirus/comments/ewri0w/la_times_chinese_migrant_worker_who_tried_to_warn/
fg3xg0o,0.0,-0.128,"Paywall gates, its 2020 and they can't figure out how to make money advertising.","L.A Times: Chinese migrant worker who tried to warn family about Coronavirus is laughed at, arrested by CCP.",2020-01-31 09:11:26,/r/Coronavirus/comments/ewri0w/la_times_chinese_migrant_worker_who_tried_to_warn/
fg4gx4g,0.3818,-0.128,Clear your cookies and search history.,"L.A Times: Chinese migrant worker who tried to warn family about Coronavirus is laughed at, arrested by CCP.",2020-01-31 09:11:26,/r/Coronavirus/comments/ewri0w/la_times_chinese_migrant_worker_who_tried_to_warn/
fg3xg6o,0.0,-0.128,Same and don't even use that site,"L.A Times: Chinese migrant worker who tried to warn family about Coronavirus is laughed at, arrested by CCP.",2020-01-31 09:11:26,/r/Coronavirus/comments/ewri0w/la_times_chinese_migrant_worker_who_tried_to_warn/
fg4nave,0.0,-0.128,put outline.com/ before the link,"L.A Times: Chinese migrant worker who tried to warn family about Coronavirus is laughed at, arrested by CCP.",2020-01-31 09:11:26,/r/Coronavirus/comments/ewri0w/la_times_chinese_migrant_worker_who_tried_to_warn/
fg4wcsa,-0.2263,-0.128,Sarcasm I presume?,"L.A Times: Chinese migrant worker who tried to warn family about Coronavirus is laughed at, arrested by CCP.",2020-01-31 09:11:26,/r/Coronavirus/comments/ewri0w/la_times_chinese_migrant_worker_who_tried_to_warn/
fg47wrk,0.3182,-0.128,Proof stating exactly what you just said please...,"L.A Times: Chinese migrant worker who tried to warn family about Coronavirus is laughed at, arrested by CCP.",2020-01-31 09:11:26,/r/Coronavirus/comments/ewri0w/la_times_chinese_migrant_worker_who_tried_to_warn/
fg3x72q,0.4215,0.0,Lol is the first guy the one who was picking his nose and smelling his armpit?,BREAKING NEWS: Origin of Coronavirus identified,2020-01-31 09:23:27,/r/Coronavirus/comments/ewro87/breaking_news_origin_of_coronavirus_identified/
fg3yqzl,0.0,0.0,6 degrees of infection,BREAKING NEWS: Origin of Coronavirus identified,2020-01-31 09:23:27,/r/Coronavirus/comments/ewro87/breaking_news_origin_of_coronavirus_identified/
fg3xbdm,0.0,0.0,Who’s the first guy?,BREAKING NEWS: Origin of Coronavirus identified,2020-01-31 09:23:27,/r/Coronavirus/comments/ewro87/breaking_news_origin_of_coronavirus_identified/
fg44adj,0.791,0.0,"I saw this meme on the sub that shares such content. It is indeed funny if you take it as a joke. However, putting this kind of jokes on this sub affects the credibility of this sub in the minds of readers, who're waiting for info.",BREAKING NEWS: Origin of Coronavirus identified,2020-01-31 09:23:27,/r/Coronavirus/comments/ewro87/breaking_news_origin_of_coronavirus_identified/
fg3xd0j,0.0,0.0,I mean the Vatican isn't far off.,BREAKING NEWS: Origin of Coronavirus identified,2020-01-31 09:23:27,/r/Coronavirus/comments/ewro87/breaking_news_origin_of_coronavirus_identified/
fg46t8e,-0.0803,0.0,No Jogi No,BREAKING NEWS: Origin of Coronavirus identified,2020-01-31 09:23:27,/r/Coronavirus/comments/ewro87/breaking_news_origin_of_coronavirus_identified/
fg42rgb,0.0,0.0,Joachim Löw (Germany's Soccer National Team Coach),BREAKING NEWS: Origin of Coronavirus identified,2020-01-31 09:23:27,/r/Coronavirus/comments/ewro87/breaking_news_origin_of_coronavirus_identified/
fg47ub2,0.296,0.0,Yeah and eating the stuff that he got out of his nose. It's all on camera,BREAKING NEWS: Origin of Coronavirus identified,2020-01-31 09:23:27,/r/Coronavirus/comments/ewro87/breaking_news_origin_of_coronavirus_identified/
fg3xdvq,-0.2732,0.0,Joachim Low. German football coach,BREAKING NEWS: Origin of Coronavirus identified,2020-01-31 09:23:27,/r/Coronavirus/comments/ewro87/breaking_news_origin_of_coronavirus_identified/
fg3x6fe,0.4215,0.0,Obviously a troll lol,BREAKING NEWS: Origin of Coronavirus identified,2020-01-31 09:23:27,/r/Coronavirus/comments/ewro87/breaking_news_origin_of_coronavirus_identified/
fg3x630,0.6486,0.0,"Follow the pictures like a sequence but yes, troll has been identified.",BREAKING NEWS: Origin of Coronavirus identified,2020-01-31 09:23:27,/r/Coronavirus/comments/ewro87/breaking_news_origin_of_coronavirus_identified/
fg6qg4r,0.0,0.0,f*g,BREAKING NEWS: Origin of Coronavirus identified,2020-01-31 09:23:27,/r/Coronavirus/comments/ewro87/breaking_news_origin_of_coronavirus_identified/
fg6qvge,0.0,0.0,🤦🏻‍♂️,BREAKING NEWS: Origin of Coronavirus identified,2020-01-31 09:23:27,/r/Coronavirus/comments/ewro87/breaking_news_origin_of_coronavirus_identified/
fg3ybyq,0.0,0.3612,Shenzhen doesn't have the most outside of hubei,"Outside of Hubei province (Wuhan is in Hubei), Shenzhen is the city with most confirmed cases. Here's what life is like there right now.",2020-01-31 09:28:20,/r/Coronavirus/comments/ewrqpz/outside_of_hubei_province_wuhan_is_in_hubei/
fg3yzyi,-0.2543,0.3612,I checked the official Chinese counter just before stating this in my video. Guangzhou was close second at that time. More than half a day has passed. So can't guarantee for now.,"Outside of Hubei province (Wuhan is in Hubei), Shenzhen is the city with most confirmed cases. Here's what life is like there right now.",2020-01-31 09:28:20,/r/Coronavirus/comments/ewrqpz/outside_of_hubei_province_wuhan_is_in_hubei/
fg3z307,0.0,0.3612,What was your count for shenzhen? Because mine is at 134 from the Chinese data.,"Outside of Hubei province (Wuhan is in Hubei), Shenzhen is the city with most confirmed cases. Here's what life is like there right now.",2020-01-31 09:28:20,/r/Coronavirus/comments/ewrqpz/outside_of_hubei_province_wuhan_is_in_hubei/
fg4upg7,0.0,0.3612,How about Wenzhou?,"Outside of Hubei province (Wuhan is in Hubei), Shenzhen is the city with most confirmed cases. Here's what life is like there right now.",2020-01-31 09:28:20,/r/Coronavirus/comments/ewrqpz/outside_of_hubei_province_wuhan_is_in_hubei/
fg5hu96,0.0,0.3612,Data has changed now. Shenzhen has 170 cases and Wenzhou has overtaken Shenzhen with now 241 cases.,"Outside of Hubei province (Wuhan is in Hubei), Shenzhen is the city with most confirmed cases. Here's what life is like there right now.",2020-01-31 09:28:20,/r/Coronavirus/comments/ewrqpz/outside_of_hubei_province_wuhan_is_in_hubei/
fg55q88,0.0,0.3612,They have more than shenzhen. In fact 3 others outside of hubei have more than shenzhen,"Outside of Hubei province (Wuhan is in Hubei), Shenzhen is the city with most confirmed cases. Here's what life is like there right now.",2020-01-31 09:28:20,/r/Coronavirus/comments/ewrqpz/outside_of_hubei_province_wuhan_is_in_hubei/
fg5kmuy,0.0,0.3612,"Wenzhou already had more yesterday, even back to the 28th.With the updated data, shenzhen is now the third highest outside of hubei. Previously shanghai and Beijing had more. Chongqing still has more.","Outside of Hubei province (Wuhan is in Hubei), Shenzhen is the city with most confirmed cases. Here's what life is like there right now.",2020-01-31 09:28:20,/r/Coronavirus/comments/ewrqpz/outside_of_hubei_province_wuhan_is_in_hubei/
fg41oxo,-0.8211,0.0,"Google maps is not accurate in China. They are forced by the CCP to issue inaccurate maps.  [https://www.youtube.com/watch?v=L9Di-UVC-\_4](https://www.youtube.com/watch?v=L9Di-UVC-_4)In some cases it is even more severe. Military bases and government buildings are not listed in the correct locations and can be miles away from their real locations, or even missing entirely replaced by faked images of the area.Don't think that is entirely unique to China. The US military locations are also replaced by fake images or not shown entirely also. However we don't take it nearly as far as China.Also look at Disney world and Disney Land on the maps. Notice anything missing? People. The images are altered to show the parks in their best light. Not just removing people but sometimes things they don't want the public to see. As the park layout is copyrighted they are able to force google to alter it to appear as they want it to.Don't trust everything you see.",Google and Bing have vastly different ideas as to where the Wuhan Virology Institute is located,2020-01-31 09:40:24,/r/Coronavirus/comments/ewrx53/google_and_bing_have_vastly_different_ideas_as_to/
fg3ztbl,0.8225,0.0,"Great post thank you for this it was assumed a day or two ago that they had changed the location on maps,however, somebody had taken a screenshot before the outbreak grew of major concern and after, and it had been relocated and the original spot was blurred/made to look like a patch of green and posted the findings. (Sorry I have no source atm just a screenshot I took of the findings) This helps confirm what they had said. Btw, screenshot everything. Sometimes things get buried and deleted. But you’ll have them on your phone for reference as well as the date and time it was announced/posted.",Google and Bing have vastly different ideas as to where the Wuhan Virology Institute is located,2020-01-31 09:40:24,/r/Coronavirus/comments/ewrx53/google_and_bing_have_vastly_different_ideas_as_to/
