Comment ID,Comment_VS,Title_VS,Comment,Title,Publish Date,Permalink
fg8426e,0.5574,-0.5267,"I get why they would want to keep the cat in the bag. I couldnt imagine what it would be like to be in that position of making that type of decision. However, they (possibly) took a risk. Keep it hush-hush, hope it blows over, no one is the wiser. OR keep it hush-hush and end up having it spread to every corner of the earth. You make your bed, you lie in it.",At what point does Chinese Censorship become a threat to all society.,2020-02-01 17:11:15,/r/Coronavirus/comments/exg6ro/at_what_point_does_chinese_censorship_become_a/
fg85wzx,0.8128,-0.5267,But good ol' Chernobyl hasn't gotten anyone sick on the other side of the globe.,At what point does Chinese Censorship become a threat to all society.,2020-02-01 17:11:15,/r/Coronavirus/comments/exg6ro/at_what_point_does_chinese_censorship_become_a/
fg82oqs,0.7501,-0.6597,"It’s hard to have fake news when scientists don’t know what’s real news yet...The truth is a lot about this virus is completely unknown. Therefore this sub would be almost completely empty...Take for example asymptomatic transfer. It’s not yet 100% certain this is true. Most governments now believe it is possible but some other governments and scientists don’t. We wouldn’t be able to have any posts on asymptomatic transfer on this sub because it’s not 100% verified among the scientific community (even if it may be likely).EDIT: a practical solution that allows information flow whilst highlighting what’s not yet confirmed would be strict use of stickers in each post title. Hopefully, this would address OP’s concerns whilst still enabling early information to be available.",Can we have a pinned thread for fake news about the virus? Misinformation is getting out of control.,2020-02-01 17:43:09,/r/Coronavirus/comments/exgnes/can_we_have_a_pinned_thread_for_fake_news_about/
fg891wm,0.2626,-0.6597,"Research papers are not fake news.Take videos with a grain of salt.Ignore the conspiracy theories.No, we don't need a thread, use your brain.Edit: Thanks for the silver",Can we have a pinned thread for fake news about the virus? Misinformation is getting out of control.,2020-02-01 17:43:09,/r/Coronavirus/comments/exgnes/can_we_have_a_pinned_thread_for_fake_news_about/
fg8olx4,-0.4767,-0.6597,Who de ides what is fake?,Can we have a pinned thread for fake news about the virus? Misinformation is getting out of control.,2020-02-01 17:43:09,/r/Coronavirus/comments/exgnes/can_we_have_a_pinned_thread_for_fake_news_about/
fg9x92l,-0.4417,-0.6597,That's kinda hard when all information coming out of China is likely fudged or complete lies.,Can we have a pinned thread for fake news about the virus? Misinformation is getting out of control.,2020-02-01 17:43:09,/r/Coronavirus/comments/exgnes/can_we_have_a_pinned_thread_for_fake_news_about/
fg82vp4,0.1363,-0.6597,"You’re statement is flawed, in fact it’s the exact opposite. It’s EASY to have fake news when scientists don’t know what’s real news yet.",Can we have a pinned thread for fake news about the virus? Misinformation is getting out of control.,2020-02-01 17:43:09,/r/Coronavirus/comments/exgnes/can_we_have_a_pinned_thread_for_fake_news_about/
fgb0b5h,0.4019,-0.6597,I have awarded you a Silver for this comment.,Can we have a pinned thread for fake news about the virus? Misinformation is getting out of control.,2020-02-01 17:43:09,/r/Coronavirus/comments/exgnes/can_we_have_a_pinned_thread_for_fake_news_about/
fgb0dux,0.4019,-0.6597,I have awarded you a Silver for this comment.,Can we have a pinned thread for fake news about the virus? Misinformation is getting out of control.,2020-02-01 17:43:09,/r/Coronavirus/comments/exgnes/can_we_have_a_pinned_thread_for_fake_news_about/
fg86t3u,0.8191,-0.6597,"I can agree with both of in ways if that makes sense. There's no wrong answers when nothing is set in stone but eventually there is an answer and then you're left with some people still believing a bunch of shit. That's what makes this the most interesting to me though, and in my mind is this point these publid forum sites like this in the first place. You get everyones take on one thing and develop your own opinions however it is you choose to do so. Yea false information gets posted but someone else always corrects them and people ultimately are going to think what thru would have anyways. No conspiracy theorist is going to change their minds because you post facts from a government or university research journal.",Can we have a pinned thread for fake news about the virus? Misinformation is getting out of control.,2020-02-01 17:43:09,/r/Coronavirus/comments/exgnes/can_we_have_a_pinned_thread_for_fake_news_about/
fg84j18,0.4215,-0.6597,"Yes I tend to agree. I see a lot of “reported”. If it’s a rumour, conjecture or not verified, that point should be stressed",Can we have a pinned thread for fake news about the virus? Misinformation is getting out of control.,2020-02-01 17:43:09,/r/Coronavirus/comments/exgnes/can_we_have_a_pinned_thread_for_fake_news_about/
fg8f2e4,0.5421,-0.6597,"“Actually that’s not true.” - Careful with definitive claims. I’ve seen and circulated that study to other people too over the past few days and I believe asymptomatic transfer is possible. However, there are also plenty of people more intelligent than myself who dispute it. In addition, it’s a tiny sample study which would ordinarily not be accepted in science. So whilst it may be highly likely it’s true we absolutely can not say it is 100% certain that it’s true.It’s a subtle difference and it kind of comes back to my point that we should be able to circulate things on this sub such as that study you linked even though it’s not 100% settled science.",Can we have a pinned thread for fake news about the virus? Misinformation is getting out of control.,2020-02-01 17:43:09,/r/Coronavirus/comments/exgnes/can_we_have_a_pinned_thread_for_fake_news_about/
fg8ibp7,0.6794,-0.6597,"If you’re accustomed to scientific publishing you will be well aware a sample size that small is not ordinarily accepted science (you can’t make proper statistical inferences). The reason it has been published, like many other papers on this topic, is because with how urgent it is to understand this virus convention is being forgone for the sake of any possible early information. Again, I am on your side that I think it’s very likely. I’m just saying it’s not 100% settled science (there are ulterior reasons for it being published - early info trumps certainty).",Can we have a pinned thread for fake news about the virus? Misinformation is getting out of control.,2020-02-01 17:43:09,/r/Coronavirus/comments/exgnes/can_we_have_a_pinned_thread_for_fake_news_about/
fg85g0u,0.743,-0.25,The Super Bowl will have maybe 70k attendees. Today probably thirty basketball games were played in front of crowds of over 10k. Perspective.,Should we cancel the superbowl?,2020-02-01 18:11:09,/r/Coronavirus/comments/exh25q/should_we_cancel_the_superbowl/
fg84rrv,0.438,-0.25,100% will never happen but damn that’s going to cause a lot of spreading.,Should we cancel the superbowl?,2020-02-01 18:11:09,/r/Coronavirus/comments/exh25q/should_we_cancel_the_superbowl/
fg87p9n,-0.7152,-0.25, How many people are going to choke on a hot dog and die during a super bowl party... Probably more than will die of Coronavirus because of the SuperBowl.,Should we cancel the superbowl?,2020-02-01 18:11:09,/r/Coronavirus/comments/exh25q/should_we_cancel_the_superbowl/
fg84vt2,0.0,-0.25,"If I had a ticket rn, I wouldnt go.",Should we cancel the superbowl?,2020-02-01 18:11:09,/r/Coronavirus/comments/exh25q/should_we_cancel_the_superbowl/
fg858ua,-0.3559,-0.25,Most Chinese are not very interested in football.,Should we cancel the superbowl?,2020-02-01 18:11:09,/r/Coronavirus/comments/exh25q/should_we_cancel_the_superbowl/
fg8btz1,-0.0714,-0.25,50 million people pass through MIA per year... That's 137k per day (obviously more on certain days and less on others but that's perspective),Should we cancel the superbowl?,2020-02-01 18:11:09,/r/Coronavirus/comments/exh25q/should_we_cancel_the_superbowl/
fg8mhwz,0.6908,-0.25,I told my gf she couldn't go w me and I'm taking my chinese friend instead. I can't wait to see people part like they are the red sea and I'm moses.,Should we cancel the superbowl?,2020-02-01 18:11:09,/r/Coronavirus/comments/exh25q/should_we_cancel_the_superbowl/
fg859zr,-0.25,-0.25,You people are paranoid.,Should we cancel the superbowl?,2020-02-01 18:11:09,/r/Coronavirus/comments/exh25q/should_we_cancel_the_superbowl/
fg8c457,0.0,-0.25,We should. Are we going to? Nope,Should we cancel the superbowl?,2020-02-01 18:11:09,/r/Coronavirus/comments/exh25q/should_we_cancel_the_superbowl/
fg852gi,0.0,-0.25,Nothing’s gonna happen,Should we cancel the superbowl?,2020-02-01 18:11:09,/r/Coronavirus/comments/exh25q/should_we_cancel_the_superbowl/
fg8ad2z,-0.5859,-0.25,More people will get food poisoning than nCov.,Should we cancel the superbowl?,2020-02-01 18:11:09,/r/Coronavirus/comments/exh25q/should_we_cancel_the_superbowl/
fgahl27,0.0,-0.25,"A silent Nuclear blast is about to go off, and everyone’s to nearsighted to see it.",Should we cancel the superbowl?,2020-02-01 18:11:09,/r/Coronavirus/comments/exh25q/should_we_cancel_the_superbowl/
fg8h6bj,0.0,-0.25,If hordes of drooling zombies were sitting on the 50 yard line the game would go on without a mention of the zombie hordes.,Should we cancel the superbowl?,2020-02-01 18:11:09,/r/Coronavirus/comments/exh25q/should_we_cancel_the_superbowl/
fg8ilrk,0.0,-0.25,XTZ OXT,Should we cancel the superbowl?,2020-02-01 18:11:09,/r/Coronavirus/comments/exh25q/should_we_cancel_the_superbowl/
fg8k301,-0.7184,-0.25,Hell nah. Morale.,Should we cancel the superbowl?,2020-02-01 18:11:09,/r/Coronavirus/comments/exh25q/should_we_cancel_the_superbowl/
fg8knam,-0.296,-0.25,No I got money on the line.,Should we cancel the superbowl?,2020-02-01 18:11:09,/r/Coronavirus/comments/exh25q/should_we_cancel_the_superbowl/
fg9gz85,0.128,-0.25,agree: cancel,Should we cancel the superbowl?,2020-02-01 18:11:09,/r/Coronavirus/comments/exh25q/should_we_cancel_the_superbowl/
fga7tc2,0.1531,-0.25,"lmao you're an idiot, 'inflect' thousands",Should we cancel the superbowl?,2020-02-01 18:11:09,/r/Coronavirus/comments/exh25q/should_we_cancel_the_superbowl/
fg85gdl,0.743,-0.25,The Super Bowl will have maybe 70k attendees. Today probably thirty basketball games were played in front of crowds of over 10k. Perspective.,Should we cancel the superbowl?,2020-02-01 18:11:09,/r/Coronavirus/comments/exh25q/should_we_cancel_the_superbowl/
fg8a5vp,0.0,-0.25,I’m rooting for the Chiefs. <—someone needed to do this.,Should we cancel the superbowl?,2020-02-01 18:11:09,/r/Coronavirus/comments/exh25q/should_we_cancel_the_superbowl/
fg84w3b,0.8221,-0.2732,"Twitter is generally an unreliable source. If possible, please re-submit with a link to a reliable source or the direct article.Note that you may also resubmit as a text post, just add a link and some explanatory text. Thank you for helping us keep information in /r/Conoravirus reliable!*I am a bot, and this action was performed automatically. Please [contact the moderators of this subreddit](/message/compose/?to=/r/Coronavirus) if you have any questions or concerns.*",china stating they are cremating all bodies because of risk of infection,2020-02-01 18:13:25,/r/Coronavirus/comments/exh3bz/china_stating_they_are_cremating_all_bodies/
fg85dva,0.3182,-0.2732,This is actually a reasonable and responsible thing to do.But...  uh...  tell us how many,china stating they are cremating all bodies because of risk of infection,2020-02-01 18:13:25,/r/Coronavirus/comments/exh3bz/china_stating_they_are_cremating_all_bodies/
fg85pv6,0.4728,-0.2732,"This is most likely true and standard practice for epidemic outbreaks.Now, how many, that's the real question.",china stating they are cremating all bodies because of risk of infection,2020-02-01 18:13:25,/r/Coronavirus/comments/exh3bz/china_stating_they_are_cremating_all_bodies/
fg856gz,0.0,-0.2732,Oh are they finally admitting even though we have know for days they have been running crematoriums 24/7,china stating they are cremating all bodies because of risk of infection,2020-02-01 18:13:25,/r/Coronavirus/comments/exh3bz/china_stating_they_are_cremating_all_bodies/
fg887ub,-0.9966,-0.2732,"article:http://www.bjd.com.cn/a/202002/02/WS5e3615dde4b002ffe9940417.htmltranslated:After the death of patients with New Coronary Pneumonia, no farewell ceremony of corpses and other forms of funeral activities shall be conducted. The National Health Commission issued the ""Guidelines for the Placement of Remains of Pneumonia Patients Infected by New Coronavirus (Trial)"", which explicitly stated that the remains should be cremated in the nearest vicinity, and no burial or other means of preservation should be used, nor should they be removed.The document proposes to scientifically regulate the disposal of the remains of patients with new coronary pneumonia in accordance with the principles of ""people-oriented, legally regulated, timely and stable, cremation nearby, and suspected possession"", strengthen health protection, and prevent the risk of disease transmission. According to the regulations, after the death of patients with new crown pneumonia, the medical institution where they are located reports the health and administrative department at the same level, the health and administrative department notifies the civil affairs department at the same level, and the civil affairs department notifies the relevant funeral home to make preparations for the transportation and cremation of the remains. For the remains of dead patients with neo-coronary pneumonia, the medical staff of the medical institution where they are located shall disinfect and seal the remains in accordance with the ""Technical Guidelines for the Prevention and Control of New Coronavirus Infection in Medical Institutions (First Edition)"", and it is strictly forbidden to open them after sealing.The medical institution shall contact the funeral home as soon as possible after the completion of the sanitary and epidemic prevention treatment of the remains, issue a death certificate, and contact the relatives to agree to the cremation, and indicate in the transfer of the remains that the sanitary and epidemic prevention treatment has been carried out and the opinion of immediate cremation. If the relatives of patients with new coronary pneumonia refuse to be present or refuse to transfer the remains, they shall be persuaded by medical institutions and funeral parlours. If the persuasion is invalid, the medical institutions shall sign the remains and submit them to the funeral parlor for direct cremation. The public security organs in the jurisdiction shall cooperate in the relevant work.Regarding the transfer of corpses, the transportation of corpses must not be undertaken by units and individuals other than funeral homes. The funeral home will arrange full-time personnel and special corpses to the designated place of the medical institution, and transfer the remains to the designated special corpses according to the designated route to the funeral home. The disease prevention and control institution shall instruct medical personnel, personnel for the transportation and disposal of remains, etc., to carry out health protection in accordance with the requirements for protection from disease exposure.After the remains were delivered to the funeral parlour, the funeral parlour set up a special temporary passageway, and the funeral parlor's full-time staff directly sent the remains to a special cremation furnace for cremation. Remains must not be stored or visited, and it is strictly forbidden to open the sealed remains bag during the whole process. After the cremation was completed, the ashes of the funeral home were picked up by the service staff of the funeral home, and a cremation certificate was issued, which was handed over to relatives to take away. If the family refuses to take it away, it shall be treated as ashes of an unclaimed body.The remains of patients with neo-coronary pneumonia who died in this province (district, city) should be cremated nearby, and no burial or other means of preservation should be used, nor should they be removed. Remains of patients with neo-coronary pneumonia who died outside of this province (region, city) should not enter the province's territory and be cremated on the spot in accordance with the principle of proximity. After the death of patients with New Coronary Pneumonia, no farewell ceremony of corpses and other forms of funeral activities shall be conducted.According to the provisions of the Law on the Prevention and Treatment of Infectious Diseases, the remains of patients with new crown pneumonia of ethnic minorities must be cremated on the spot. After cremation, the ashes can be resettled according to national customs. If foreigners in China, people from Hong Kong, Macao and Taiwan die of pneumonia in the country due to a new coronavirus infection, the remains must be cremated on the spot according to the provisions of the Law on Prevention and Treatment of Infectious Diseases. The cremated ashes can be transported out of the country according to the wishes of the deceased's family members.The remains of patients with suspected neo-coronary pneumonia (including those who adopt prevention and control measures such as quarantine observation) shall be handled in accordance with the principle of ""suspected from existence"" to prevent the spread of the epidemic. Relevant expenses for the transportation and cremation of the remains shall be settled in accordance with relevant regulations.",china stating they are cremating all bodies because of risk of infection,2020-02-01 18:13:25,/r/Coronavirus/comments/exh3bz/china_stating_they_are_cremating_all_bodies/
fg85y7c,-0.6486,-0.2732,Estimate of dead based on crematorium numbers [https://sinoinsider.com/2020/01/risk-watch-wuhan-coronavirus-death-count-could-be-35-times-higher-than-the-official-figure/](https://sinoinsider.com/2020/01/risk-watch-wuhan-coronavirus-death-count-could-be-35-times-higher-than-the-official-figure/),china stating they are cremating all bodies because of risk of infection,2020-02-01 18:13:25,/r/Coronavirus/comments/exh3bz/china_stating_they_are_cremating_all_bodies/
fg8cfvr,0.2732,-0.2732,Well we were wondering why there were  so many fires around wuhan earlier...guess now we know,china stating they are cremating all bodies because of risk of infection,2020-02-01 18:13:25,/r/Coronavirus/comments/exh3bz/china_stating_they_are_cremating_all_bodies/
fg8jv5k,-0.3566,-0.2732,"It sounds more than suspicious, now it'll be almost impossible to find the real number of deaths as a consequence of 2019-nCoV.",china stating they are cremating all bodies because of risk of infection,2020-02-01 18:13:25,/r/Coronavirus/comments/exh3bz/china_stating_they_are_cremating_all_bodies/
fga6257,-0.2023,-0.2732,"Oh, and if you are an enemy of the people, you just got the virus.  Come here and we'll treat you.",china stating they are cremating all bodies because of risk of infection,2020-02-01 18:13:25,/r/Coronavirus/comments/exh3bz/china_stating_they_are_cremating_all_bodies/
fg8g8oj,0.4939,-0.2732,"China cremate all body’s regardless, they outlaw ground burials to save land from cemeteries for developments",china stating they are cremating all bodies because of risk of infection,2020-02-01 18:13:25,/r/Coronavirus/comments/exh3bz/china_stating_they_are_cremating_all_bodies/
fg85jcg,0.0,-0.2732,"another source: (Global Times) (reputable, 1.6M followers, China's national English language newspaper)https://twitter.com/globaltimesnews/status/1223774570043232256",china stating they are cremating all bodies because of risk of infection,2020-02-01 18:13:25,/r/Coronavirus/comments/exh3bz/china_stating_they_are_cremating_all_bodies/
fg85jej,0.4939,-0.2732,I thought this article seemed pretty accurate in its information.[crematoriums](https://sinoinsider.com/2020/01/risk-watch-wuhan-coronavirus-death-count-could-be-35-times-higher-than-the-official-figure/),china stating they are cremating all bodies because of risk of infection,2020-02-01 18:13:25,/r/Coronavirus/comments/exh3bz/china_stating_they_are_cremating_all_bodies/
fg8ijl9,-0.3612,-0.2732,"Confirmed,  I found it difficult to find the link to copy.",china stating they are cremating all bodies because of risk of infection,2020-02-01 18:13:25,/r/Coronavirus/comments/exh3bz/china_stating_they_are_cremating_all_bodies/
fgc9mw9,-0.5994,-0.2732,Cremation is required for EVERY death in China.  Standard  process,china stating they are cremating all bodies because of risk of infection,2020-02-01 18:13:25,/r/Coronavirus/comments/exh3bz/china_stating_they_are_cremating_all_bodies/
fg880tu,0.0,-0.2732,Many,china stating they are cremating all bodies because of risk of infection,2020-02-01 18:13:25,/r/Coronavirus/comments/exh3bz/china_stating_they_are_cremating_all_bodies/
fgb1z3t,-0.6486,-0.2732,Shaun from Shaun of the Dead: lots,china stating they are cremating all bodies because of risk of infection,2020-02-01 18:13:25,/r/Coronavirus/comments/exh3bz/china_stating_they_are_cremating_all_bodies/
fgaaoj7,0.0,-0.2732,"Wait til they find out the virus survives in crematorium smoke!(kidding , everyone!)",china stating they are cremating all bodies because of risk of infection,2020-02-01 18:13:25,/r/Coronavirus/comments/exh3bz/china_stating_they_are_cremating_all_bodies/
fg86wt7,-0.6705,-0.2732,when was the last time any country burned dead bodies to prevent a disease from spreading?  Serious question.,china stating they are cremating all bodies because of risk of infection,2020-02-01 18:13:25,/r/Coronavirus/comments/exh3bz/china_stating_they_are_cremating_all_bodies/
fg89v8o,0.0,-0.2732,Wait but how do you know they've been running crematoriums for days on end?,china stating they are cremating all bodies because of risk of infection,2020-02-01 18:13:25,/r/Coronavirus/comments/exh3bz/china_stating_they_are_cremating_all_bodies/
fg8g4k0,0.0,-0.2732,Do we know how reputable this news source is?,china stating they are cremating all bodies because of risk of infection,2020-02-01 18:13:25,/r/Coronavirus/comments/exh3bz/china_stating_they_are_cremating_all_bodies/
fg8ckgs,-0.5574,-0.5994,Shit storm is about to hit,first death outside of china,2020-02-01 18:44:51,/r/Coronavirus/comments/exhjme/first_death_outside_of_china/
fg87l73,0.0,-0.5994,Anyone know the current confirmed cases in the phillipines?,first death outside of china,2020-02-01 18:44:51,/r/Coronavirus/comments/exhjme/first_death_outside_of_china/
fg87v15,0.5764,-0.5994,Thanks! Just saw the first confirmed case was 3 days ago???,first death outside of china,2020-02-01 18:44:51,/r/Coronavirus/comments/exhjme/first_death_outside_of_china/
fg8fx2f,0.0,-0.5994,I wonder how far its gonna spread.,first death outside of china,2020-02-01 18:44:51,/r/Coronavirus/comments/exhjme/first_death_outside_of_china/
fgay5hz,0.0,-0.5994,"I was wondering when it would happen, but I didn't expect it to be the first day of this month, though.",first death outside of china,2020-02-01 18:44:51,/r/Coronavirus/comments/exhjme/first_death_outside_of_china/
fgaydfy,0.0,-0.5994,"I was wondering when it would happen, but I didn't expect it to happen yesterday, though.",first death outside of china,2020-02-01 18:44:51,/r/Coronavirus/comments/exhjme/first_death_outside_of_china/
fgayiro,0.0,-0.5994,"I was wondering when it would happen, but I didn't expect it to happen yesterday, though.",first death outside of china,2020-02-01 18:44:51,/r/Coronavirus/comments/exhjme/first_death_outside_of_china/
fgayv1v,0.0,-0.5994,"I was wondering when it would happen, but I didn't expect it to happen yesterday, though.",first death outside of china,2020-02-01 18:44:51,/r/Coronavirus/comments/exhjme/first_death_outside_of_china/
fg8k17e,0.0,-0.5994,Hurricane Shitina,first death outside of china,2020-02-01 18:44:51,/r/Coronavirus/comments/exhjme/first_death_outside_of_china/
fg8iu1g,0.0,-0.5994,"We are in the eye of the shiticane, Julian",first death outside of china,2020-02-01 18:44:51,/r/Coronavirus/comments/exhjme/first_death_outside_of_china/
fg87sdz,0.0,-0.5994,You can get updated stats from here. There is currently at least one more casehttps://bnonews.com/index.php/2020/01/the-latest-coronavirus-cases/,first death outside of china,2020-02-01 18:44:51,/r/Coronavirus/comments/exhjme/first_death_outside_of_china/
fg8m4po,-0.5574,-0.5994,"Speed at which labs can confirm nCov-19 is slow and a lack of testing kits globally has also shown down the process. That's why China has something like 100,000 suspected cases.Indonesia has had a number of suspected cases but none confirmed due to lack of resources to test the patients",first death outside of china,2020-02-01 18:44:51,/r/Coronavirus/comments/exhjme/first_death_outside_of_china/
fg89ijg,0.0,0.0,About time. 🙌,"Air Canada Suspending Flights to Beijing, Shanghai",2020-02-01 18:55:26,/r/Coronavirus/comments/exhp1k/air_canada_suspending_flights_to_beijing_shanghai/
fg8bmdx,0.3612,0.0,Are they suspending incoming flights too? Like Shanghai to Canada,"Air Canada Suspending Flights to Beijing, Shanghai",2020-02-01 18:55:26,/r/Coronavirus/comments/exhp1k/air_canada_suspending_flights_to_beijing_shanghai/
