Comment ID,Comment_VS,Title_VS,Comment,Title,Publish Date,Permalink
fg8n6ab,-0.1997,-0.2263,"For anyone holding their breath on this case, I did the same thing for a case near where I live. Luckily it was negative. I was constantly checking to see if the results were in. It took almost 5 days before we got the results. I don't know why it's that long, but hopefully, this one moves quicker.It's interesting because before I waited on the case near me, I didn't even think about the likelihood that the ""confirmed cases"" are people who were actually tested days ago. So just for example, if there's a consistent 5-day delay between the test and the results, that just means that the official numbers are even more screwed up. Just a thought.","New York City Eyes First Suspected Case of Coronavirus, Officials Say",2020-02-01 13:53:09,/r/Coronavirus/comments/exd9k5/new_york_city_eyes_first_suspected_case_of/
fg8x6u8,0.3612,-0.2263,Looks like I'm staying home,"New York City Eyes First Suspected Case of Coronavirus, Officials Say",2020-02-01 13:53:09,/r/Coronavirus/comments/exd9k5/new_york_city_eyes_first_suspected_case_of/
fg8rrx7,0.0,-0.2263,"“You have now entered the dark zone, transmissions jammed, proximity coverage only.”","New York City Eyes First Suspected Case of Coronavirus, Officials Say",2020-02-01 13:53:09,/r/Coronavirus/comments/exd9k5/new_york_city_eyes_first_suspected_case_of/
fg7txmg,0.2023,-0.2263,"I'm surprised too.  Been asking my husband ""why isn't there a case in NYC yet""? Things could get pretty ugly when these cases multiply.","New York City Eyes First Suspected Case of Coronavirus, Officials Say",2020-02-01 13:53:09,/r/Coronavirus/comments/exd9k5/new_york_city_eyes_first_suspected_case_of/
fg83768,0.0,-0.2263,"same, I thought we were gonna have at least one case by now","New York City Eyes First Suspected Case of Coronavirus, Officials Say",2020-02-01 13:53:09,/r/Coronavirus/comments/exd9k5/new_york_city_eyes_first_suspected_case_of/
fg7u9ya,0.0,-0.2263,For 48 hours,"New York City Eyes First Suspected Case of Coronavirus, Officials Say",2020-02-01 13:53:09,/r/Coronavirus/comments/exd9k5/new_york_city_eyes_first_suspected_case_of/
fg86yzr,0.2732,-0.2263,"I read a post on one of the corono subs that said to look for the first week of February. If we get through this week, we might dodge a bullet. If we start seeing cases pop up in various spots, well it’s going to be a long month.","New York City Eyes First Suspected Case of Coronavirus, Officials Say",2020-02-01 13:53:09,/r/Coronavirus/comments/exd9k5/new_york_city_eyes_first_suspected_case_of/
fg7xhm8,0.6603,-0.2263,"Shocking it is, but with the initial confirmed Boston case the BOS-NY Chinatowns’ el cheapo bus sprints unfortunately may enable more infectious opportunities. Hope not!","New York City Eyes First Suspected Case of Coronavirus, Officials Say",2020-02-01 13:53:09,/r/Coronavirus/comments/exd9k5/new_york_city_eyes_first_suspected_case_of/
fg7wshp,0.0,-0.2263,Is that the time of a test result?,"New York City Eyes First Suspected Case of Coronavirus, Officials Say",2020-02-01 13:53:09,/r/Coronavirus/comments/exd9k5/new_york_city_eyes_first_suspected_case_of/
fg8vwz6,0.0772,-0.2263,Link to post? Want to check their math,"New York City Eyes First Suspected Case of Coronavirus, Officials Say",2020-02-01 13:53:09,/r/Coronavirus/comments/exd9k5/new_york_city_eyes_first_suspected_case_of/
fg7zf4x,0.296,-0.2263,Yeah those busses go everywhere.  Especially to casinos.,"New York City Eyes First Suspected Case of Coronavirus, Officials Say",2020-02-01 13:53:09,/r/Coronavirus/comments/exd9k5/new_york_city_eyes_first_suspected_case_of/
fg80b6p,0.1779,-0.2263,"Quarantine time. If they extend it, NYC *is gonna have a baaaaad time*.","New York City Eyes First Suspected Case of Coronavirus, Officials Say",2020-02-01 13:53:09,/r/Coronavirus/comments/exd9k5/new_york_city_eyes_first_suspected_case_of/
fgazw3h,0.0,-0.2263,"I tried to find it just now and can't. They based it off when travel restrictions were put in place, R0, and incubation stage. Guess we'll be finding out soon anyway.","New York City Eyes First Suspected Case of Coronavirus, Officials Say",2020-02-01 13:53:09,/r/Coronavirus/comments/exd9k5/new_york_city_eyes_first_suspected_case_of/
fg7k7at,0.0,0.4939,--,The WA state patient has been treated successfully.,2020-02-01 13:59:53,/r/Coronavirus/comments/exdd21/the_wa_state_patient_has_been_treated_successfully/
fg7kdc8,-0.34,0.4939,Mind you he went from a small cough to acute pneumonia and near death in like 24 hours. It was not until they used an experimental drug that he recovered.,The WA state patient has been treated successfully.,2020-02-01 13:59:53,/r/Coronavirus/comments/exdd21/the_wa_state_patient_has_been_treated_successfully/
fg7mqt3,0.4023,0.4939,"""The patient"" as if washington is only going to have 1.  Brace yourselves.  Dont panic, prepare.",The WA state patient has been treated successfully.,2020-02-01 13:59:53,/r/Coronavirus/comments/exdd21/the_wa_state_patient_has_been_treated_successfully/
fg7nbg1,0.0948,0.4939,What’s interesting and there are other articles that they used an antiviral call Remdisivir on the patient that is used on Ebola patients. They say they are not sure of effect because again it is 1 patient but it’s also being tested in China.,The WA state patient has been treated successfully.,2020-02-01 13:59:53,/r/Coronavirus/comments/exdd21/the_wa_state_patient_has_been_treated_successfully/
fg7p1nf,-0.4767,0.4939,"Treated is not recovered and he's still in the ICU with the status of ""satisfactory"", whatever the hell that means.",The WA state patient has been treated successfully.,2020-02-01 13:59:53,/r/Coronavirus/comments/exdd21/the_wa_state_patient_has_been_treated_successfully/
fg7otln,0.2048,0.4939,"Article states walking pneumonia which isn’t a severe case. Pretty common with a lot of upper respiratory infections. Not saying it’s a good thing regardless, but it’s assuring that it wasn’t anything more severe",The WA state patient has been treated successfully.,2020-02-01 13:59:53,/r/Coronavirus/comments/exdd21/the_wa_state_patient_has_been_treated_successfully/
fg8ce36,0.3182,0.4939,"I had a mild cold last January for 3 days that turned into walking pneumonia that was easily treated.  This isn't so unusual that it's something to be that scared of.  Yeah, you'd be better off not getting this particular virus, but it's not going to do anything to you that any other common virus can't do, it just may be a little more likely to do so.",The WA state patient has been treated successfully.,2020-02-01 13:59:53,/r/Coronavirus/comments/exdd21/the_wa_state_patient_has_been_treated_successfully/
fg7kpir,0.0,0.4939,Where did it mention that?,The WA state patient has been treated successfully.,2020-02-01 13:59:53,/r/Coronavirus/comments/exdd21/the_wa_state_patient_has_been_treated_successfully/
fg7otxv,0.0,0.4939,It says in the report dude went to work for 2 days before going to the hospital. Ughhh,The WA state patient has been treated successfully.,2020-02-01 13:59:53,/r/Coronavirus/comments/exdd21/the_wa_state_patient_has_been_treated_successfully/
fg7wibo,0.2584,0.4939,In the report someone posted above it says all symptoms except cough are gone. Maybe keeping him until they know it’s not contagious?,The WA state patient has been treated successfully.,2020-02-01 13:59:53,/r/Coronavirus/comments/exdd21/the_wa_state_patient_has_been_treated_successfully/
fg7uppc,0.0,0.4939,Apparently “Satisfactory” translates to “Not Dead.”,The WA state patient has been treated successfully.,2020-02-01 13:59:53,/r/Coronavirus/comments/exdd21/the_wa_state_patient_has_been_treated_successfully/
fg7kuqm,0.0,0.4939,You can read the entire case study here https://www.nejm.org/doi/full/10.1056/NEJMoa2001191,The WA state patient has been treated successfully.,2020-02-01 13:59:53,/r/Coronavirus/comments/exdd21/the_wa_state_patient_has_been_treated_successfully/
fg7yddo,0.6478,0.4939,"Thanks for this bro, you need to post this as a thread. This journal is very well written. I learned a lot.",The WA state patient has been treated successfully.,2020-02-01 13:59:53,/r/Coronavirus/comments/exdd21/the_wa_state_patient_has_been_treated_successfully/
fg7lc4g,0.5423,0.4939,Thank you. Small cough to near death in 24 hours is a bit of a stretch though. Glad this guy is doing good.,The WA state patient has been treated successfully.,2020-02-01 13:59:53,/r/Coronavirus/comments/exdd21/the_wa_state_patient_has_been_treated_successfully/
fg7lgm9,0.0,0.4939,They gave him an experimental treatment.,The WA state patient has been treated successfully.,2020-02-01 13:59:53,/r/Coronavirus/comments/exdd21/the_wa_state_patient_has_been_treated_successfully/
fg7oxxz,0.1154,0.4939,Yeah but nothing that put him “near death.” Pneumonia was worsening but that’s when they added in the experimental meds and he started to improve the next day.,The WA state patient has been treated successfully.,2020-02-01 13:59:53,/r/Coronavirus/comments/exdd21/the_wa_state_patient_has_been_treated_successfully/
fg7ng3w,0.0,0.4939,Source? Couldn’t find in report,The WA state patient has been treated successfully.,2020-02-01 13:59:53,/r/Coronavirus/comments/exdd21/the_wa_state_patient_has_been_treated_successfully/
fg7o8j6,0.4939,0.4939,"It's in the article that I posted above under case studies ""clinicians pursued compassionate use of an investigational antiviral therapy. Treatment with intravenous remdesivir""",The WA state patient has been treated successfully.,2020-02-01 13:59:53,/r/Coronavirus/comments/exdd21/the_wa_state_patient_has_been_treated_successfully/
fg7orys,0.0,0.4939,It’s in the report,The WA state patient has been treated successfully.,2020-02-01 13:59:53,/r/Coronavirus/comments/exdd21/the_wa_state_patient_has_been_treated_successfully/
fg7ohz5,0.4847,0.4939,I believe another pulmonary doctor commented on this report stating the person only experienced walking pneumonia. Not near death experience.,The WA state patient has been treated successfully.,2020-02-01 13:59:53,/r/Coronavirus/comments/exdd21/the_wa_state_patient_has_been_treated_successfully/
fg7m7yi,0.7469,0.0258,"I would suggest that people download as many of these videos as possible.  Some have been scrubbed, more will be, but its important to show these to friends and family that only watch mainstream news and dont understand the severity of this.",Wuhan - 9 deaths witnessed in one hospital in Wuhan over a matter of a few minutes,2020-02-01 14:12:57,/r/Coronavirus/comments/exdjem/wuhan_9_deaths_witnessed_in_one_hospital_in_wuhan/
fg7mv9k,-0.6908,0.0258,Your title makes it sounding like they all died within a few minutes after each other. From this video it is impossible to say when they died.,Wuhan - 9 deaths witnessed in one hospital in Wuhan over a matter of a few minutes,2020-02-01 14:12:57,/r/Coronavirus/comments/exdjem/wuhan_9_deaths_witnessed_in_one_hospital_in_wuhan/
fg7ow3q,-0.5423,0.0258,I work in the medical field. It's definitely not common to see people just dead in the lobby or hallways lol. China is lying and needs to pay the price .,Wuhan - 9 deaths witnessed in one hospital in Wuhan over a matter of a few minutes,2020-02-01 14:12:57,/r/Coronavirus/comments/exdjem/wuhan_9_deaths_witnessed_in_one_hospital_in_wuhan/
fg7p67c,0.875,0.0258,I feel like when I share first hand info with Friends and close relatives they think I am over reacting and prefer to believe whatever it says on the news,Wuhan - 9 deaths witnessed in one hospital in Wuhan over a matter of a few minutes,2020-02-01 14:12:57,/r/Coronavirus/comments/exdjem/wuhan_9_deaths_witnessed_in_one_hospital_in_wuhan/
fg7ozkf,0.1999,0.0258,Surely a city of 11 million people has the resources to dispose of 40 bodies a day without leaving them stacked up in a van in the carpark with the doors left open - doesnt seem like a normal procedure ...,Wuhan - 9 deaths witnessed in one hospital in Wuhan over a matter of a few minutes,2020-02-01 14:12:57,/r/Coronavirus/comments/exdjem/wuhan_9_deaths_witnessed_in_one_hospital_in_wuhan/
fg7lsvd,-0.5574,0.0258,How do we know they died within the span of minutes. They could be from hours ago,Wuhan - 9 deaths witnessed in one hospital in Wuhan over a matter of a few minutes,2020-02-01 14:12:57,/r/Coronavirus/comments/exdjem/wuhan_9_deaths_witnessed_in_one_hospital_in_wuhan/
fg9y9hf,0.119,0.0258,"Unlikely for western countries to experience anything close to this - the virus was able to spread for at least 6 weeks in Wuhan virtually uninhibited ... there’s no surprise factor anymore, governments are already starting to lockdown their borders and quarantine anyone showing symptoms.There is a very real chance of it exploding in third world/underdeveloped nations that don’t have the same infrastructure/medical capabilities/hygiene standards though",Wuhan - 9 deaths witnessed in one hospital in Wuhan over a matter of a few minutes,2020-02-01 14:12:57,/r/Coronavirus/comments/exdjem/wuhan_9_deaths_witnessed_in_one_hospital_in_wuhan/
fg7nlrb,0.6249,0.0258,"Well, in Wuhan there are about 40 deaths a day.  9 would be either expected or an improvement.",Wuhan - 9 deaths witnessed in one hospital in Wuhan over a matter of a few minutes,2020-02-01 14:12:57,/r/Coronavirus/comments/exdjem/wuhan_9_deaths_witnessed_in_one_hospital_in_wuhan/
fg8qkdr,-0.6504,0.0258,"Except we don't know the severity of this, because hundreds of people die every day in Wuhan from non-corona-causes.Dead bodies in a hospital should NOT be a shock. As I have said elsewhere, if people in Western countries start dropping dead, we will know it is far worse than China has reported. Given that there are dozens of cases globally, the prognosis will be pretty clear a week or two from now",Wuhan - 9 deaths witnessed in one hospital in Wuhan over a matter of a few minutes,2020-02-01 14:12:57,/r/Coronavirus/comments/exdjem/wuhan_9_deaths_witnessed_in_one_hospital_in_wuhan/
fg7n9kq,-0.5574,0.0258,Or even what they died from,Wuhan - 9 deaths witnessed in one hospital in Wuhan over a matter of a few minutes,2020-02-01 14:12:57,/r/Coronavirus/comments/exdjem/wuhan_9_deaths_witnessed_in_one_hospital_in_wuhan/
fg7n5zp,0.4588,0.0258,"I think I just got overly emotional. Can't figure out a way to edit the title. The security guard did mention that the bodies were from the last 24 hours, and that's just ONE hospital in Wuhan",Wuhan - 9 deaths witnessed in one hospital in Wuhan over a matter of a few minutes,2020-02-01 14:12:57,/r/Coronavirus/comments/exdjem/wuhan_9_deaths_witnessed_in_one_hospital_in_wuhan/
fg7pdx9,-0.4939,0.0258,"Well, I couldn’t believe it either until I saw those dead bodies stacked in a van",Wuhan - 9 deaths witnessed in one hospital in Wuhan over a matter of a few minutes,2020-02-01 14:12:57,/r/Coronavirus/comments/exdjem/wuhan_9_deaths_witnessed_in_one_hospital_in_wuhan/
fg8r6al,-0.9648,0.0258,"Except there are already hundreds of people dieing from non-corona causes. If Wuhan  has \~200-250 deaths per day (extrapolated from global death rate), 40 additional deaths would represent a 16-20% increase, something they may not be prepared for. Its obvious as hell their medical staff are completely overworked and bogged down, so bodies lying in beds isn't immediate cause for alarm either.   Either way we won't know for sure until people either start dropping dead in droves in Western countries or they don't.",Wuhan - 9 deaths witnessed in one hospital in Wuhan over a matter of a few minutes,2020-02-01 14:12:57,/r/Coronavirus/comments/exdjem/wuhan_9_deaths_witnessed_in_one_hospital_in_wuhan/
fg7uz10,-0.5657,0.0258,"Completely irrelevant. The comment/video to which you’re responding reflect a minimum number of deaths on one day, at one hospital. Based on this alone, we can deduce that we are not being provided with accurate info re: daily deaths stemming from this pandemic. What other inaccurate info/lies are we being told in an effort to make this seem less dire?",Wuhan - 9 deaths witnessed in one hospital in Wuhan over a matter of a few minutes,2020-02-01 14:12:57,/r/Coronavirus/comments/exdjem/wuhan_9_deaths_witnessed_in_one_hospital_in_wuhan/
fg7m0de,0.0516,0.0258,"They could. Still, that’s 9 deaths in one hospital in no more than a 24 hour period, according to the security guard in the video",Wuhan - 9 deaths witnessed in one hospital in Wuhan over a matter of a few minutes,2020-02-01 14:12:57,/r/Coronavirus/comments/exdjem/wuhan_9_deaths_witnessed_in_one_hospital_in_wuhan/
fg7oh03,-0.5574,0.0258,"I rewatched the video. There were only 3 bodies in that van at 28:12. Still, we don't know if they all died from coronavirus...",Wuhan - 9 deaths witnessed in one hospital in Wuhan over a matter of a few minutes,2020-02-01 14:12:57,/r/Coronavirus/comments/exdjem/wuhan_9_deaths_witnessed_in_one_hospital_in_wuhan/
fg7pox2,-0.8625,0.0258,"Forty is inaccurate. In a city of 10 million, 200 is more accurate. I saw a video saying there are 7 crematories in Wuhan that can process the dead usually 4 hours a day, but now they are working 24/7. Maybe the amount of dead is 4-6 times the normal, so around 1,000 deaths a day in Wuhan based on crematory operations.",Wuhan - 9 deaths witnessed in one hospital in Wuhan over a matter of a few minutes,2020-02-01 14:12:57,/r/Coronavirus/comments/exdjem/wuhan_9_deaths_witnessed_in_one_hospital_in_wuhan/
fg7nnqx,0.0,0.0258,"40 from all of Wuhan, 9 is just from this one hospital",Wuhan - 9 deaths witnessed in one hospital in Wuhan over a matter of a few minutes,2020-02-01 14:12:57,/r/Coronavirus/comments/exdjem/wuhan_9_deaths_witnessed_in_one_hospital_in_wuhan/
fg7nrd3,-0.0,-0.8176,"The limit of it is the sample testing capacity that added only around 2k per day.. if they can test effectively let say 20k, infected number would not linear.","UPDATE: 304 Dead, 13950 Infected",2020-02-01 14:25:17,/r/Coronavirus/comments/exdpnp/update_304_dead_13950_infected/
fg82v81,-0.2801,-0.8176,This is so sad. I hate that I’m fascinated by it. I hope the families that lost their loved ones can come out of this okay :(,"UPDATE: 304 Dead, 13950 Infected",2020-02-01 14:25:17,/r/Coronavirus/comments/exdpnp/update_304_dead_13950_infected/
fg7pzs1,-0.4404,-0.8176,Put a another 0 behind the infected number and I'll believe it.,"UPDATE: 304 Dead, 13950 Infected",2020-02-01 14:25:17,/r/Coronavirus/comments/exdpnp/update_304_dead_13950_infected/
fg7nh7e,0.4364,-0.8176,It seems very linear growth,"UPDATE: 304 Dead, 13950 Infected",2020-02-01 14:25:17,/r/Coronavirus/comments/exdpnp/update_304_dead_13950_infected/
fg7rf5e,-0.2263,-0.8176,"This is only Hubei province. Yesterday it was 1300 cases in hubei, today is 2,000 cases. Don’t think this is considered linear... also keep in mind that China as a whole has 17988 suspected cases waiting for results. There is only so many they can confirm/test a day.Sources: https://bnonews.com/index.php/2020/01/the-latest-coronavirus-cases/https://news.qq.com/zt2020/page/feiyan.htm?utm_name=iossmf","UPDATE: 304 Dead, 13950 Infected",2020-02-01 14:25:17,/r/Coronavirus/comments/exdpnp/update_304_dead_13950_infected/
fg9uvel,0.0,-0.8176,Does anyone else look at this and think the actual figures have another zero on the end?,"UPDATE: 304 Dead, 13950 Infected",2020-02-01 14:25:17,/r/Coronavirus/comments/exdpnp/update_304_dead_13950_infected/
fg7opw2,0.0,-0.8176,"Im hearing this is over because those recovered surpassed the deaths. Not the case yall , its just getting started","UPDATE: 304 Dead, 13950 Infected",2020-02-01 14:25:17,/r/Coronavirus/comments/exdpnp/update_304_dead_13950_infected/
fg7q8fe,0.0,-0.8176,"Again this is Hubei province only, we should see more soon","UPDATE: 304 Dead, 13950 Infected",2020-02-01 14:25:17,/r/Coronavirus/comments/exdpnp/update_304_dead_13950_infected/
fg8go06,-0.4023,-0.8176,"I don't trust the local news anymore, so is there anyone being diagnosed for nCov living in India ?","UPDATE: 304 Dead, 13950 Infected",2020-02-01 14:25:17,/r/Coronavirus/comments/exdpnp/update_304_dead_13950_infected/
fga5yok,0.3182,-0.8176,Add a 10-20x multiplier on that. God forbid a 30-50x. Everyone should be praying.,"UPDATE: 304 Dead, 13950 Infected",2020-02-01 14:25:17,/r/Coronavirus/comments/exdpnp/update_304_dead_13950_infected/
fg95f7s,0.0,-0.8176,14634 *,"UPDATE: 304 Dead, 13950 Infected",2020-02-01 14:25:17,/r/Coronavirus/comments/exdpnp/update_304_dead_13950_infected/
fgaam2l,0.2003,-0.8176,Other source says it is 420 cured vs 304 dead. Hope it's getting better!,"UPDATE: 304 Dead, 13950 Infected",2020-02-01 14:25:17,/r/Coronavirus/comments/exdpnp/update_304_dead_13950_infected/
fgakh8j,0.0,-0.8176,Kerala,"UPDATE: 304 Dead, 13950 Infected",2020-02-01 14:25:17,/r/Coronavirus/comments/exdpnp/update_304_dead_13950_infected/
fg7po8q,-0.0516,-0.8176,"It has to be that. There's no way it would be THIS linear of a spread. That just doesn't make sense given the number of people who live in China, and how fast it was growing for the first few days from the 23rd-28th","UPDATE: 304 Dead, 13950 Infected",2020-02-01 14:25:17,/r/Coronavirus/comments/exdpnp/update_304_dead_13950_infected/
fg84kwu,0.5145,-0.8176,"And to be fair, they can't say that someone has the disease unless they test them.  They can't say someone died of the disease unless they were tested for it.  The whole thing is limited by the amount of test kits available.","UPDATE: 304 Dead, 13950 Infected",2020-02-01 14:25:17,/r/Coronavirus/comments/exdpnp/update_304_dead_13950_infected/
fg7przj,0.0,-0.8176,Got a source on that?,"UPDATE: 304 Dead, 13950 Infected",2020-02-01 14:25:17,/r/Coronavirus/comments/exdpnp/update_304_dead_13950_infected/
fg7o7gf,0.3612,-0.8176,I agree,"UPDATE: 304 Dead, 13950 Infected",2020-02-01 14:25:17,/r/Coronavirus/comments/exdpnp/update_304_dead_13950_infected/
fg7t3vw,0.4754,-0.8176,So true,"UPDATE: 304 Dead, 13950 Infected",2020-02-01 14:25:17,/r/Coronavirus/comments/exdpnp/update_304_dead_13950_infected/
fg8v6pk,-0.5106,-0.8176,need update when it reaches 400 kills,"UPDATE: 304 Dead, 13950 Infected",2020-02-01 14:25:17,/r/Coronavirus/comments/exdpnp/update_304_dead_13950_infected/
fg7oitf,0.8513,0.552,"Beautiful! Idk how you guys do it, you should start a blog on how to become internet archivists and how to help on events like these!","The Coronavirus Papers unlocked: 5,352 scientific articles covering the coronavirus - fully searchable and free.",2020-02-01 14:32:41,/r/Coronavirus/comments/exdtjt/the_coronavirus_papers_unlocked_5352_scientific/
fg7s6nm,0.8885,0.552,"Woo-boy. This database gets the Aaron Swartz Award for contribution to the world at cost of great personal risk. Well done.Edit: Side recommendation for /r/DataHoarder , good community for all things archival.","The Coronavirus Papers unlocked: 5,352 scientific articles covering the coronavirus - fully searchable and free.",2020-02-01 14:32:41,/r/Coronavirus/comments/exdtjt/the_coronavirus_papers_unlocked_5352_scientific/
fg7rxwf,0.705,0.552,"yep...lots of important headlines in NYT, Washington Post and other online newspapers but can't read because of the paywall :(this kind of information should be free and public","The Coronavirus Papers unlocked: 5,352 scientific articles covering the coronavirus - fully searchable and free.",2020-02-01 14:32:41,/r/Coronavirus/comments/exdtjt/the_coronavirus_papers_unlocked_5352_scientific/
fg7zz1q,-0.2484,0.552,>I found an early-release coronavirus article with a $35.95 access fee for non-subscribers. The fury I felt brought tears to my eyeshttps://www.sci-hub.tw/Protect it. Love it. Cherish it.Btw look into the Elsevier dynasty. They make more then apple per annum trading knowledge. Very dirty family.,"The Coronavirus Papers unlocked: 5,352 scientific articles covering the coronavirus - fully searchable and free.",2020-02-01 14:32:41,/r/Coronavirus/comments/exdtjt/the_coronavirus_papers_unlocked_5352_scientific/
fg7wxp9,0.765,0.552,"If someone really wants an article that is behind a paywall, most of the time, if you email the author/s and ask for it they will email you it for free. Or if you go to your university library or city library they may be able to get it for you. But many researchers will email you it for free.","The Coronavirus Papers unlocked: 5,352 scientific articles covering the coronavirus - fully searchable and free.",2020-02-01 14:32:41,/r/Coronavirus/comments/exdtjt/the_coronavirus_papers_unlocked_5352_scientific/
fg7ymka,-0.296,0.552,"This one is missing and looks very important.""Angiotensin-converting enzyme 2 (ACE2) proteins of different bat species confer variable susceptibility to SARS-CoV entry""https://link.springer.com/content/pdf/10.1007/s00705-010-0729-6.pdfMade within the ""State Key Laboratory of Virology, Wuhan Institute of Virology"", probably talks about using HIV to enhance the SARS virus?","The Coronavirus Papers unlocked: 5,352 scientific articles covering the coronavirus - fully searchable and free.",2020-02-01 14:32:41,/r/Coronavirus/comments/exdtjt/the_coronavirus_papers_unlocked_5352_scientific/
fg81ogt,0.0,0.552,This article isn't peer-reviewed but looks very ominous.[https://www.medrxiv.org/content/10.1101/2020.01.27.20018952v1.full.pdf](https://www.medrxiv.org/content/10.1101/2020.01.27.20018952v1.full.pdf),"The Coronavirus Papers unlocked: 5,352 scientific articles covering the coronavirus - fully searchable and free.",2020-02-01 14:32:41,/r/Coronavirus/comments/exdtjt/the_coronavirus_papers_unlocked_5352_scientific/
