Comment ID,Comment_VS,Title_VS,Comment,Title,Publish Date,Permalink
fg62ybg,0.9382,-0.4215,"It may very well be, but I have read articles and journals about oil drilling because the process fascinates me, but that does not qualify me to have an authentic opinion about the subject. I truly mean no disrespect in that statement, it is just the truth in my opinion.","So after reading two articles, and two medical journals, I have legitimate fears that 2019-nCoV is a manufactured bioweapon that escaped the level four bio lab located in Wuhan.",2020-02-01 01:20:19,/r/Coronavirus/comments/ex3mjj/so_after_reading_two_articles_and_two_medical/
fg62ans,0.0,-0.4215,[deleted],"So after reading two articles, and two medical journals, I have legitimate fears that 2019-nCoV is a manufactured bioweapon that escaped the level four bio lab located in Wuhan.",2020-02-01 01:20:19,/r/Coronavirus/comments/ex3mjj/so_after_reading_two_articles_and_two_medical/
fg629ic,0.4833,-0.4215,And then the CCP started spreading the bag soup and market videos to cover up what they had done. There was a Harvard professor arrested the other day who was given $1.5 million to build a nanotechnology department in the Wuhan lab. He won some prestigious award at Harvard for an injectable mesh that can interface with your brain. 😳🤦🏻‍♀️ Not sure what China plans to do with that technology. https://www.technologyreview.com/f/615105/a-harvard-super-chemist-has-been-arrested-over-lying-about-secret-china-payments/,"So after reading two articles, and two medical journals, I have legitimate fears that 2019-nCoV is a manufactured bioweapon that escaped the level four bio lab located in Wuhan.",2020-02-01 01:20:19,/r/Coronavirus/comments/ex3mjj/so_after_reading_two_articles_and_two_medical/
fg64x3q,-0.6956,-0.4215,"It's attributes are not abnormal for a coronavirus. Your own link to the Lancet journal indicates this. Specifically, ""Phylogenetic analysis revealed that 2019-nCoV fell within the subgenus Sarbecovirus of the genus Betacoronavirus, with a relatively long branch length to its closest relatives bat-SL-CoVZC45 and bat-SL-CoVZXC21, and was genetically distinct from SARS-CoV."" Which is to say, it is not abnormal for a coronavirus at all. It's different, yes, as all different types of coronavirus are. The common cold is a coronavirus, and it's ""abnormal"" compared to SARS and compared to this new virus. That difference is relatively meaningless.The journal article you've linked has been roundly criticized. In fact, your own Lancet journal article confounds their findings without intending to when they discuss the relationship between the genetic differences and the database profile. They even prognosticate a bit there about the most likely connections (hint, it's not HIV) on the way to indicating a third-party transmission between the bat forms, the animal intermediary, and its evolution into something with the ability for human transmission.Your article about the Harvard researcher is unrelated and connected only by your paranoia. And just because a virus is ""new"" and ""different"" than other viruses does not mean that it is any more or less infectious or deadly. Viruses evolve novel forms *all the time;* this is partially why the flu shot changes every year. The R0 and mortality rate is still in dispute, but the idea that this is anything more than a naturally evolved viral mutation is absurd and and posting crap like this is irresponsible on your part.","So after reading two articles, and two medical journals, I have legitimate fears that 2019-nCoV is a manufactured bioweapon that escaped the level four bio lab located in Wuhan.",2020-02-01 01:20:19,/r/Coronavirus/comments/ex3mjj/so_after_reading_two_articles_and_two_medical/
fg6gue2,-0.4588,-0.4215,"From my own deep dive into this, I would speculate that there is a >50% chance that the likely cause of the outbreak is an accidental laboratory acquired infection (LAI) of a strain of SARS from one of China's infectious disease labs, likely the new biosecurity level 4 (BSL-4) lab in Wuhan. Several articles have been written that warn about the poor adherence to proper infectious disease handling protocols in Chinese research and testing laboratories. Articles also detail several instances where SARS escaped from laboratories via infection of lab workers in both China (2004) and Singapore (2003). Therefore, it is not stretch by any means that this may have been the potential cause of the current 2019-nCoV outbreak.Sources:WHO - Virology Lab Is Focus Of Latest SARS Outbreak In China (May, 2004) : https://www.sciencedaily.com/releases/2004/05/040510020956.htmJournal article detailing SARS LAI from a BSL-3 lab in Singapore in August, 2003 (Article from 2004): https://www.nejm.org/doi/full/10.1056/NEJMoa032565More recent large LAI event (disease other than SARS)Chinese institutes investigate pathogen outbreaks in lab workers (December, 2019): https://www.nature.com/articles/d41586-019-03863-z","So after reading two articles, and two medical journals, I have legitimate fears that 2019-nCoV is a manufactured bioweapon that escaped the level four bio lab located in Wuhan.",2020-02-01 01:20:19,/r/Coronavirus/comments/ex3mjj/so_after_reading_two_articles_and_two_medical/
fg65ijq,0.5962,-0.4215,You make the verdict that it's engineered based on your knowldge. Then it gives you sufficient reason to believe it's exactly the one that engineered in that specific lab??? And hence released by China?Wow. What a reasonable inference to prove the argument. So easily legitimate. What a discrimination and lack of compassion towards Chinese people.,"So after reading two articles, and two medical journals, I have legitimate fears that 2019-nCoV is a manufactured bioweapon that escaped the level four bio lab located in Wuhan.",2020-02-01 01:20:19,/r/Coronavirus/comments/ex3mjj/so_after_reading_two_articles_and_two_medical/
fg68666,0.2023,-0.4215,"Molecular  biologist here, I have some  knowledge on molecular virology. Those  inserts means nothing, they are  only 6 aminoacids, they are also in  other proteins and they are simple  common domains. You can find them in  Bat-CoV too and they are not unique  of HIV, you can BLASTp them  yourselves.other argumentations here:  [https://www.reddit.com/r/China\_Flu/comments/ewuotw/discussion\_biorxiv\_preprint\_on\_2019ncov\_spike/](https://www.reddit.com/r/China_Flu/comments/ewuotw/discussion_biorxiv_preprint_on_2019ncov_spike/)  And please, before making such assumptions, educate yourself. This is just fearmongering and It makes only harm. :)","So after reading two articles, and two medical journals, I have legitimate fears that 2019-nCoV is a manufactured bioweapon that escaped the level four bio lab located in Wuhan.",2020-02-01 01:20:19,/r/Coronavirus/comments/ex3mjj/so_after_reading_two_articles_and_two_medical/
fg6871u,0.7233,-0.4215,It’s looking more and more like it’s been manufactured. How it got out is anyone’s guess. The good thing is they will likely have a vaccine. So that means a plucky little company somewhere will accidentally find the cure. Just like that Canadian company found the cure to Ebola rather quickly.,"So after reading two articles, and two medical journals, I have legitimate fears that 2019-nCoV is a manufactured bioweapon that escaped the level four bio lab located in Wuhan.",2020-02-01 01:20:19,/r/Coronavirus/comments/ex3mjj/so_after_reading_two_articles_and_two_medical/
fg6dd2n,-0.3182,-0.4215,I am starting to believe the conspiracy as well.,"So after reading two articles, and two medical journals, I have legitimate fears that 2019-nCoV is a manufactured bioweapon that escaped the level four bio lab located in Wuhan.",2020-02-01 01:20:19,/r/Coronavirus/comments/ex3mjj/so_after_reading_two_articles_and_two_medical/
fg6eyi3,0.0,-0.4215,Can anyone give a quick tl;dr,"So after reading two articles, and two medical journals, I have legitimate fears that 2019-nCoV is a manufactured bioweapon that escaped the level four bio lab located in Wuhan.",2020-02-01 01:20:19,/r/Coronavirus/comments/ex3mjj/so_after_reading_two_articles_and_two_medical/
fg6btia,0.5423,-0.4215,This is fascinating. Everyone should watch this.,"So after reading two articles, and two medical journals, I have legitimate fears that 2019-nCoV is a manufactured bioweapon that escaped the level four bio lab located in Wuhan.",2020-02-01 01:20:19,/r/Coronavirus/comments/ex3mjj/so_after_reading_two_articles_and_two_medical/
fg6dnad,-0.4118,-0.4215,Not exactly “absurd”. The fact that this virus started in the same location as the only BSL4 lab in China is enough reason to be concerned. The chance of that being a random occurrence is less than 150-1.Could be a coincidence. But being suspicious or concerned is not “absurd”.,"So after reading two articles, and two medical journals, I have legitimate fears that 2019-nCoV is a manufactured bioweapon that escaped the level four bio lab located in Wuhan.",2020-02-01 01:20:19,/r/Coronavirus/comments/ex3mjj/so_after_reading_two_articles_and_two_medical/
fg6du8o,0.0,-0.4215,"Related question, how many genes does the virus have and where would one find that information?","So after reading two articles, and two medical journals, I have legitimate fears that 2019-nCoV is a manufactured bioweapon that escaped the level four bio lab located in Wuhan.",2020-02-01 01:20:19,/r/Coronavirus/comments/ex3mjj/so_after_reading_two_articles_and_two_medical/
fg6sm03,0.2732,-0.4215,"It takes about a year+ for a vaccine to be developed, you have to go through the actual creation, clinical testing, human testing, and THEN you can release it","So after reading two articles, and two medical journals, I have legitimate fears that 2019-nCoV is a manufactured bioweapon that escaped the level four bio lab located in Wuhan.",2020-02-01 01:20:19,/r/Coronavirus/comments/ex3mjj/so_after_reading_two_articles_and_two_medical/
fg63jhf,-0.3818,-0.3818,SARS stats:[*http://www*.diaspoir.net/health/sars/Total.html](http://www.diaspoir.net/health/sars/Total.html)*2009* Swine Flu stats:[\*https://\*en.wikipedia.org/wiki/2009\_flu\_pandemic\_table\_April\_2009](https://en.wikipedia.org/wiki/2009_flu_pandemic_table_April_2009)Current outbreak stats:\*https://\*[bnonews.com/index.php/*2020*/01/the-latest-coronavirus-cases/](https://bnonews.com/index.php/2020/01/the-latest-coronavirus-cases/),"Two charts representing the Deaths per day and Infections Per Day of 2019-nCoV, SARS, and the 2009 swine flu. Links to sources in the comments.",2020-02-01 02:08:44,/r/Coronavirus/comments/ex433g/two_charts_representing_the_deaths_per_day_and/
fg6zt8f,0.5267,-0.3818,Can you do a recover chart as well please?,"Two charts representing the Deaths per day and Infections Per Day of 2019-nCoV, SARS, and the 2009 swine flu. Links to sources in the comments.",2020-02-01 02:08:44,/r/Coronavirus/comments/ex433g/two_charts_representing_the_deaths_per_day_and/
fg65mjm,-0.1719,-0.3818,Ah. Well that's... Not encouraging....,"Two charts representing the Deaths per day and Infections Per Day of 2019-nCoV, SARS, and the 2009 swine flu. Links to sources in the comments.",2020-02-01 02:08:44,/r/Coronavirus/comments/ex433g/two_charts_representing_the_deaths_per_day_and/
fg6icyr,0.0,-0.3818,Uh oh,"Two charts representing the Deaths per day and Infections Per Day of 2019-nCoV, SARS, and the 2009 swine flu. Links to sources in the comments.",2020-02-01 02:08:44,/r/Coronavirus/comments/ex433g/two_charts_representing_the_deaths_per_day_and/
fg63jpo,-0.6966,-0.3818,"**2009 flu pandemic table April 2009**This is a table containing the figures from the WHO Influenza A Situation Updates issued in April 2009 roughly once a day.  Where more than one update was issued in a day, the figures are from the last update that day.  The table can by sorted by country, date of first confirmed case or date of first confirmed case by continent.This presentation of the data in these and other tables shows the progression, peaks, and, eventually, decline of the epidemic in each country and continent.***^[ [^PM](https://www.reddit.com/message/compose?to=kittens_from_space) ^| [^Exclude ^me](https://reddit.com/message/compose?to=WikiTextBot&message=Excludeme&subject=Excludeme) ^| [^Exclude ^from ^subreddit](https://np.reddit.com/r/Coronavirus/about/banned) ^| [^FAQ ^/ ^Information](https://np.reddit.com/r/WikiTextBot/wiki/index) ^| [^Source](https://github.com/kittenswolf/WikiTextBot)   ^]^Downvote ^to ^remove ^| ^v0.28","Two charts representing the Deaths per day and Infections Per Day of 2019-nCoV, SARS, and the 2009 swine flu. Links to sources in the comments.",2020-02-01 02:08:44,/r/Coronavirus/comments/ex433g/two_charts_representing_the_deaths_per_day_and/
fg6k7n8,0.0,-0.3818,From what I have read the outbreak started around 14th December. So shouldn’t it be close to 45 days now?,"Two charts representing the Deaths per day and Infections Per Day of 2019-nCoV, SARS, and the 2009 swine flu. Links to sources in the comments.",2020-02-01 02:08:44,/r/Coronavirus/comments/ex433g/two_charts_representing_the_deaths_per_day_and/
fg63ri5,0.0,0.0,Probably there are more cases but the fuckin ccp not gonna tell,"Wuhan Coronavirus Map for February 1st, 2020",2020-02-01 02:09:44,/r/Coronavirus/comments/ex43gk/wuhan_coronavirus_map_for_february_1st_2020/
fg66ywz,0.0,0.0,What is the % make vs female ??,"Wuhan Coronavirus Map for February 1st, 2020",2020-02-01 02:09:44,/r/Coronavirus/comments/ex43gk/wuhan_coronavirus_map_for_february_1st_2020/
fg661qa,0.0,0.0,Did you make this yourself or is there a website i could go to that updates this every day?,"Wuhan Coronavirus Map for February 1st, 2020",2020-02-01 02:09:44,/r/Coronavirus/comments/ex43gk/wuhan_coronavirus_map_for_february_1st_2020/
fg68co2,0.3147,0.0,"Tracking suspected cases will be important now that we know new infections are outpacing the number of people they can test daily. 3.6 roentgen, folks. Not great but also not terrible","Wuhan Coronavirus Map for February 1st, 2020",2020-02-01 02:09:44,/r/Coronavirus/comments/ex43gk/wuhan_coronavirus_map_for_february_1st_2020/
fg6gso2,0.3612,0.0,Thank you for this information,"Wuhan Coronavirus Map for February 1st, 2020",2020-02-01 02:09:44,/r/Coronavirus/comments/ex43gk/wuhan_coronavirus_map_for_february_1st_2020/
fg7fwor,-0.4215,0.0,You can tell by the map that most of the spread was caused by travel and people fleeing. Way to go Wuhan- ANNOUNCE the freaking quarantine  BEFORE it happens. Idiots. 5 million people left the city.,"Wuhan Coronavirus Map for February 1st, 2020",2020-02-01 02:09:44,/r/Coronavirus/comments/ex43gk/wuhan_coronavirus_map_for_february_1st_2020/
fg6f2v5,0.0,0.0,Why are there some countries with cases but not painted in the map?,"Wuhan Coronavirus Map for February 1st, 2020",2020-02-01 02:09:44,/r/Coronavirus/comments/ex43gk/wuhan_coronavirus_map_for_february_1st_2020/
fg672tl,-0.8645,0.0,"I know we can't draw any solid conclusions here, but mortality rate is determed by looking at confirmed cases and comparing the # that recovered to the # that died. By latest count, there are more dead than recovered.Does that tell us anything remotely useful?","Wuhan Coronavirus Map for February 1st, 2020",2020-02-01 02:09:44,/r/Coronavirus/comments/ex43gk/wuhan_coronavirus_map_for_february_1st_2020/
fg6cr72,0.0,0.0,"i cant find it and cant scan it either, link?","Wuhan Coronavirus Map for February 1st, 2020",2020-02-01 02:09:44,/r/Coronavirus/comments/ex43gk/wuhan_coronavirus_map_for_february_1st_2020/
fg6fm5g,0.0,0.0,"The count of cases is NOT going up based on actual cases but at the rate they produce testing kits.  All the projections assume that China has enough testing kits, which they do not.","Wuhan Coronavirus Map for February 1st, 2020",2020-02-01 02:09:44,/r/Coronavirus/comments/ex43gk/wuhan_coronavirus_map_for_february_1st_2020/
fg6fqze,0.0,0.0,So to get in WeChat you have to contact a user already there to get them to scan a QR.  how the he’ll do I do that if I’m not on WeChat?  🤷‍♂️,"Wuhan Coronavirus Map for February 1st, 2020",2020-02-01 02:09:44,/r/Coronavirus/comments/ex43gk/wuhan_coronavirus_map_for_february_1st_2020/
fg71u14,0.0,0.0,Why isn’t uk highlighted on the map? Is it because the 2 cases recovered?,"Wuhan Coronavirus Map for February 1st, 2020",2020-02-01 02:09:44,/r/Coronavirus/comments/ex43gk/wuhan_coronavirus_map_for_february_1st_2020/
fg78p7q,0.0,0.0,I wonder what would happen if just 1 infection occurs in North Korea. That would probably be overkill.,"Wuhan Coronavirus Map for February 1st, 2020",2020-02-01 02:09:44,/r/Coronavirus/comments/ex43gk/wuhan_coronavirus_map_for_february_1st_2020/
fg79x3r,-0.5585,0.0,"Even if it may not kill very well, I still don't want this. I bet it's more miserable than the flu.","Wuhan Coronavirus Map for February 1st, 2020",2020-02-01 02:09:44,/r/Coronavirus/comments/ex43gk/wuhan_coronavirus_map_for_february_1st_2020/
fg7g3v5,0.0,0.0,US now has 8 btw.,"Wuhan Coronavirus Map for February 1st, 2020",2020-02-01 02:09:44,/r/Coronavirus/comments/ex43gk/wuhan_coronavirus_map_for_february_1st_2020/
fg63t8v,0.0,0.0,Ya. I think the current HK estimate was around 70k right?,"Wuhan Coronavirus Map for February 1st, 2020",2020-02-01 02:09:44,/r/Coronavirus/comments/ex43gk/wuhan_coronavirus_map_for_february_1st_2020/
fg66dzf,0.0,0.0,I got this from the Hangzhou Expat's wechat page. Do you have wechat?,"Wuhan Coronavirus Map for February 1st, 2020",2020-02-01 02:09:44,/r/Coronavirus/comments/ex43gk/wuhan_coronavirus_map_for_february_1st_2020/
fg66o6f,0.0,0.0,"Hangzhou expat website, on WeChat.","Wuhan Coronavirus Map for February 1st, 2020",2020-02-01 02:09:44,/r/Coronavirus/comments/ex43gk/wuhan_coronavirus_map_for_february_1st_2020/
fg67738,-0.5106,0.0,"Only people who have been followed up with that were sick and recovered tend to be in European countries. Not a large amount, and makes you wonder if the virus is much harder on Asians.","Wuhan Coronavirus Map for February 1st, 2020",2020-02-01 02:09:44,/r/Coronavirus/comments/ex43gk/wuhan_coronavirus_map_for_february_1st_2020/
fg6fdnr,0.9127,0.0,As a Chinese I laughed first time I saw these pics but then I don't think they are funny anymore… Masks are out of sale everywhere and some elder people are not able to get information as fast as young ones. What if some of them are living in the most effected areas and these are the best they can do to survive…,Wuhan Coronavirus face-mask ingenuity,2020-02-01 02:25:37,/r/Coronavirus/comments/ex48r6/wuhan_coronavirus_facemask_ingenuity/
fg66hg8,0.4588,0.0,"I mean, at some degree these are valid masks and might be better than a simply N95.They prevent you to touch face, nose, mouth, eyes.",Wuhan Coronavirus face-mask ingenuity,2020-02-01 02:25:37,/r/Coronavirus/comments/ex48r6/wuhan_coronavirus_facemask_ingenuity/
fg67c46,0.8885,0.0,The funniest thing ... Why not just use a full face motorbike helmet... At least you will look a bit cool and can clean it down easy.,Wuhan Coronavirus face-mask ingenuity,2020-02-01 02:25:37,/r/Coronavirus/comments/ex48r6/wuhan_coronavirus_facemask_ingenuity/
fg68t2n,-0.5563,0.0,"""It appears the containment system has completely failed..."" - Half-Life / Black Mesa",Wuhan Coronavirus face-mask ingenuity,2020-02-01 02:25:37,/r/Coronavirus/comments/ex48r6/wuhan_coronavirus_facemask_ingenuity/
fg6imwb,0.5017,0.0,I rather look silly and not die.,Wuhan Coronavirus face-mask ingenuity,2020-02-01 02:25:37,/r/Coronavirus/comments/ex48r6/wuhan_coronavirus_facemask_ingenuity/
fg6ikh1,0.0927,0.0,"This is more sad than interesting. If the regular, cheap, mass produced ones were available people wouldn't have to do this just to survive. People have always been creative, its not like that is anything new.",Wuhan Coronavirus face-mask ingenuity,2020-02-01 02:25:37,/r/Coronavirus/comments/ex48r6/wuhan_coronavirus_facemask_ingenuity/
fg6pc2m,0.0,0.0,[deleted],Wuhan Coronavirus face-mask ingenuity,2020-02-01 02:25:37,/r/Coronavirus/comments/ex48r6/wuhan_coronavirus_facemask_ingenuity/
fg68wt7,-0.296,0.0,missing [this guy](https://nationalfile.com/report-chinese-man-uses-sanitary-pad-as-face-mask-in-coronavirus-crisis/),Wuhan Coronavirus face-mask ingenuity,2020-02-01 02:25:37,/r/Coronavirus/comments/ex48r6/wuhan_coronavirus_facemask_ingenuity/
fg6nsxb,-0.296,0.0,Are people in china really using GP-5s to stop the virus?,Wuhan Coronavirus face-mask ingenuity,2020-02-01 02:25:37,/r/Coronavirus/comments/ex48r6/wuhan_coronavirus_facemask_ingenuity/
fg6onzj,0.4404,0.0,I’m gonna go with the kfc bag as my fave.,Wuhan Coronavirus face-mask ingenuity,2020-02-01 02:25:37,/r/Coronavirus/comments/ex48r6/wuhan_coronavirus_facemask_ingenuity/
fg6su2v,-0.2444,0.0,Great ingenuity.   They see the problem and try and solve it the best they can with what they have and don't waste time blaming everybody else for the situation they are in.  Something the communist should learn from.  Your suffering is your own.  Blaming others has no value.  Once again Chinese people demonstrating why they are and never will be communists.  The worst virus ever unleashed was the mind virus of communism.  A mind virus that the West infected China with over 70 years ago.  The vaccine is coming.  The Chinese citizens have the solution to the communist plague.,Wuhan Coronavirus face-mask ingenuity,2020-02-01 02:25:37,/r/Coronavirus/comments/ex48r6/wuhan_coronavirus_facemask_ingenuity/
fg6ph74,0.0,0.0,[deleted],Wuhan Coronavirus face-mask ingenuity,2020-02-01 02:25:37,/r/Coronavirus/comments/ex48r6/wuhan_coronavirus_facemask_ingenuity/
fg688ve,-0.5411,0.0,It is called science you fools!,Wuhan Coronavirus face-mask ingenuity,2020-02-01 02:25:37,/r/Coronavirus/comments/ex48r6/wuhan_coronavirus_facemask_ingenuity/
fg6jv2j,-0.296,0.0,Why is there no batman mask oh wait,Wuhan Coronavirus face-mask ingenuity,2020-02-01 02:25:37,/r/Coronavirus/comments/ex48r6/wuhan_coronavirus_facemask_ingenuity/
fg6oi9m,-0.296,0.0,All it’s missing is a plague doctors mask,Wuhan Coronavirus face-mask ingenuity,2020-02-01 02:25:37,/r/Coronavirus/comments/ex48r6/wuhan_coronavirus_facemask_ingenuity/
fg6p6gf,-0.0516,0.0,I guess when your bored and stuck inside your home you get creative.,Wuhan Coronavirus face-mask ingenuity,2020-02-01 02:25:37,/r/Coronavirus/comments/ex48r6/wuhan_coronavirus_facemask_ingenuity/
fg6qq2e,-0.308,0.0,"Gosh, not suppose to laugh but dang, they are stylish!",Wuhan Coronavirus face-mask ingenuity,2020-02-01 02:25:37,/r/Coronavirus/comments/ex48r6/wuhan_coronavirus_facemask_ingenuity/
fg6qwky,0.804,0.0,Not suppose to laugh but these are dang stylish 👌🏻,Wuhan Coronavirus face-mask ingenuity,2020-02-01 02:25:37,/r/Coronavirus/comments/ex48r6/wuhan_coronavirus_facemask_ingenuity/
fg6y7oe,0.1531,0.0,pick your fighter,Wuhan Coronavirus face-mask ingenuity,2020-02-01 02:25:37,/r/Coronavirus/comments/ex48r6/wuhan_coronavirus_facemask_ingenuity/
fg71l2k,0.0,0.0,Bruh,Wuhan Coronavirus face-mask ingenuity,2020-02-01 02:25:37,/r/Coronavirus/comments/ex48r6/wuhan_coronavirus_facemask_ingenuity/
fg6gync,-0.6908,0.0,There is a joke that when the coronavirus reaches Romania it will die as soon as it is infected with our existing bugs in hospitals.,It's official: German tourist has been spreading coronavirus to Spain.,2020-02-01 03:02:35,/r/Coronavirus/comments/ex4lbo/its_official_german_tourist_has_been_spreading/
fg698uu,-0.7218,0.0,"Edit: extra info in the Spanish news, this guy flew to Tenerife not la gomera, and then took a ship to la gomera!!! He has been spreading it over 2 islands for god knows how long, obviously, the authorities are also hiding this information (a local canary island news paper found out this)I’m from Spain and just watched this in the news. This guy came with 5 German friends in a plane to la gomera island, he got infected from a coworker in Germany who travelled to China for business. Therefore, my logic says, that the chances more people got infected in the 4hour flight are pretty high. Here in Spain, our new government is taking this as a “joke”, you can see the guy infected in the news sunbathing at the balcony of the hospital with sunglasses like nothing is going on. Is this how you are supposed to treat a confirmed infected patient? Also, another brilliant idea of our Goverment, the 12 Spanish people who were trapped in wuhan and were deported back to Spain, they sent them to a hospital IN MADRID. Like wtf, Australia sends their people to a fucking island, and we take them to a hospital in the center of the most populated city. Governments sucks. All of them. They take things as a joke as they won’t be taking any risks.",It's official: German tourist has been spreading coronavirus to Spain.,2020-02-01 03:02:35,/r/Coronavirus/comments/ex4lbo/its_official_german_tourist_has_been_spreading/
fg6iioy,-0.7232,0.0,There is no stopping this virus. Too many stupid and selfish people.,It's official: German tourist has been spreading coronavirus to Spain.,2020-02-01 03:02:35,/r/Coronavirus/comments/ex4lbo/its_official_german_tourist_has_been_spreading/
fg6glx0,-0.2263,0.0,In the US they just let one suspected case go home before the test results came back from the CDC. https://www.google.com/amp/s/www.ksnt.com/news/local-news/lawrence-man-tested-for-coronavirus-now-home-from-the-hospital/amp/,It's official: German tourist has been spreading coronavirus to Spain.,2020-02-01 03:02:35,/r/Coronavirus/comments/ex4lbo/its_official_german_tourist_has_been_spreading/
