Comment ID,Comment_VS,Title_VS,Comment,Title,Publish Date,Permalink
fg6ms66,0.0,0.4215,Can you PM me the link?,"Mayor of Wuhan claims he was suppressed in saying the actual numbers of the outbreak. Makes sense now why they ordered hospitals to be build immediately, who knows what the true numbers are now after all this time.",2020-02-01 07:43:02,/r/Coronavirus/comments/ex7vfn/mayor_of_wuhan_claims_he_was_suppressed_in_saying/
fg6muoi,0.0,0.4215,I’ll take a pm too,"Mayor of Wuhan claims he was suppressed in saying the actual numbers of the outbreak. Makes sense now why they ordered hospitals to be build immediately, who knows what the true numbers are now after all this time.",2020-02-01 07:43:02,/r/Coronavirus/comments/ex7vfn/mayor_of_wuhan_claims_he_was_suppressed_in_saying/
fg6n2bw,0.5229,0.4215,Would like a link as well!!Didn't read this news yet!,"Mayor of Wuhan claims he was suppressed in saying the actual numbers of the outbreak. Makes sense now why they ordered hospitals to be build immediately, who knows what the true numbers are now after all this time.",2020-02-01 07:43:02,/r/Coronavirus/comments/ex7vfn/mayor_of_wuhan_claims_he_was_suppressed_in_saying/
fg6nd8i,0.0772,0.4215,Same. Link plz,"Mayor of Wuhan claims he was suppressed in saying the actual numbers of the outbreak. Makes sense now why they ordered hospitals to be build immediately, who knows what the true numbers are now after all this time.",2020-02-01 07:43:02,/r/Coronavirus/comments/ex7vfn/mayor_of_wuhan_claims_he_was_suppressed_in_saying/
fg6ng4p,0.0,0.4215,PM link???,"Mayor of Wuhan claims he was suppressed in saying the actual numbers of the outbreak. Makes sense now why they ordered hospitals to be build immediately, who knows what the true numbers are now after all this time.",2020-02-01 07:43:02,/r/Coronavirus/comments/ex7vfn/mayor_of_wuhan_claims_he_was_suppressed_in_saying/
fg6olqh,0.7096,0.4215,May I have a PM as well please. Thank you.,"Mayor of Wuhan claims he was suppressed in saying the actual numbers of the outbreak. Makes sense now why they ordered hospitals to be build immediately, who knows what the true numbers are now after all this time.",2020-02-01 07:43:02,/r/Coronavirus/comments/ex7vfn/mayor_of_wuhan_claims_he_was_suppressed_in_saying/
fg6oyae,0.0,0.4215,Gimme that sticky link daddy,"Mayor of Wuhan claims he was suppressed in saying the actual numbers of the outbreak. Makes sense now why they ordered hospitals to be build immediately, who knows what the true numbers are now after all this time.",2020-02-01 07:43:02,/r/Coronavirus/comments/ex7vfn/mayor_of_wuhan_claims_he_was_suppressed_in_saying/
fg73asj,0.3802,0.4215,please PM me the link!,"Mayor of Wuhan claims he was suppressed in saying the actual numbers of the outbreak. Makes sense now why they ordered hospitals to be build immediately, who knows what the true numbers are now after all this time.",2020-02-01 07:43:02,/r/Coronavirus/comments/ex7vfn/mayor_of_wuhan_claims_he_was_suppressed_in_saying/
fg7u2re,0.3182,0.4215,I guess.... Pm me too please,"Mayor of Wuhan claims he was suppressed in saying the actual numbers of the outbreak. Makes sense now why they ordered hospitals to be build immediately, who knows what the true numbers are now after all this time.",2020-02-01 07:43:02,/r/Coronavirus/comments/ex7vfn/mayor_of_wuhan_claims_he_was_suppressed_in_saying/
fg6pamk,0.0,0.4215,This is guy is soooooo going to get reeducated,"Mayor of Wuhan claims he was suppressed in saying the actual numbers of the outbreak. Makes sense now why they ordered hospitals to be build immediately, who knows what the true numbers are now after all this time.",2020-02-01 07:43:02,/r/Coronavirus/comments/ex7vfn/mayor_of_wuhan_claims_he_was_suppressed_in_saying/
fgbaj3e,-0.9749,0.4215,"I also had an insanely bad flu in London that started ~3 weeks ago (Sunday 12th Jan).Took 8 full days in bed to get back to being able to go to work. And I was still suffering from severe fatigue for a full week after that (~14 days total). I was seriously considering going to the hospital if it continued.If what the government says is true, it must have been a normal strain. But, I remember thinking this is a crazy weird flu- super harsh symptoms and it just refused to go away... like my body didn’t know what to do.My girlfriend started having the exact same weird harsh flu at the same time on the same day and had the same experience timeline. We are both very healthy people and both of us have never had a flu last longer than 3 days (in ~30 years) so we were both very weirded out.I travel A LOT for work and life and would be highly exposed to anything (reflecting on it... we were both oddly walking around NYC China Town about 5 days before this started- 6th/7th Jan... that would probably be one of the first likely places in the west that this could have made it out... creepy).I still struggle to link these- it would mean a complete failure of governments.But is it not possible that it got around the world earlier? I guess all it takes is a few people from the first group of infected in incubation periods to get on flights. P.S. I’m really not trying to fear monger- just my experience and whether it is feasible. But find it hard to believe a there would have to be other cases popping up in NYC/London...","Mayor of Wuhan claims he was suppressed in saying the actual numbers of the outbreak. Makes sense now why they ordered hospitals to be build immediately, who knows what the true numbers are now after all this time.",2020-02-01 07:43:02,/r/Coronavirus/comments/ex7vfn/mayor_of_wuhan_claims_he_was_suppressed_in_saying/
fg74zqw,0.0,0.4215,Hey can you send me that coronachan redacted link?,"Mayor of Wuhan claims he was suppressed in saying the actual numbers of the outbreak. Makes sense now why they ordered hospitals to be build immediately, who knows what the true numbers are now after all this time.",2020-02-01 07:43:02,/r/Coronavirus/comments/ex7vfn/mayor_of_wuhan_claims_he_was_suppressed_in_saying/
fg70nqb,-0.4522,0.4215,So is he refusing to be the fall guy?,"Mayor of Wuhan claims he was suppressed in saying the actual numbers of the outbreak. Makes sense now why they ordered hospitals to be build immediately, who knows what the true numbers are now after all this time.",2020-02-01 07:43:02,/r/Coronavirus/comments/ex7vfn/mayor_of_wuhan_claims_he_was_suppressed_in_saying/
fg6qyxs,-0.4019,-0.8126,Friend of mine once got in a fight and told the other guys he had aids. No one wanted to risk it,Unethical Pro Life Hack during nCov crisis,2020-02-01 08:07:15,/r/Coronavirus/comments/ex8882/unethical_pro_life_hack_during_ncov_crisis/
fg7572u,-0.296,-0.8126,"I wore a mask in the student health center waiting room in college because a nurse told me that I had to.  People were standing just to avoid sitting near me. I didn't have any virus, i had a splinter in my elbow",Unethical Pro Life Hack during nCov crisis,2020-02-01 08:07:15,/r/Coronavirus/comments/ex8882/unethical_pro_life_hack_during_ncov_crisis/
fg6paew,0.0,-0.8126,Of you feel a sneeze coming on .. Wuhhannn,Unethical Pro Life Hack during nCov crisis,2020-02-01 08:07:15,/r/Coronavirus/comments/ex8882/unethical_pro_life_hack_during_ncov_crisis/
fg7ez65,0.3818,-0.8126,Husband had to go to see his Ill father across the country. He wore a respirator and gloves. He had people taking pictures of him 😂. Then on the plane he clean his table and arm rest. His seatmates asked if he had extra wipes he gladly shared.This was last week before the emergency declarations. Wonder if he is going to be viewed differently on the flight home,Unethical Pro Life Hack during nCov crisis,2020-02-01 08:07:15,/r/Coronavirus/comments/ex8882/unethical_pro_life_hack_during_ncov_crisis/
fg6ou5h,-0.25,0.0,It's over guys the aplocolyps is cancelled.,Recoveries have surpassed deaths!,2020-02-01 08:08:29,/r/Coronavirus/comments/ex88v6/recoveries_have_surpassed_deaths/
fg6x67v,-0.8294,0.0,"Yes, the deaths are under reported. But the recoveries are also vastly under reported since we know not everyone who gets this even get seriously ill or goes to the hospital. Tldr: This is meaningless",Recoveries have surpassed deaths!,2020-02-01 08:08:29,/r/Coronavirus/comments/ex88v6/recoveries_have_surpassed_deaths/
fg6x7co,0.8442,0.0,"i like how the ""guy from chernobyl"" thread said that china is going to start reporting data that say they're winning against the virus to save face&#x200B;and then 2 hours later...",Recoveries have surpassed deaths!,2020-02-01 08:08:29,/r/Coronavirus/comments/ex88v6/recoveries_have_surpassed_deaths/
fg6pf4f,-0.5423,0.0,Too bad the deaths are under reported.,Recoveries have surpassed deaths!,2020-02-01 08:08:29,/r/Coronavirus/comments/ex88v6/recoveries_have_surpassed_deaths/
fg6sh76,-0.7678,0.0,The thing is tho if you recover it’s been confirmed that you’re still at risk of being infected again so this number could go up down and fucking sideways and sadly the deaths are permanent.,Recoveries have surpassed deaths!,2020-02-01 08:08:29,/r/Coronavirus/comments/ex88v6/recoveries_have_surpassed_deaths/
fg81ljk,-0.7236,0.0,Can someone explain what exactly “recovery” means?  Does it mean the virus isn’t found in the patient anymore?  Or is the patient not able to transfer it to another person?  Or does it mean the person isn’t going to die but can still pass it on to another victim?,Recoveries have surpassed deaths!,2020-02-01 08:08:29,/r/Coronavirus/comments/ex88v6/recoveries_have_surpassed_deaths/
fg6ujfc,-0.5106,0.0,"To bad those numbers are based on information from a government that will lie about anything to make it seem like it's all fine and dandy, i bet the real numbers are at least 10 times worse and that's being conservative.",Recoveries have surpassed deaths!,2020-02-01 08:08:29,/r/Coronavirus/comments/ex88v6/recoveries_have_surpassed_deaths/
fg7ffbe,-0.1779,0.0,"thats weird, never seen 259,000 written that way before",Recoveries have surpassed deaths!,2020-02-01 08:08:29,/r/Coronavirus/comments/ex88v6/recoveries_have_surpassed_deaths/
fg6xgr8,0.296,0.0,Wait... 48% where is the vital information?#theMoreYouKnow🌈,Recoveries have surpassed deaths!,2020-02-01 08:08:29,/r/Coronavirus/comments/ex88v6/recoveries_have_surpassed_deaths/
fg75tnb,0.0,0.0,this is due to the fact that many people only get cold symptoms,Recoveries have surpassed deaths!,2020-02-01 08:08:29,/r/Coronavirus/comments/ex88v6/recoveries_have_surpassed_deaths/
fg7bhxm,0.5106,0.0,You can’t trust a single thing China says.... wait and see,Recoveries have surpassed deaths!,2020-02-01 08:08:29,/r/Coronavirus/comments/ex88v6/recoveries_have_surpassed_deaths/
fg7nz3e,0.296,0.0,Communists are now creating recovery videos as they burn the bodies in the basement.,Recoveries have surpassed deaths!,2020-02-01 08:08:29,/r/Coronavirus/comments/ex88v6/recoveries_have_surpassed_deaths/
fg7b3ih,0.8625,0.0,Yay commie numbers! So trustworthy!,Recoveries have surpassed deaths!,2020-02-01 08:08:29,/r/Coronavirus/comments/ex88v6/recoveries_have_surpassed_deaths/
fg712qe,0.8293,0.0,why is everyone so reluctant to accept any good news like do you guys want the world to end lol,Recoveries have surpassed deaths!,2020-02-01 08:08:29,/r/Coronavirus/comments/ex88v6/recoveries_have_surpassed_deaths/
fg6xcqi,0.9098,0.0,"woot ! a moment of glory in the middle of battle..it may not be the final truth, but it's comforting for a moment...great for a second wind to keep fightingI think as we (humans) learn about this outbreak, we manage cases better and faster and this trend is going to be the rule.",Recoveries have surpassed deaths!,2020-02-01 08:08:29,/r/Coronavirus/comments/ex88v6/recoveries_have_surpassed_deaths/
fg70xxq,0.4939,0.0,it is winding down. #excitement over.,Recoveries have surpassed deaths!,2020-02-01 08:08:29,/r/Coronavirus/comments/ex88v6/recoveries_have_surpassed_deaths/
fg72c8w,-0.3818,0.0,"My name is stalin, I am here to do what we arent doing, call out the conspiratorial lunatics",Recoveries have surpassed deaths!,2020-02-01 08:08:29,/r/Coronavirus/comments/ex88v6/recoveries_have_surpassed_deaths/
fg7g4dj,-0.6908,0.0,"Nah. Deaths are severely undercounting due to lack of testing kids, people dying while waiting to get tested and people dying at home/streets.",Recoveries have surpassed deaths!,2020-02-01 08:08:29,/r/Coronavirus/comments/ex88v6/recoveries_have_surpassed_deaths/
fg7lcr9,0.3082,0.0,"This literally means nothing.Suspected cases continues to go up daily.I'm so tired of people spouting out that because it won't kill them, it isn't a problem.",Recoveries have surpassed deaths!,2020-02-01 08:08:29,/r/Coronavirus/comments/ex88v6/recoveries_have_surpassed_deaths/
fg7ng7m,-0.5622,0.0,No shit. People are fucking paranoid. I've been saying this for weeks. The immunocompromised are more likely to die from it. Just like the flu.,Recoveries have surpassed deaths!,2020-02-01 08:08:29,/r/Coronavirus/comments/ex88v6/recoveries_have_surpassed_deaths/
fg6st7s,0.0516,0.0,Unless some country gets incredibly accurate Intel then I doubt we'll ever truly know where th virus came from. But obviously most of us think it has come from their lab in Wuhan. Too many steps leading back into their trail.,Lab acquired infection as likely source of outbreak?,2020-02-01 08:17:00,/r/Coronavirus/comments/ex8dh0/lab_acquired_infection_as_likely_source_of/
fg6ss1z,0.0,0.0,Is this why patient 0 hasn't been 'identified'?,Lab acquired infection as likely source of outbreak?,2020-02-01 08:17:00,/r/Coronavirus/comments/ex8dh0/lab_acquired_infection_as_likely_source_of/
fg6piwy,0.0,0.0,We been knew.,Lab acquired infection as likely source of outbreak?,2020-02-01 08:17:00,/r/Coronavirus/comments/ex8dh0/lab_acquired_infection_as_likely_source_of/
fg6w80f,0.6369,0.0,I love that this sub acts as a containment board(lol) for this topic,Lab acquired infection as likely source of outbreak?,2020-02-01 08:17:00,/r/Coronavirus/comments/ex8dh0/lab_acquired_infection_as_likely_source_of/
fg6unev,0.3182,0.0,Have a read of this : https://web.archive.org/web/20200130012233/https://medium.com/@siradrianbond/coronavirus-2019-ncov-part-1-d6a338eed7c5      I find the previous research that the lab was publishing particularly relevant.         Note: the original has been taken down by medium.,Lab acquired infection as likely source of outbreak?,2020-02-01 08:17:00,/r/Coronavirus/comments/ex8dh0/lab_acquired_infection_as_likely_source_of/
fg75ek1,0.4404,0.0,I think you should talk to a veterinarian since the virus is found in animals and with an improper check if the animal can be actually eaten (revelation: not all animals from farms that are slaughter are good to eat) we end up ingesting the viruses / bacteria. That's how humans actually got HIV that was originally found in monkeys.,Lab acquired infection as likely source of outbreak?,2020-02-01 08:17:00,/r/Coronavirus/comments/ex8dh0/lab_acquired_infection_as_likely_source_of/
fg7zqk0,-0.34,0.0,"I think this probable considering how the Chinese government covered up the outbreak for more than a month, to save face. They hoped it would be contained but failed.Unfortunately this theory isn’t popular and is getting lost in all the Chinese hate berating the Chinese for eating bats.",Lab acquired infection as likely source of outbreak?,2020-02-01 08:17:00,/r/Coronavirus/comments/ex8dh0/lab_acquired_infection_as_likely_source_of/
fg72brg,-0.2755,0.0,arent you the guy who selectively removes articles he doesnt agree with,Lab acquired infection as likely source of outbreak?,2020-02-01 08:17:00,/r/Coronavirus/comments/ex8dh0/lab_acquired_infection_as_likely_source_of/
fg6tx97,-0.8176,0.4019,"Some people don’t want to hear the truth. Even if he didn’t cover it up, the CCP was told to get these disgusting immoral wet markets under control after the SARS outbreak. They obviously did no such thing. Xinnie the Pooh and the rest communist clowns should be roundly criticized for their actions regarding the outbreak.",Whats with the mods deleting all my links to support the claim that the mayor of Wuhan was told to suppress information?,2020-02-01 08:54:03,/r/Coronavirus/comments/ex8xt8/whats_with_the_mods_deleting_all_my_links_to/
fg7br8c,0.5023,0.4019,"The chinese government have got into the subreddit, we’re all fucked*this is sarcasm but there’s a small part of me that thinks it could be true",Whats with the mods deleting all my links to support the claim that the mayor of Wuhan was told to suppress information?,2020-02-01 08:54:03,/r/Coronavirus/comments/ex8xt8/whats_with_the_mods_deleting_all_my_links_to/
fg6tamo,0.3182,0.4019,Can you give the link? please pm it to me.The mods of this reddit are known to be pro-CCP.,Whats with the mods deleting all my links to support the claim that the mayor of Wuhan was told to suppress information?,2020-02-01 08:54:03,/r/Coronavirus/comments/ex8xt8/whats_with_the_mods_deleting_all_my_links_to/
fg7ngon,-0.5878,0.4019,"I got banned for 3 days in r/China_Flu within 30 mins of posting links and facts about the Canadian Government’s idiocy regarding their stance of not taking ANY actions that the rest of the world is now taking, and called out the mods accordingly, most of them now seem to be working for the CCP and censoring anything that shines a light on them, or negatively calls them out and their bought affiliations amongst world governments.Sadly no surprise here.",Whats with the mods deleting all my links to support the claim that the mayor of Wuhan was told to suppress information?,2020-02-01 08:54:03,/r/Coronavirus/comments/ex8xt8/whats_with_the_mods_deleting_all_my_links_to/
fg71a6t,-0.7579,0.4019,Reddit is pro china.  They will bend the knee to censor anything that may make them look bad even if that costs lives.,Whats with the mods deleting all my links to support the claim that the mayor of Wuhan was told to suppress information?,2020-02-01 08:54:03,/r/Coronavirus/comments/ex8xt8/whats_with_the_mods_deleting_all_my_links_to/
fg732ps,0.0,0.4019,You know why.,Whats with the mods deleting all my links to support the claim that the mayor of Wuhan was told to suppress information?,2020-02-01 08:54:03,/r/Coronavirus/comments/ex8xt8/whats_with_the_mods_deleting_all_my_links_to/
fg7x7u5,-0.8481,0.4019,"A strange thing happened yesterday when I first posted a translation of one of chenqiushi’s videos that got 1,000+ upvotes. I was banned by the moderators for 3 days and had to contact them to get unbanned. They said it was a mistake. They proceeded to mute me from contacting them for 3 days so if I get banned again right now I’ll have to wait.",Whats with the mods deleting all my links to support the claim that the mayor of Wuhan was told to suppress information?,2020-02-01 08:54:03,/r/Coronavirus/comments/ex8xt8/whats_with_the_mods_deleting_all_my_links_to/
fg779oe,-0.4767,0.4019,"Try saying anything about Dr Francis Boyle and watch the downvotes flow. People always talk about China's government having a large presence on reddit. Now you can see it in real time, and this sub would certainly be one they kept an eyes on.*this is how. It's hard to downvote if it calls you out for doing so. At what point is it worth it to stop denying and start finding someone to blame?",Whats with the mods deleting all my links to support the claim that the mayor of Wuhan was told to suppress information?,2020-02-01 08:54:03,/r/Coronavirus/comments/ex8xt8/whats_with_the_mods_deleting_all_my_links_to/
fg71hjv,0.0,0.4019,It’s the CCP fam,Whats with the mods deleting all my links to support the claim that the mayor of Wuhan was told to suppress information?,2020-02-01 08:54:03,/r/Coronavirus/comments/ex8xt8/whats_with_the_mods_deleting_all_my_links_to/
fg7ef7f,0.34,0.4019,[Reddit.com](https://Reddit.com) is owned by one of the biggest Chinese companies. All major leadership positions in the company are held by the sons and cousins of former Chinese Communist Presidents. Reddit is basically owned by Communist Party in China and as we know they censor things 24/7 that goes against the party.,Whats with the mods deleting all my links to support the claim that the mayor of Wuhan was told to suppress information?,2020-02-01 08:54:03,/r/Coronavirus/comments/ex8xt8/whats_with_the_mods_deleting_all_my_links_to/
fg6v6kj,0.0,0.4019,https://m.youtube.com/watch?feature=youtu.be&v=excqpgFYkRk,Whats with the mods deleting all my links to support the claim that the mayor of Wuhan was told to suppress information?,2020-02-01 08:54:03,/r/Coronavirus/comments/ex8xt8/whats_with_the_mods_deleting_all_my_links_to/
fg789n3,0.0,0.4019,[removed],Whats with the mods deleting all my links to support the claim that the mayor of Wuhan was told to suppress information?,2020-02-01 08:54:03,/r/Coronavirus/comments/ex8xt8/whats_with_the_mods_deleting_all_my_links_to/
fg8u9gc,0.0,0.4019,Pm me the links,Whats with the mods deleting all my links to support the claim that the mayor of Wuhan was told to suppress information?,2020-02-01 08:54:03,/r/Coronavirus/comments/ex8xt8/whats_with_the_mods_deleting_all_my_links_to/
fgkod0g,0.3612,0.4019,"I would like to have some links, too",Whats with the mods deleting all my links to support the claim that the mayor of Wuhan was told to suppress information?,2020-02-01 08:54:03,/r/Coronavirus/comments/ex8xt8/whats_with_the_mods_deleting_all_my_links_to/
fg6ww6v,0.0,0.4019,Lo and behold,Whats with the mods deleting all my links to support the claim that the mayor of Wuhan was told to suppress information?,2020-02-01 08:54:03,/r/Coronavirus/comments/ex8xt8/whats_with_the_mods_deleting_all_my_links_to/
fg80zb7,-0.34,0.4019,Umm what kind of statement is that. That’s such BS. I’m sure they just don’t want fear mongering and unsubstantiated lists.,Whats with the mods deleting all my links to support the claim that the mayor of Wuhan was told to suppress information?,2020-02-01 08:54:03,/r/Coronavirus/comments/ex8xt8/whats_with_the_mods_deleting_all_my_links_to/
fg6ufnv,0.0,0.4019,[removed],Whats with the mods deleting all my links to support the claim that the mayor of Wuhan was told to suppress information?,2020-02-01 08:54:03,/r/Coronavirus/comments/ex8xt8/whats_with_the_mods_deleting_all_my_links_to/
fg8d8pr,0.0,0.4019,No. Why?,Whats with the mods deleting all my links to support the claim that the mayor of Wuhan was told to suppress information?,2020-02-01 08:54:03,/r/Coronavirus/comments/ex8xt8/whats_with_the_mods_deleting_all_my_links_to/
fg6xjjy,0.3899,-0.1531,"Being prepared is not paranoia, it's prudence.","Insult you today, beg for your help tomorrow",2020-02-01 09:00:38,/r/Coronavirus/comments/ex91np/insult_you_today_beg_for_your_help_tomorrow/
fg6u558,0.0,-0.1531,[deleted],"Insult you today, beg for your help tomorrow",2020-02-01 09:00:38,/r/Coronavirus/comments/ex91np/insult_you_today_beg_for_your_help_tomorrow/
fg72sie,0.0716,-0.1531,"Most people simply don't want to think about things like this for whatever reason, and would promptly dismiss caution as paranoia to kick the thought away.","Insult you today, beg for your help tomorrow",2020-02-01 09:00:38,/r/Coronavirus/comments/ex91np/insult_you_today_beg_for_your_help_tomorrow/
fg79xm3,-0.7765,-0.1531,"Without going into debates, ask your self 5 things1. Was there an outbreak of a virus that caused china to quarantine over 60mill people?2. Were there confirmed cases outside china, near my country, or inside my country?3. Has the WHO declared global state of emergency?4. Would i prepare some extra food and supply if i were living in china among those 60mill people if i were not infected or would i just hope for the best?5. Why aren't i buying some extra supplies?You don't actually need to buy food and supplies for a whole year, but having extra supplies for a week in most cases doesn't cost that much, and it wont actually go to waste.When a country is in an emergency state ,production, transportation and shops run low pretty quick.   It happened every single time during every single war or a period where there was a panic.Remember how different types of masks just flew off the shelves not even amazon had any for sale? Thats how food and supplies can disappear as well.","Insult you today, beg for your help tomorrow",2020-02-01 09:00:38,/r/Coronavirus/comments/ex91np/insult_you_today_beg_for_your_help_tomorrow/
fg6v8zi,0.0258,-0.1531,This is sooo damn true.,"Insult you today, beg for your help tomorrow",2020-02-01 09:00:38,/r/Coronavirus/comments/ex91np/insult_you_today_beg_for_your_help_tomorrow/
fg780ky,-0.891,-0.1531,"I'm less concerned about any given disaster (hurricane, virus, whatever) than I am about the people.If the disaster disrupts power or normal distribution of goods for more than a few weeks....  people can get irrational.","Insult you today, beg for your help tomorrow",2020-02-01 09:00:38,/r/Coronavirus/comments/ex91np/insult_you_today_beg_for_your_help_tomorrow/
fg77uuz,0.0,-0.1531,"It's not unreasonable at all. As an example, I live in Ontario. I work at the same university attended by the most recently announced Canadian Wuhan case. My partner also works at this university.But he also works in Port Huron, in a sector where he is around hundreds of Americans.We're all interconnected at this point. I've got a food and mask stockpile. You should too.","Insult you today, beg for your help tomorrow",2020-02-01 09:00:38,/r/Coronavirus/comments/ex91np/insult_you_today_beg_for_your_help_tomorrow/
