Comment ID,Comment_VS,Title_VS,Comment,Title,Publish Date,Permalink
fgsr8xy,-0.3818,-0.296,"If this is true, I think ALL of the passengers should have been put under lockdown.  How many potental infected people could be walking around, right now, we know that this thing can maybe spread with no symptoms at all.","12 potential cases on cruise ship docked at Bayonne, NJ. The other 4k passengers were allowed to disembark, no quarantine",2020-02-07 07:51:39,/r/Coronavirus/comments/f0cb0s/12_potential_cases_on_cruise_ship_docked_at/
fgsrowj,-0.6597,-0.296,This seems fucked.  Are people still not getting the potential 2 week incubation period?,"12 potential cases on cruise ship docked at Bayonne, NJ. The other 4k passengers were allowed to disembark, no quarantine",2020-02-07 07:51:39,/r/Coronavirus/comments/f0cb0s/12_potential_cases_on_cruise_ship_docked_at/
fgstaoi,-0.9254,-0.296,"...AND this is why it is only a matter of time before this shit gets out of hand. Given the conditions on any cruise ship if the 12 potential cases do end up confirmed there is a 100% probability that they just released the virus to a major population center. And because the CDC is only testing people with direct connections to China or confirmed cases... Most that get sick will be tested for the virus when they do show symptoms. Though unbelievably stupid, it is hardly unexpected with the people in charge of this shit show.","12 potential cases on cruise ship docked at Bayonne, NJ. The other 4k passengers were allowed to disembark, no quarantine",2020-02-07 07:51:39,/r/Coronavirus/comments/f0cb0s/12_potential_cases_on_cruise_ship_docked_at/
fgssd2p,0.3182,-0.296,Come on guys we need to be sure about what is considered “potential”. The NCov symptoms are VERY common among this kind of transport.,"12 potential cases on cruise ship docked at Bayonne, NJ. The other 4k passengers were allowed to disembark, no quarantine",2020-02-07 07:51:39,/r/Coronavirus/comments/f0cb0s/12_potential_cases_on_cruise_ship_docked_at/
fgsuq4i,-0.6902,-0.296,"Cases like this are why softies are now going around saying XENOPHOBIA -- ""I was only taken off because of my citizenship"" -- Ugh. That does not ""SOUND"" good to people who don't understand this.Obviously we know that cruise's are cesspools and it doesn't matter who you are -- if the virus is on the ship, everyone is at risk. This was not handled well.","12 potential cases on cruise ship docked at Bayonne, NJ. The other 4k passengers were allowed to disembark, no quarantine",2020-02-07 07:51:39,/r/Coronavirus/comments/f0cb0s/12_potential_cases_on_cruise_ship_docked_at/
fgstoen,0.0,-0.296,[deleted],"12 potential cases on cruise ship docked at Bayonne, NJ. The other 4k passengers were allowed to disembark, no quarantine",2020-02-07 07:51:39,/r/Coronavirus/comments/f0cb0s/12_potential_cases_on_cruise_ship_docked_at/
fgssc50,0.2023,-0.296,Unbelievable.,"12 potential cases on cruise ship docked at Bayonne, NJ. The other 4k passengers were allowed to disembark, no quarantine",2020-02-07 07:51:39,/r/Coronavirus/comments/f0cb0s/12_potential_cases_on_cruise_ship_docked_at/
fgss1ch,0.0,-0.296,How cAn this be possible?????,"12 potential cases on cruise ship docked at Bayonne, NJ. The other 4k passengers were allowed to disembark, no quarantine",2020-02-07 07:51:39,/r/Coronavirus/comments/f0cb0s/12_potential_cases_on_cruise_ship_docked_at/
fgsvcvo,-0.5106,-0.296,A girl on that link said she’s pregnant with her mother disembarking the cruise with no checks. They’re putting a lot of people at risk,"12 potential cases on cruise ship docked at Bayonne, NJ. The other 4k passengers were allowed to disembark, no quarantine",2020-02-07 07:51:39,/r/Coronavirus/comments/f0cb0s/12_potential_cases_on_cruise_ship_docked_at/
fgsxg00,-0.4767,-0.296,I can't believe they let everyone off to just go home when there were infected people aboard,"12 potential cases on cruise ship docked at Bayonne, NJ. The other 4k passengers were allowed to disembark, no quarantine",2020-02-07 07:51:39,/r/Coronavirus/comments/f0cb0s/12_potential_cases_on_cruise_ship_docked_at/
fgtz5un,0.0,-0.296,This is being done on purpose.,"12 potential cases on cruise ship docked at Bayonne, NJ. The other 4k passengers were allowed to disembark, no quarantine",2020-02-07 07:51:39,/r/Coronavirus/comments/f0cb0s/12_potential_cases_on_cruise_ship_docked_at/
fgsubdj,0.296,-0.296,gg nj & ny,"12 potential cases on cruise ship docked at Bayonne, NJ. The other 4k passengers were allowed to disembark, no quarantine",2020-02-07 07:51:39,/r/Coronavirus/comments/f0cb0s/12_potential_cases_on_cruise_ship_docked_at/
fgst9dz,0.0,-0.296,Just because they are Chinese nationals doesn’t mean they have the virus. Unless they were in China recently before the cruise,"12 potential cases on cruise ship docked at Bayonne, NJ. The other 4k passengers were allowed to disembark, no quarantine",2020-02-07 07:51:39,/r/Coronavirus/comments/f0cb0s/12_potential_cases_on_cruise_ship_docked_at/
fgsx18g,-0.3412,-0.296,Not good.,"12 potential cases on cruise ship docked at Bayonne, NJ. The other 4k passengers were allowed to disembark, no quarantine",2020-02-07 07:51:39,/r/Coronavirus/comments/f0cb0s/12_potential_cases_on_cruise_ship_docked_at/
fgt395a,-0.3612,-0.296,"All the petrochemicals in the NJ air should kill it off pretty quick though, right?","12 potential cases on cruise ship docked at Bayonne, NJ. The other 4k passengers were allowed to disembark, no quarantine",2020-02-07 07:51:39,/r/Coronavirus/comments/f0cb0s/12_potential_cases_on_cruise_ship_docked_at/
fgtacs2,0.0,-0.296,Time to move to Madagascar.,"12 potential cases on cruise ship docked at Bayonne, NJ. The other 4k passengers were allowed to disembark, no quarantine",2020-02-07 07:51:39,/r/Coronavirus/comments/f0cb0s/12_potential_cases_on_cruise_ship_docked_at/
fgtrh96,-0.6096,-0.296,Pay them $150/day and tell them to self quarantine for 3 weeks. Keeping them on the cruise ship would make more people sick.,"12 potential cases on cruise ship docked at Bayonne, NJ. The other 4k passengers were allowed to disembark, no quarantine",2020-02-07 07:51:39,/r/Coronavirus/comments/f0cb0s/12_potential_cases_on_cruise_ship_docked_at/
fgugslw,0.6369,-0.296,Ma Freedom. Ma Libertay. Murica.,"12 potential cases on cruise ship docked at Bayonne, NJ. The other 4k passengers were allowed to disembark, no quarantine",2020-02-07 07:51:39,/r/Coronavirus/comments/f0cb0s/12_potential_cases_on_cruise_ship_docked_at/
fguky91,0.88,-0.296,"This just in! Norwegian cruise lines is offering 30% off cruises, with free open bar, and free excursions! Who’s down for the coronavirus special?!","12 potential cases on cruise ship docked at Bayonne, NJ. The other 4k passengers were allowed to disembark, no quarantine",2020-02-07 07:51:39,/r/Coronavirus/comments/f0cb0s/12_potential_cases_on_cruise_ship_docked_at/
fgss88y,0.0,0.0,"I live in SE Washington state,  and they are already out of masks at most places. And every pharmacy says they are on backorder.  If you can find some buy some!!!",For those asking whether they should get supplies. This is one day after a case was found near me,2020-02-07 07:57:20,/r/Coronavirus/comments/f0cdvi/for_those_asking_whether_they_should_get_supplies/
fgsuxf3,0.347,0.0,"Just like I predicted and told my husband about a week ago -As soon as Texans hear that they're routing evacuees through a major hub (DFW) and doing quarantines in SA for infected, and releasing the rest for self-quarantine... shit will start flying off the shelves.Yesterday Target was out of Hand Sanitizer. LOL",For those asking whether they should get supplies. This is one day after a case was found near me,2020-02-07 07:57:20,/r/Coronavirus/comments/f0cdvi/for_those_asking_whether_they_should_get_supplies/
fgssdu2,0.296,0.0,"Better to get a little bit now imho. Also - when people panic, they tend to over purchase (*coughs Texas with one day of ice*). Little bit here & there can go a long way and won’t strain pocketbooks or supply lines (ideally).",For those asking whether they should get supplies. This is one day after a case was found near me,2020-02-07 07:57:20,/r/Coronavirus/comments/f0cdvi/for_those_asking_whether_they_should_get_supplies/
fgt2t71,0.3071,0.0,When you prepare. Don't forget your pets!!,For those asking whether they should get supplies. This is one day after a case was found near me,2020-02-07 07:57:20,/r/Coronavirus/comments/f0cdvi/for_those_asking_whether_they_should_get_supplies/
fgt2m6g,0.4939,0.0,Zero cases in portland and hand sanitizer/masks have been sold out for a while,For those asking whether they should get supplies. This is one day after a case was found near me,2020-02-07 07:57:20,/r/Coronavirus/comments/f0cdvi/for_those_asking_whether_they_should_get_supplies/
fgswtob,-0.7506,0.0,"I'm in Lawrence, Kansas, where there was a suspected case that turned out to be negative about one week ago. Literally every store I've gone to is still sold out of masks. Even though it's been one week since there was a *suspected* case at all. Sigh.",For those asking whether they should get supplies. This is one day after a case was found near me,2020-02-07 07:57:20,/r/Coronavirus/comments/f0cdvi/for_those_asking_whether_they_should_get_supplies/
fgssrum,0.0,0.0,"The time to prepare has passed. Do what you can now, regardless o where you are in the world",For those asking whether they should get supplies. This is one day after a case was found near me,2020-02-07 07:57:20,/r/Coronavirus/comments/f0cdvi/for_those_asking_whether_they_should_get_supplies/
fgsuaqp,-0.128,0.0,"I say yes, you spend 25-50 dollars to potentially prevent from getting sick. If you don’t need it now, you may need it in the future",For those asking whether they should get supplies. This is one day after a case was found near me,2020-02-07 07:57:20,/r/Coronavirus/comments/f0cdvi/for_those_asking_whether_they_should_get_supplies/
fgt0org,0.0,0.0,[Amazon](https://www.amazon.com/dp/B00FY3EV08/ref=cm_sw_r_oth_api_i_35zpEbA2XWH3H)  has some that will be back in stock next week. Ordered a pack last night.,For those asking whether they should get supplies. This is one day after a case was found near me,2020-02-07 07:57:20,/r/Coronavirus/comments/f0cdvi/for_those_asking_whether_they_should_get_supplies/
fgt30rl,0.1531,0.0,"I live in California, Santa Clara county has no masks and drug stores have signs saying they are sold out and they may get some in the next shipment.  I thankfully had some from a trip I took a week before it hit.",For those asking whether they should get supplies. This is one day after a case was found near me,2020-02-07 07:57:20,/r/Coronavirus/comments/f0cdvi/for_those_asking_whether_they_should_get_supplies/
fgt5emk,-0.296,0.0,I’m in Idaho no masks left in my town Fortunately I went and got stuff in the middle of January when this thing started popping off,For those asking whether they should get supplies. This is one day after a case was found near me,2020-02-07 07:57:20,/r/Coronavirus/comments/f0cdvi/for_those_asking_whether_they_should_get_supplies/
fguvxk8,0.755,0.0,"Hand sanitizer is effective because of the alcohol in it, right? Wouldn't a small spray bottle of rubbing alcohol do the same trick? Plenty of that around.",For those asking whether they should get supplies. This is one day after a case was found near me,2020-02-07 07:57:20,/r/Coronavirus/comments/f0cdvi/for_those_asking_whether_they_should_get_supplies/
fgt4e18,0.0,0.0,Masks in the UK have been sold out for at least a week,For those asking whether they should get supplies. This is one day after a case was found near me,2020-02-07 07:57:20,/r/Coronavirus/comments/f0cdvi/for_those_asking_whether_they_should_get_supplies/
fgt6jeh,-0.1406,0.0,"That happened in Sweden over a week ago. Maybe supply was low or something, but it did run out.",For those asking whether they should get supplies. This is one day after a case was found near me,2020-02-07 07:57:20,/r/Coronavirus/comments/f0cdvi/for_those_asking_whether_they_should_get_supplies/
fgtaip9,-0.7601,0.0,I’m in WV and there are simply no masks to be found. They also aren’t available on line unless they’re shipped from......China.....slow shipping too. I’m not sure how many people have self quarantined themselves in the northern part of the state at this point. Maybe 11. Small state. Never in the news. Not the best officials.......,For those asking whether they should get supplies. This is one day after a case was found near me,2020-02-07 07:57:20,/r/Coronavirus/comments/f0cdvi/for_those_asking_whether_they_should_get_supplies/
fgtq36a,0.2382,0.0,"I've got about 10 bars of soap. I'm good. The only thing I might get is a mask, but I'll get it from my doc's office.",For those asking whether they should get supplies. This is one day after a case was found near me,2020-02-07 07:57:20,/r/Coronavirus/comments/f0cdvi/for_those_asking_whether_they_should_get_supplies/
fgultt3,-0.3612,0.0,"I'm from Portugal, the virus isn't here yet and the masks are already sold out. I asked when they would get more and they didn't know. On Amazon.es which delivers to my country, it's either sold out or ridiculous prices.Have you tried hardware stores though? I found a hardware store which still sells n95 masks.",For those asking whether they should get supplies. This is one day after a case was found near me,2020-02-07 07:57:20,/r/Coronavirus/comments/f0cdvi/for_those_asking_whether_they_should_get_supplies/
fgv3evw,-0.34,0.0,The time to get supplies is ALWAYS when everyone else thinks you’re crazy.Never wait until your crazy starts making sense to everyone else.,For those asking whether they should get supplies. This is one day after a case was found near me,2020-02-07 07:57:20,/r/Coronavirus/comments/f0cdvi/for_those_asking_whether_they_should_get_supplies/
fgszl63,0.1744,0.0,No masks or hand sanitizer in Toronto at the local pharmacy. Glad we had a bunch of masks and sanitizer on hand. We were able to order more when the news of the virus first hit the Canadian news but they were already running short,For those asking whether they should get supplies. This is one day after a case was found near me,2020-02-07 07:57:20,/r/Coronavirus/comments/f0cdvi/for_those_asking_whether_they_should_get_supplies/
fgt6665,0.4939,0.0,"Well, in my little town in east Croatia the masks were sold out last week, and yesterday when I asked in the local pharmacy have they gotten any of it, actually they did purchase from local supplier a couple more packages  but with in 120% increased price along per box",For those asking whether they should get supplies. This is one day after a case was found near me,2020-02-07 07:57:20,/r/Coronavirus/comments/f0cdvi/for_those_asking_whether_they_should_get_supplies/
fgtbyq2,0.4215,-0.3818,"You see... this is why I like reddit. It is, in spite of its flaws, honest and community driven. Unlike the shills (bots even) that want people to stop posting - and REposting - the truth.",Archive of 500+ coronavirus video clips &amp; latest archive dump video,2020-02-07 08:16:45,/r/Coronavirus/comments/f0co4g/archive_of_500_coronavirus_video_clips_latest/
fgsys8z,0.0,-0.3818,https://pastebin.com/Qg9TFsY9 can you see this?,Archive of 500+ coronavirus video clips &amp; latest archive dump video,2020-02-07 08:16:45,/r/Coronavirus/comments/f0co4g/archive_of_500_coronavirus_video_clips_latest/
fgsu7fb,-0.1263,-0.3818,already saying there's a problem showing it. It's almost like the government and Google are working for the Coronavirus.,Archive of 500+ coronavirus video clips &amp; latest archive dump video,2020-02-07 08:16:45,/r/Coronavirus/comments/f0co4g/archive_of_500_coronavirus_video_clips_latest/
fgt6lgj,0.6655,-0.3818,"I watched the first minutes, I can't believe it. I have no words for this. I hope that these are not real. What I pray for is that the world stops to think in nations and that they start to work together. We must support each other, we must take this serious and fight this virus all together. Please stob buying the medical protection gear in masses. Don't overload your personal stack, don't buy masses of these supplies to deal with them at higher prices. We must guarantee that we have enough protective gear for the medical staff that is treating everyone.Please stay aware and informed. We have a common enemy as the WHO told us. Differences in nation, race, religion, personal lifestyle doesn't matter! We are all humans and nobody is immune.",Archive of 500+ coronavirus video clips &amp; latest archive dump video,2020-02-07 08:16:45,/r/Coronavirus/comments/f0co4g/archive_of_500_coronavirus_video_clips_latest/
fgug6mv,0.0,-0.3818,Are these confirmed to be real?,Archive of 500+ coronavirus video clips &amp; latest archive dump video,2020-02-07 08:16:45,/r/Coronavirus/comments/f0co4g/archive_of_500_coronavirus_video_clips_latest/
fguknd4,-0.5514,-0.3818,What was happening to that security guy or police officer when he fell like that? A stroke then seizure? After watching this on youtube I feel as though I could have an anxiety attack its that disturbing.,Archive of 500+ coronavirus video clips &amp; latest archive dump video,2020-02-07 08:16:45,/r/Coronavirus/comments/f0co4g/archive_of_500_coronavirus_video_clips_latest/
fgsv3bh,0.9578,-0.3818,"Oh wow,  thanks for sharing.  Much appreciated.  Take care and stay safe.",Archive of 500+ coronavirus video clips &amp; latest archive dump video,2020-02-07 08:16:45,/r/Coronavirus/comments/f0co4g/archive_of_500_coronavirus_video_clips_latest/
fgt26ca,-0.4391,-0.3818,"This needs to be shared, people need to know the extent of this virus. I’m absolutely terrified watching this.",Archive of 500+ coronavirus video clips &amp; latest archive dump video,2020-02-07 08:16:45,/r/Coronavirus/comments/f0co4g/archive_of_500_coronavirus_video_clips_latest/
fgtvp7y,-0.7096,-0.3818,Terrifying. Had to stop the video a few times,Archive of 500+ coronavirus video clips &amp; latest archive dump video,2020-02-07 08:16:45,/r/Coronavirus/comments/f0co4g/archive_of_500_coronavirus_video_clips_latest/
fgsy4uk,-0.6966,-0.3818,I hope all the infected people would goto their mayor office/house. All goto their local government officials house. They are the one doing this to the people. They don’t care about the people. They have all the protective gears and mask but not even the doctors. I’m suppose Wuhan people haven’t start rioting. What are they waiting for? To die?,Archive of 500+ coronavirus video clips &amp; latest archive dump video,2020-02-07 08:16:45,/r/Coronavirus/comments/f0co4g/archive_of_500_coronavirus_video_clips_latest/
fgsth4q,0.5106,-0.3818,Appreciated sir.,Archive of 500+ coronavirus video clips &amp; latest archive dump video,2020-02-07 08:16:45,/r/Coronavirus/comments/f0co4g/archive_of_500_coronavirus_video_clips_latest/
fgsz69a,0.4019,-0.3818,Yes,Archive of 500+ coronavirus video clips &amp; latest archive dump video,2020-02-07 08:16:45,/r/Coronavirus/comments/f0co4g/archive_of_500_coronavirus_video_clips_latest/
fgt2jsl,0.6696,-0.3818,Yes thank you!,Archive of 500+ coronavirus video clips &amp; latest archive dump video,2020-02-07 08:16:45,/r/Coronavirus/comments/f0co4g/archive_of_500_coronavirus_video_clips_latest/
fgubdru,0.0,-0.3818,I cant. Tell me how to see it,Archive of 500+ coronavirus video clips &amp; latest archive dump video,2020-02-07 08:16:45,/r/Coronavirus/comments/f0co4g/archive_of_500_coronavirus_video_clips_latest/
fgsutw3,0.7506,-0.3818,"Hmmm.. hopefully it's working for other people. If you like, you can pm me your email and I'll share it with you that way.",Archive of 500+ coronavirus video clips &amp; latest archive dump video,2020-02-07 08:16:45,/r/Coronavirus/comments/f0co4g/archive_of_500_coronavirus_video_clips_latest/
fgwdmol,-0.1655,-0.3818,"You won’t get official sources confirming these videos because any videos about the coronavirus not issued by the Chinese government are pretty much banned in China. You may have seen the video of Fan Bing getting taken away and the other videos what are apparently people being arrested for forwarding messages.The clips I’ve downloaded include Chinese people wearing masks and doctors wearing the full protective clothing as well as people talking about the coronavirus. The only way a lot of the videos could be made would be with CGI or something like that... but still they are not “confirmed”. Do you see the problem?It is up to you whether or not you believe. And yes, some may be fake. In fact, I’m sure at least a couple of these will be fake. I don’t have time to check every video carefully, though. If you are able to prove a video is fake, it would be very helpful.I include sources for almost every video clip so you can check those out if you wish. These videos are usually coming from twitter. If not, probably YouTube.",Archive of 500+ coronavirus video clips &amp; latest archive dump video,2020-02-07 08:16:45,/r/Coronavirus/comments/f0co4g/archive_of_500_coronavirus_video_clips_latest/
fgv6tp8,-0.2716,-0.3818,Looks like a tonic clinic seizure. Lots of potential causes. Very disturbing the way he goes down,Archive of 500+ coronavirus video clips &amp; latest archive dump video,2020-02-07 08:16:45,/r/Coronavirus/comments/f0co4g/archive_of_500_coronavirus_video_clips_latest/
fgv1zdz,0.5562,-0.3818,"The infected should surround and sit all over everything related to the CCP party members. They're leaving corpses in hospitals, go full middle ages and trebuchet them into government officials homes... Ok maybe that's a bit much, but the spitting for sure!",Archive of 500+ coronavirus video clips &amp; latest archive dump video,2020-02-07 08:16:45,/r/Coronavirus/comments/f0co4g/archive_of_500_coronavirus_video_clips_latest/
fgszank,0.6486,-0.3818,"nice, thank you",Archive of 500+ coronavirus video clips &amp; latest archive dump video,2020-02-07 08:16:45,/r/Coronavirus/comments/f0co4g/archive_of_500_coronavirus_video_clips_latest/
fgulqjl,0.0,-0.3818,Did you try the URL in the pastebin?,Archive of 500+ coronavirus video clips &amp; latest archive dump video,2020-02-07 08:16:45,/r/Coronavirus/comments/f0co4g/archive_of_500_coronavirus_video_clips_latest/
fgsu94k,0.4387,0.0,"I prepped for the first time the day they announced the Quarantine. After the latest WHO breifing on PPE i'm glad I did.. anything N95+ will be unavailable for civilians in the next few days.. GET THEM NOW at any cost.It's not even the virus.. everything in this world runs just in time.. all it takes is 2-3 days of no deliveries to a place like NYC and it's going to be madness. 80% of the worlds manufacturing is already at a stand still because china controls 15% of the worlds exports with the rest of the world relying on parts from china to do their manufacturing.  I expect the next 8-12 months to be nasty.I'll never go without again.. this has proven how fast it can get out of hand. If this blows over, i'll have supplies on stock going forward always. At least 90 days of food.I've been adding more supplies as this worsens.. I think me and mine are ok for about 60-90 days atm and I have both full and 1/2 mask N95 and P100 Respirators.Stay safe out there, the government isn't going to protect you.",Perhaps the preppers are right,2020-02-07 08:18:50,/r/Coronavirus/comments/f0cp5v/perhaps_the_preppers_are_right/
fgsw9ph,0.3182,0.0,"I'm an American prepper in china.  My wife couldn't understand why id buy extra food, medicine etc.  Now she told me once things calm down we need to double up on our inventory.",Perhaps the preppers are right,2020-02-07 08:18:50,/r/Coronavirus/comments/f0cp5v/perhaps_the_preppers_are_right/
fgsto2z,0.3899,0.0,"Being prepared is not paranoia, it's prudence.",Perhaps the preppers are right,2020-02-07 08:18:50,/r/Coronavirus/comments/f0cp5v/perhaps_the_preppers_are_right/
fgstq0k,0.836,0.0,"The prepper part of it yes.   The world is more fragile than most people realize.  Get a real off the wall nutter and yeah its amusing.  I have always been a prepper by nature.  Even as a kid, I saw things differently and saw things were interconnected and how easily it could fall down.",Perhaps the preppers are right,2020-02-07 08:18:50,/r/Coronavirus/comments/f0cp5v/perhaps_the_preppers_are_right/
fgsum26,-0.9016,0.0,"My point has been, who cares about the death rates. Do I really want to go out to the store for during the worst part of an outbreak, putting myself and my family at risk? And, do I really want to have the worst time finding medicine and food because everyone panicked at the last minute and made it impossible for me to provide for my family? It's just responsible to stock up on things you'll use anyway.",Perhaps the preppers are right,2020-02-07 08:18:50,/r/Coronavirus/comments/f0cp5v/perhaps_the_preppers_are_right/
fgsxo0t,-0.5267,0.0,"The only real argument anyone can have against prepping is opportunity costs .. i.e. the money, time, space, you could have used for something else.Other arguments made against prepping seem to basically boil down to .. ""you prepping is making me anxious about something I would rather ignore, please stop so I can live in blissful ignorance"", ..",Perhaps the preppers are right,2020-02-07 08:18:50,/r/Coronavirus/comments/f0cp5v/perhaps_the_preppers_are_right/
