Comment ID,Comment_VS,Title_VS,Comment,Title,Publish Date,Permalink
fgul7oc,0.8221,0.4767,"Youtube is generally an unreliable source. If possible, please re-submit with a link to a reliable source, such as a reliable news organization or a recognized institution.Note that you may also resubmit as a text post, just add a link and some explanatory text. Thank you for helping us keep information in /r/Conoravirus reliable!*I am a bot, and this action was performed automatically. Please [contact the moderators of this subreddit](/message/compose/?to=/r/Coronavirus) if you have any questions or concerns.*",Interview with Wuhan resident (not in Wuhan) provides unique insight into the situation through stories of friends and family in the city,2020-02-07 16:59:45,/r/Coronavirus/comments/f0k43g/interview_with_wuhan_resident_not_in_wuhan/
fgusjqu,0.5106,0.4767,"You can tell she’s strong, then that ending..",Interview with Wuhan resident (not in Wuhan) provides unique insight into the situation through stories of friends and family in the city,2020-02-07 16:59:45,/r/Coronavirus/comments/f0k43g/interview_with_wuhan_resident_not_in_wuhan/
fgunxms,0.4576,0.4767,provides a very interesting insight into life there right now,Interview with Wuhan resident (not in Wuhan) provides unique insight into the situation through stories of friends and family in the city,2020-02-07 16:59:45,/r/Coronavirus/comments/f0k43g/interview_with_wuhan_resident_not_in_wuhan/
fgv0jkm,0.2732,0.4767,"My god, it’s really happening",Interview with Wuhan resident (not in Wuhan) provides unique insight into the situation through stories of friends and family in the city,2020-02-07 16:59:45,/r/Coronavirus/comments/f0k43g/interview_with_wuhan_resident_not_in_wuhan/
fgv0uiq,0.8689,0.4767,"Awesome, glad we could help",Interview with Wuhan resident (not in Wuhan) provides unique insight into the situation through stories of friends and family in the city,2020-02-07 16:59:45,/r/Coronavirus/comments/f0k43g/interview_with_wuhan_resident_not_in_wuhan/
fgwgxpj,0.8689,0.4767,thank you and if it's your video. wishing you all strength and courage from the rest of us,Interview with Wuhan resident (not in Wuhan) provides unique insight into the situation through stories of friends and family in the city,2020-02-07 16:59:45,/r/Coronavirus/comments/f0k43g/interview_with_wuhan_resident_not_in_wuhan/
fguslkn,-0.2172,-0.7506,"B-b-buh-but, The Flu kills xyz people? uhh.. uhm.. it's only China that's had deaths? ahhh... um... there arent any cases in my home town so I'm safe? uhh... oh dear.","A vaccine would come too late, says expert. The novel virus is spreading much faster than the SARS virus, which it is related. After only a few weeks, it has now infected more people around the world and has killed more patients in China than SARS did in nine months.",2020-02-07 17:11:38,/r/Coronavirus/comments/f0k994/a_vaccine_would_come_too_late_says_expert_the/
fgumln6,0.25,-0.7506,"There is no way that the vacine would be develepoed in time ti save every one,","A vaccine would come too late, says expert. The novel virus is spreading much faster than the SARS virus, which it is related. After only a few weeks, it has now infected more people around the world and has killed more patients in China than SARS did in nine months.",2020-02-07 17:11:38,/r/Coronavirus/comments/f0k994/a_vaccine_would_come_too_late_says_expert_the/
fgv8enm,-0.8401,-0.7506,"It surpassed total confirmed SARS infections weeks ago. Deaths in China are exceeded, soon to be deaths worldwide. I’ve seen estimates of 15,000,000 Americans infected with seasonal flu this year and appx 8,000 deaths so far. Even if we accept low end estimates of mortality for this virus,  (2%) thats 300,000 people. If this is as contagious as the flu, and it appears that it may even be more so, it would be like St. Louis,  Cincinnati, Orlando, or Pittsburgh disappearing in a matter of a few months. If they keep comparing this to flu there will be mass chaos when the dead appear in the streets. They should be warning everyone that this could get out of control and bring everyday life, the economy, everything to a total standstill. It’s not time to panic but it is time for all of us to prepare, especially hospitals.","A vaccine would come too late, says expert. The novel virus is spreading much faster than the SARS virus, which it is related. After only a few weeks, it has now infected more people around the world and has killed more patients in China than SARS did in nine months.",2020-02-07 17:11:38,/r/Coronavirus/comments/f0k994/a_vaccine_would_come_too_late_says_expert_the/
fgungyf,0.739,-0.7506,"This article was a very good read, thank you so much!","A vaccine would come too late, says expert. The novel virus is spreading much faster than the SARS virus, which it is related. After only a few weeks, it has now infected more people around the world and has killed more patients in China than SARS did in nine months.",2020-02-07 17:11:38,/r/Coronavirus/comments/f0k994/a_vaccine_would_come_too_late_says_expert_the/
fgvab60,-0.3032,-0.7506,"""For most, the illness is over in two weeks, whereas for those for whom the illness becomes severe, if they can survive three weeks, they're good. Those that can't will die in three weeks.""https://www.straitstimes.com/asia/east-asia/reporters-notebook-life-and-death-in-a-wuhan-coronavirus-icu","A vaccine would come too late, says expert. The novel virus is spreading much faster than the SARS virus, which it is related. After only a few weeks, it has now infected more people around the world and has killed more patients in China than SARS did in nine months.",2020-02-07 17:11:38,/r/Coronavirus/comments/f0k994/a_vaccine_would_come_too_late_says_expert_the/
fguy9cx,0.8158,-0.7506,"Here's 3 more:1.) CCP manipulates the numbers2.) China is welding entire apartment buildings shut3.) This novel virus has killed 650 people in a 3 month period in China, meanwhile the tradition flu kills ~150 people in China annually. For comparison, the flu kills something like 60,000 in the US annually. It doesn't take be a genius to compare those numbers and realize that realistically this virus has the potential to kills millions if it isn't contained.If the virus continues on its current growth trajectory, and infects millions, then there will be devastating fallout. I'm not saying it will infect millions, but if it does then you better be prepared. We should all hope for the best, but thoughts and prayers don't really have much of an effect on viruses.","A vaccine would come too late, says expert. The novel virus is spreading much faster than the SARS virus, which it is related. After only a few weeks, it has now infected more people around the world and has killed more patients in China than SARS did in nine months.",2020-02-07 17:11:38,/r/Coronavirus/comments/f0k994/a_vaccine_would_come_too_late_says_expert_the/
fgx043y,-0.9603,-0.7506,"Not true. This virus will affect economy, there is no doubt about that, the question is how big will the collapse be. Global supply chains will definetly collapse, china manufactures too much shit, most of it is delivered by cargo ships and those can take over a month to reach ports in EU and the US. Personally I think economic collapse due to this virus can be greater that 2008 collapse... And that's why I follow news about it carefully. In fact I don't really care about death rate or death count, all I care about is how will it affect economy and how I can profit from it.","A vaccine would come too late, says expert. The novel virus is spreading much faster than the SARS virus, which it is related. After only a few weeks, it has now infected more people around the world and has killed more patients in China than SARS did in nine months.",2020-02-07 17:11:38,/r/Coronavirus/comments/f0k994/a_vaccine_would_come_too_late_says_expert_the/
fgvtv15,0.0,-0.7506,"When the Chinese government tells us the infected/death toll, add AT LEAST one zero","A vaccine would come too late, says expert. The novel virus is spreading much faster than the SARS virus, which it is related. After only a few weeks, it has now infected more people around the world and has killed more patients in China than SARS did in nine months.",2020-02-07 17:11:38,/r/Coronavirus/comments/f0k994/a_vaccine_would_come_too_late_says_expert_the/
fgv2st4,-0.8126,-0.7506,"Umm BS,  an analysis led by Chinese scientists published in The Lancet Public  Health in September 2019 found that there were 84,200 to 92,000  flu-related deaths in China each year, accounting for 8.2 percent of all  deaths from respiratory diseasesChina fudges Flu number BIG time, they don't count any deaths caused by diseases exacerbated by the flu.We need to start posting every time someone gets diagnosed with the flu and how outraged we are about why that person isn't being quarantined.","A vaccine would come too late, says expert. The novel virus is spreading much faster than the SARS virus, which it is related. After only a few weeks, it has now infected more people around the world and has killed more patients in China than SARS did in nine months.",2020-02-07 17:11:38,/r/Coronavirus/comments/f0k994/a_vaccine_would_come_too_late_says_expert_the/
fgv5i50,-0.1935,-0.7506,I will say I've heard they completely underreport their flu numbers as well. This is a trend apparently.,"A vaccine would come too late, says expert. The novel virus is spreading much faster than the SARS virus, which it is related. After only a few weeks, it has now infected more people around the world and has killed more patients in China than SARS did in nine months.",2020-02-07 17:11:38,/r/Coronavirus/comments/f0k994/a_vaccine_would_come_too_late_says_expert_the/
fgx8045,0.5734,-0.7506,"Pittsburgh’s population is about 0.09% of the country’s population. Evenly spread throughout the country, it won’t be that noticeable. Most of the people who actually die will most likely be people who weren’t working anyway due to a pre-existing illness. I know young healthy people are being infected and a few have died as well, but I highly doubt it’s the majority. I’m not saying it won’t affect the economy negatively, but I’m not envisioning bodies in the streets and I don’t think most people will feel super affected by it personally (unless due to their investments). An even distribution of jobs opening up will only benefit the economy in the long run, just like the bubonic plague did for Europe.","A vaccine would come too late, says expert. The novel virus is spreading much faster than the SARS virus, which it is related. After only a few weeks, it has now infected more people around the world and has killed more patients in China than SARS did in nine months.",2020-02-07 17:11:38,/r/Coronavirus/comments/f0k994/a_vaccine_would_come_too_late_says_expert_the/
fgvnc3c,-0.1401,-0.7506,"We’re not talking religion, we’re talking science. Jesus isn’t helping anything, The countless hours that doctors and medical staff put in trying to curtail this will help but not Jesus lol","A vaccine would come too late, says expert. The novel virus is spreading much faster than the SARS virus, which it is related. After only a few weeks, it has now infected more people around the world and has killed more patients in China than SARS did in nine months.",2020-02-07 17:11:38,/r/Coronavirus/comments/f0k994/a_vaccine_would_come_too_late_says_expert_the/
fgwfzzg,-0.4574,-0.7506,Dude children are literally beaten to death everyday. Do you actually think Christ cares more about people who catch a virus than innocent children?  not trying to be a jerk but seriously!,"A vaccine would come too late, says expert. The novel virus is spreading much faster than the SARS virus, which it is related. After only a few weeks, it has now infected more people around the world and has killed more patients in China than SARS did in nine months.",2020-02-07 17:11:38,/r/Coronavirus/comments/f0k994/a_vaccine_would_come_too_late_says_expert_the/
fguos5g,0.7506,0.2023,No way is anything opening Monday.  Better chance of Nancy Pelosi french  kissing Donald Trump.,"Watching financial news here in America, it’s all business as usual, with the top story “China reopens factories on Monday”",2020-02-07 17:29:31,/r/Coronavirus/comments/f0kgyx/watching_financial_news_here_in_america_its_all/
fgutx42,0.516,0.2023,It is amazing how the press here (UNITED STATES) just lies and repeats whatever is told to them with no research or actual reporting. Get your English news from Canada and the UK.,"Watching financial news here in America, it’s all business as usual, with the top story “China reopens factories on Monday”",2020-02-07 17:29:31,/r/Coronavirus/comments/f0kgyx/watching_financial_news_here_in_america_its_all/
fgupxsb,0.1511,0.2023,"The two girls that the author is quoting in Beijing aren't even in financial or medical markets.  They are political and social writers.  This article ain't worth piss, I'm afraid.","Watching financial news here in America, it’s all business as usual, with the top story “China reopens factories on Monday”",2020-02-07 17:29:31,/r/Coronavirus/comments/f0kgyx/watching_financial_news_here_in_america_its_all/
fguogpf,0.0,0.2023,"I saw a different article that said the same, and thought...I just saw Foxconn tell everyone to stay home. China is closed till May. There is nothing coming, going, cruising, traveling, or exporting....","Watching financial news here in America, it’s all business as usual, with the top story “China reopens factories on Monday”",2020-02-07 17:29:31,/r/Coronavirus/comments/f0kgyx/watching_financial_news_here_in_america_its_all/
fguoh7e,0.0,0.2023,Let’s see if they open.,"Watching financial news here in America, it’s all business as usual, with the top story “China reopens factories on Monday”",2020-02-07 17:29:31,/r/Coronavirus/comments/f0kgyx/watching_financial_news_here_in_america_its_all/
fguoah4,0.6124,0.2023,"Hopefully manufacturers will wise up to the fact that doing business in China is a risky investment and in the long run, it's more expensive than staying in the West.","Watching financial news here in America, it’s all business as usual, with the top story “China reopens factories on Monday”",2020-02-07 17:29:31,/r/Coronavirus/comments/f0kgyx/watching_financial_news_here_in_america_its_all/
fguswc3,0.0,0.2023,someone outta the 57k in this community probably has ties to production outfits in China.... anyone anyone anyone,"Watching financial news here in America, it’s all business as usual, with the top story “China reopens factories on Monday”",2020-02-07 17:29:31,/r/Coronavirus/comments/f0kgyx/watching_financial_news_here_in_america_its_all/
fgutr06,-0.2411,0.2023,"Several car companies reported in the US they were opening Monday in China, not sure if that is just wishful thinking. Tesla, Nissan, etc.","Watching financial news here in America, it’s all business as usual, with the top story “China reopens factories on Monday”",2020-02-07 17:29:31,/r/Coronavirus/comments/f0kgyx/watching_financial_news_here_in_america_its_all/
fguwnpx,0.8972,0.2023,"Well folks, don’t order anything from China if they do open. I wanted a baby yoda blanket for Valentine’s Day but now it says shipping would be 2 months!!!! No, thanks. I’ll wait until the bio zone has cleared lol","Watching financial news here in America, it’s all business as usual, with the top story “China reopens factories on Monday”",2020-02-07 17:29:31,/r/Coronavirus/comments/f0kgyx/watching_financial_news_here_in_america_its_all/
fguxq65,-0.296,0.2023,No way they are opening on Monday. That's in 2 days.,"Watching financial news here in America, it’s all business as usual, with the top story “China reopens factories on Monday”",2020-02-07 17:29:31,/r/Coronavirus/comments/f0kgyx/watching_financial_news_here_in_america_its_all/
fgv1ai8,-0.4588,0.2023,The CCP is going to imprison their entire population. They’ll go to work and then go straight home. Anyone that gets the sniffles goes to the infection gulag to die.,"Watching financial news here in America, it’s all business as usual, with the top story “China reopens factories on Monday”",2020-02-07 17:29:31,/r/Coronavirus/comments/f0kgyx/watching_financial_news_here_in_america_its_all/
fguwzmh,0.8479,0.2023,"And this is why the news here isn't going insane with the story. It's why even Donald Trump isn't hammering home what you'd think would be an endlessly renewable well of material he could use to pulverize China and gain a powerful asset in the trade war. Uncontrolled panic is bad for the stock market. For all we talk of ""communist"" China, we tend to conveniently forget that they're extraordinarily capitalist and intertwined into the global economy entirely for that reason; businesses won't and can't just leave China like they could with the USSR or Cuba, and the Chinese don't want to be left out of the global market either, especially when they have this much growth potential. As long as profits can be made, expect our financial news to go out of its way to declare the coronavirus a passing story, and then once the poopy things hit the fan, it'll be nothing but ""we've bottomed out and things are looking up"" every other week to reassure investors all the way down. And they'll unflinchingly accept China's numbers as long as they don't imply panic right up until the floor collapses; then they'll finally admit ""China was hiding the real numbers all along."" By that point, the CCP will probably be either defunct or masks-off-totalitarian anyway.","Watching financial news here in America, it’s all business as usual, with the top story “China reopens factories on Monday”",2020-02-07 17:29:31,/r/Coronavirus/comments/f0kgyx/watching_financial_news_here_in_america_its_all/
fgus69c,-0.4939,0.2023,They will. Wouldn’t you leave your house if you were forced to sit at home for 14 days,"Watching financial news here in America, it’s all business as usual, with the top story “China reopens factories on Monday”",2020-02-07 17:29:31,/r/Coronavirus/comments/f0kgyx/watching_financial_news_here_in_america_its_all/
fguwmj5,0.0,0.2023,🤦‍♀️,"Watching financial news here in America, it’s all business as usual, with the top story “China reopens factories on Monday”",2020-02-07 17:29:31,/r/Coronavirus/comments/f0kgyx/watching_financial_news_here_in_america_its_all/
fgv00nl,0.2263,0.2023,Are you surprised?,"Watching financial news here in America, it’s all business as usual, with the top story “China reopens factories on Monday”",2020-02-07 17:29:31,/r/Coronavirus/comments/f0kgyx/watching_financial_news_here_in_america_its_all/
fgv2hvg,0.0,0.2023,You can open factories all you wantNobody will show up to work,"Watching financial news here in America, it’s all business as usual, with the top story “China reopens factories on Monday”",2020-02-07 17:29:31,/r/Coronavirus/comments/f0kgyx/watching_financial_news_here_in_america_its_all/
fgv2tf2,0.024,0.2023,Now you know what is really important to this world. Sad sickening it does not say much for the human race. Our God is riches,"Watching financial news here in America, it’s all business as usual, with the top story “China reopens factories on Monday”",2020-02-07 17:29:31,/r/Coronavirus/comments/f0kgyx/watching_financial_news_here_in_america_its_all/
fgv66g1,0.3612,0.2023,Sounds like there's money to be made shorting the market on monday,"Watching financial news here in America, it’s all business as usual, with the top story “China reopens factories on Monday”",2020-02-07 17:29:31,/r/Coronavirus/comments/f0kgyx/watching_financial_news_here_in_america_its_all/
fgvfwum,0.0,0.2023,Yea our partner plants are not opening at least until March. The workers cant travel back to the plants.,"Watching financial news here in America, it’s all business as usual, with the top story “China reopens factories on Monday”",2020-02-07 17:29:31,/r/Coronavirus/comments/f0kgyx/watching_financial_news_here_in_america_its_all/
fgutg5q,0.0,0.2023,/r/eyebleach,"Watching financial news here in America, it’s all business as usual, with the top story “China reopens factories on Monday”",2020-02-07 17:29:31,/r/Coronavirus/comments/f0kgyx/watching_financial_news_here_in_america_its_all/
fguof2e,0.8283,-0.296,"LOL i was like those dates are months off!DD/MM/YY (vs MM/DD/YY)I read this yesterday. Thanks for reposting cuz I forgot to check. Yep, suspiciously close.",If anyone didn't already think that the figures coming out of the CCP were suspect.,2020-02-07 17:29:35,/r/Coronavirus/comments/f0kgzu/if_anyone_didnt_already_think_that_the_figures/
fgup7i3,0.6187,-0.296,"There are a couple of comments in the original thread that make statements contrary to the claims of OP. I realized by reading the threads how dumb I am. Going to keep the thread going because fuck it, but it may not be 100%accurate. I'd love it if someone could ELI5",If anyone didn't already think that the figures coming out of the CCP were suspect.,2020-02-07 17:29:35,/r/Coronavirus/comments/f0kgzu/if_anyone_didnt_already_think_that_the_figures/
fgutgxb,0.0,-0.296,Its all but confirmed the numbers are beong suppressed,If anyone didn't already think that the figures coming out of the CCP were suspect.,2020-02-07 17:29:35,/r/Coronavirus/comments/f0kgzu/if_anyone_didnt_already_think_that_the_figures/
fgv7brl,0.1695,-0.296,That's why I write my days as 07Feb20You cannot confuse it for both Americans and the world.,If anyone didn't already think that the figures coming out of the CCP were suspect.,2020-02-07 17:29:35,/r/Coronavirus/comments/f0kgzu/if_anyone_didnt_already_think_that_the_figures/
fgv626y,-0.5759,-0.296,"OP graphed reported figures from the Chinese government and found a spookily accurate fit to a curve, a fit that would be incredibly unlikely to be natural.A relatively serious disease with fairly good containment could easily fit that curve over the long-haul, but would have a TON more noise and variation (spikes and plateaus) as logistical and medical countermeasures ramp up.The released figures don’t have these natural variations. So they are QUITE suspicious. OP then projected the curve into the future and for three days straight has predicted with UNCANNY accuracy the figures released by the Chinese government. It is almost certain that the figures released by China are completely made up. And they definitely wouldn’t make up figures that made it appear worse than what’s happening, or even close to as bad as reality. TLDR: China’s covering up something way worse than they’re reporting.",If anyone didn't already think that the figures coming out of the CCP were suspect.,2020-02-07 17:29:35,/r/Coronavirus/comments/f0kgzu/if_anyone_didnt_already_think_that_the_figures/
fgurbuc,0.9309,-0.296,"OP graphed cases and found a good fit. GOOD JOB OP.However, OP and the surrounding community include data that should not be included for the sake of fitting the model. The model has error, and that error is relatively large. But it has remained relatively accurate, meaning that we can predict the number of cases in the near future using a simple trinomial fit. I hope this helps somewhat.",If anyone didn't already think that the figures coming out of the CCP were suspect.,2020-02-07 17:29:35,/r/Coronavirus/comments/f0kgzu/if_anyone_didnt_already_think_that_the_figures/
fgvf5fl,0.4215,-0.296,lol,If anyone didn't already think that the figures coming out of the CCP were suspect.,2020-02-07 17:29:35,/r/Coronavirus/comments/f0kgzu/if_anyone_didnt_already_think_that_the_figures/
fguob5b,0.0,0.4939,"Since these patients caught it in the hospital, they could have a higher mortality than the general population.",Mortality 4.3%; 26% intensive care; 41% caught virus in hospital,2020-02-07 17:30:14,/r/Coronavirus/comments/f0kh9y/mortality_43_26_intensive_care_41_caught_virus_in/
fgupq7z,0.9745,0.4939,"I’m a health care provider. this sounds about right. Nosocomial infections are around 6-30%. This is a huge variations dependent on many factors. If you had a rush of patient at your hospital like Wuhan, you’re better off staying at home unless the symptoms are so severe that you have no choice but to drive, walk , crawl to the hospitals. Your risk of getting the virus will significantly increase once entering the lobby of an ER or urgent care. It may not even be coronavirus. You could possibly be sitting next to a different case from meningitis, other coronaviruses, or super bugs that I don’t want to mention. These are the types of patients we get in the ER. I don’t down play any disease, but this is what you’re up against even before 2019nCov settles into the US. What I would be worried about is that we don’t have a damn clue what works against this new novel virus. We’re guessing that HIV cocktails mixed with other viral meds are working. let’s hope we get some better news in the coming weeks.",Mortality 4.3%; 26% intensive care; 41% caught virus in hospital,2020-02-07 17:30:14,/r/Coronavirus/comments/f0kh9y/mortality_43_26_intensive_care_41_caught_virus_in/
fgv13jj,-0.8957,0.4939,"Please note this study is not telling you anything about the case fatality rate in the general population.It is informing us of what the outcomes are once you are diagnosed with pneumonia secondary to 2019-nCoV.As a gross approximation, this data would suggest a general population case fatality rate of less than 1%, as around 80% of patients have mild disease.",Mortality 4.3%; 26% intensive care; 41% caught virus in hospital,2020-02-07 17:30:14,/r/Coronavirus/comments/f0kh9y/mortality_43_26_intensive_care_41_caught_virus_in/
