Comment ID,Comment_VS,Title_VS,Comment,Title,Publish Date,Permalink
fgs7enc,-0.7906,-0.296,"“..and that 238 people evacuated from Wuhan, the epicentre of the outbreak, had not shown symptoms or been tested.”Bad, bad, bad idea not to test them based on not showing symptoms",Concerns coronavirus is going undetected in Indonesia. The world’s fourth most populous country says it has no confirmed cases despite close links to China.,2020-02-07 00:22:00,/r/Coronavirus/comments/f07mrp/concerns_coronavirus_is_going_undetected_in/
fgrzhrm,0.0,-0.296,Can confirm.,Concerns coronavirus is going undetected in Indonesia. The world’s fourth most populous country says it has no confirmed cases despite close links to China.,2020-02-07 00:22:00,/r/Coronavirus/comments/f07mrp/concerns_coronavirus_is_going_undetected_in/
fgs0wrh,-0.5267,-0.296,"We have exactly the same situation in Kyrgyzstan, even thou the entire population of the country a bit more than 6,000,000 people , we still have no confirmed cases. There was an article in the local newspaper about 14 people under quarantine who recently came back from China , but since then, no information what so ever.",Concerns coronavirus is going undetected in Indonesia. The world’s fourth most populous country says it has no confirmed cases despite close links to China.,2020-02-07 00:22:00,/r/Coronavirus/comments/f07mrp/concerns_coronavirus_is_going_undetected_in/
fgsq6t4,0.6894,-0.296,"This is very true, nobody is showing symptoms yet since the incubation period is 2weeks. Quite sure it's already spreading",Concerns coronavirus is going undetected in Indonesia. The world’s fourth most populous country says it has no confirmed cases despite close links to China.,2020-02-07 00:22:00,/r/Coronavirus/comments/f07mrp/concerns_coronavirus_is_going_undetected_in/
fgt5k49,-0.7269,-0.296,I’m thinking g the same about the Philippines. They were forced to confront the cases that did after bending over backwards to deny them.,Concerns coronavirus is going undetected in Indonesia. The world’s fourth most populous country says it has no confirmed cases despite close links to China.,2020-02-07 00:22:00,/r/Coronavirus/comments/f07mrp/concerns_coronavirus_is_going_undetected_in/
fgrzmcj,-0.4767,-0.296,This is really concerning. They are obviously hiding the cases or being pressured to not test people. Or a combination of both.,Concerns coronavirus is going undetected in Indonesia. The world’s fourth most populous country says it has no confirmed cases despite close links to China.,2020-02-07 00:22:00,/r/Coronavirus/comments/f07mrp/concerns_coronavirus_is_going_undetected_in/
fgs098i,-0.1695,-0.296,How do you know? Indonesia is not prepared for this. The wife is finally going to kampung after much pleading.,Concerns coronavirus is going undetected in Indonesia. The world’s fourth most populous country says it has no confirmed cases despite close links to China.,2020-02-07 00:22:00,/r/Coronavirus/comments/f07mrp/concerns_coronavirus_is_going_undetected_in/
fgsdqxw,-0.4921,-0.296,"The whole situation it’s strange. Many other Asian countries that have recently received people from Wuhan have reported cases and Indonesia doesn’t. Maybe they have been lucky so far, but I highly doubt that.",Concerns coronavirus is going undetected in Indonesia. The world’s fourth most populous country says it has no confirmed cases despite close links to China.,2020-02-07 00:22:00,/r/Coronavirus/comments/f07mrp/concerns_coronavirus_is_going_undetected_in/
fgs3njr,-0.8805,-0.296,What the actual fuck... this is insane. China is in utter chaos (that area to be exact),"Compilation video including rare footage that keeps getting taken down. Warning: it shows panic, please be mindful who you share this with.",2020-02-07 01:18:12,/r/Coronavirus/comments/f083az/compilation_video_including_rare_footage_that/
fgs269y,-0.8834,-0.5859,"You forgot one:""Reaching 30k infected""= oh god oh fuck there's a hundred thousand people sick and we just made concentration camp style quarantine centers oh god oh fuck",Virus speak and terminology. Some translations or those that don’t speak bullshit,2020-02-07 01:24:14,/r/Coronavirus/comments/f0855v/virus_speak_and_terminology_some_translations_or/
fgs25y3,-0.25,-0.5859,trying to decipher the true meaning of their bullshit has been sending me for a loop.thanks for breaking it down.,Virus speak and terminology. Some translations or those that don’t speak bullshit,2020-02-07 01:24:14,/r/Coronavirus/comments/f0855v/virus_speak_and_terminology_some_translations_or/
fgs2bby,0.0,-0.5859,I concur.,Virus speak and terminology. Some translations or those that don’t speak bullshit,2020-02-07 01:24:14,/r/Coronavirus/comments/f0855v/virus_speak_and_terminology_some_translations_or/
fgs632e,0.5886,-0.5859,"These are rational-minded epidemiologists and virologists, not panicked monkeys throwing faeces. Listen to the scientists. They have spent their entire lives understanding this. Don't listen to those getting ""news"" on Facebook and Fox from fear-mongering bilge pustules.Does this virus have single-stranded or double stranded genes? Are they DNA or RNA? How many genes are encoded? If you don't know the answer to these questions, stop thinking you're smarter.",Virus speak and terminology. Some translations or those that don’t speak bullshit,2020-02-07 01:24:14,/r/Coronavirus/comments/f0855v/virus_speak_and_terminology_some_translations_or/
fgs3zgd,0.0,-0.5859,Spot on.,Virus speak and terminology. Some translations or those that don’t speak bullshit,2020-02-07 01:24:14,/r/Coronavirus/comments/f0855v/virus_speak_and_terminology_some_translations_or/
fgskk6f,0.0,-0.5859,">We see **now** reason at this time.Hey, you already said that.",Virus speak and terminology. Some translations or those that don’t speak bullshit,2020-02-07 01:24:14,/r/Coronavirus/comments/f0855v/virus_speak_and_terminology_some_translations_or/
fgsvjh2,0.0,-0.5859,I loled.,Virus speak and terminology. Some translations or those that don’t speak bullshit,2020-02-07 01:24:14,/r/Coronavirus/comments/f0855v/virus_speak_and_terminology_some_translations_or/
fgsb3zq,0.4019,-0.5859,"They’re smart yes, but you also should listen to the hospital doctors on the ground in wuhan who have to turn dying people away because they’re over capacity.",Virus speak and terminology. Some translations or those that don’t speak bullshit,2020-02-07 01:24:14,/r/Coronavirus/comments/f0855v/virus_speak_and_terminology_some_translations_or/
fgs6efy,-0.296,-0.5859,So scientists that suggest this is a bio weapon or scientists that say it came from bats ?,Virus speak and terminology. Some translations or those that don’t speak bullshit,2020-02-07 01:24:14,/r/Coronavirus/comments/f0855v/virus_speak_and_terminology_some_translations_or/
fgs6n5q,0.0,-0.5859,[removed],Virus speak and terminology. Some translations or those that don’t speak bullshit,2020-02-07 01:24:14,/r/Coronavirus/comments/f0855v/virus_speak_and_terminology_some_translations_or/
fgsxixo,0.0258,-0.5859,"You're confusing speculation with hard fact, the truth of the matter is we just don't know yet.",Virus speak and terminology. Some translations or those that don’t speak bullshit,2020-02-07 01:24:14,/r/Coronavirus/comments/f0855v/virus_speak_and_terminology_some_translations_or/
fgtic0z,0.0505,-0.5859,No I’m not. Hard facts are what exactly ? Just heard Indonesia may have an outbreak according to experts. Well according to redditors that was over a week ago. Maybe experts should log on here for info,Virus speak and terminology. Some translations or those that don’t speak bullshit,2020-02-07 01:24:14,/r/Coronavirus/comments/f0855v/virus_speak_and_terminology_some_translations_or/
fgu06zl,0.4062,-0.5859,"Hard facts are like pathology and virology. Epidemiology is more built on guess work and good detectives to discover the origin of the outbreak i.e patient zero, natural reservoirs ect. Virology is the study of viruses themselves and so far that's telling us it came from bats, that it's in the Coronavirus family which has been known and responsible for zoonotic jumps in the past. Pathology is telling us how the virus interacts with out bodies, how fast it replicates in our cell, describes onset and progression of symptoms. This outbreak is effecting the body how we expect coronavirus to interact with it pathologically and biological weapons generally don't present with the same symptoms as their natural counterparts, they also aren't designed to be highly transmissible, killing the host to quickly to spread.",Virus speak and terminology. Some translations or those that don’t speak bullshit,2020-02-07 01:24:14,/r/Coronavirus/comments/f0855v/virus_speak_and_terminology_some_translations_or/
fgs44f6,-0.8402,-0.6908,It’s a natural reaction. We react to sick people with fear and trepidation.  Even loved ones sometimes run. During the plague it was not uncommon for a sick person to be boarded up in their rooms or houses and simply left to die. It will take wuhan quite a few years to shake the stigma. Even within China.,Global community and irrational panic,2020-02-07 01:47:34,/r/Coronavirus/comments/f08c5i/global_community_and_irrational_panic/
fgs4gki,0.6162,-0.6908,I didn't have irrational panic until seeing all the videos from Wuhan .. omg! https://streamable.com/cuypo,Global community and irrational panic,2020-02-07 01:47:34,/r/Coronavirus/comments/f08c5i/global_community_and_irrational_panic/
fgs77nw,-0.9393,-0.6908,"i think you are right, irrational panic is dead easy, and the worst thing is that it in itself is contagious, especially online.it is normal though but i wonder what the split is, what percentage do what you did and see sense after the initial panic and what percentage go into a panic loop that's hard to recover from.also, i didn't know we were doing quarantine here, i mean im not surprised but i hadn't heard anywhere, where boots are you (roughly lol)",Global community and irrational panic,2020-02-07 01:47:34,/r/Coronavirus/comments/f08c5i/global_community_and_irrational_panic/
fgs313v,0.0,-0.6908,Ahhhhhhh!!,Global community and irrational panic,2020-02-07 01:47:34,/r/Coronavirus/comments/f08c5i/global_community_and_irrational_panic/
fgs4czc,0.0,-0.6908,[removed],Global community and irrational panic,2020-02-07 01:47:34,/r/Coronavirus/comments/f08c5i/global_community_and_irrational_panic/
fgsf62e,0.8622,-0.6908,"Thanks for sharing, we all need some positive news!",Global community and irrational panic,2020-02-07 01:47:34,/r/Coronavirus/comments/f08c5i/global_community_and_irrational_panic/
fgsf92h,-0.7391,-0.6908,"Your reaction is totally normal. It is just part of the self defense system in your brain. At the advert of a possible danger you will naturally want to either,1. Fight2. Hide3. Flight But you, as a rational individual, constantly reevaluate your reactions and revert the panic feelings.You are just another mundane human. Everything is OK, nothing to see here.",Global community and irrational panic,2020-02-07 01:47:34,/r/Coronavirus/comments/f08c5i/global_community_and_irrational_panic/
fgsmc94,0.0,-0.6908,AS someone who can't view videos ELI5?,Global community and irrational panic,2020-02-07 01:47:34,/r/Coronavirus/comments/f08c5i/global_community_and_irrational_panic/
fgs6o63,0.0,-0.6908,what a video,Global community and irrational panic,2020-02-07 01:47:34,/r/Coronavirus/comments/f08c5i/global_community_and_irrational_panic/
fgs9787,0.4927,-0.6908,Really good.,Global community and irrational panic,2020-02-07 01:47:34,/r/Coronavirus/comments/f08c5i/global_community_and_irrational_panic/
fgshdi8,-0.9174,-0.6908,"Edinburgh. I'm assuming that he was quarantined locally but don't know this for sure. Also, the recommendation is to self isolate so I presume that's what he did rather than a forced quarantine arrangement.Yes, a major panic is my worry too. I don't wish to sound superior in any way but I suspect that a large proportion of people wouldn't react the same way as I did.",Global community and irrational panic,2020-02-07 01:47:34,/r/Coronavirus/comments/f08c5i/global_community_and_irrational_panic/
fgs4czo,0.7717,-0.6908,"Please do not post/comment links to other unrealiable subreddits. You can check out our trusted sister subreddit: r/epidemic and r/china_flu*I am a bot, and this action was performed automatically. Please [contact the moderators of this subreddit](/message/compose/?to=/r/Coronavirus) if you have any questions or concerns.*",Global community and irrational panic,2020-02-07 01:47:34,/r/Coronavirus/comments/f08c5i/global_community_and_irrational_panic/
fgswi1z,-0.5789,-0.6908,"It’s a compilation of footage featuring mass crowds, chaos, and the overall state of distress in Wuhan. Hard to say if all the footage is accurately from this situation but much of the clips in this video are ones I have been seeing recently.",Global community and irrational panic,2020-02-07 01:47:34,/r/Coronavirus/comments/f08c5i/global_community_and_irrational_panic/
fgsrgo6,0.7187,-0.6908,"I think we will be fine. We are too small and too sparse to be really badly affected.I know edinburgh is a decent sized city but I still think, overall, commom sense will prevail.Peace and love.",Global community and irrational panic,2020-02-07 01:47:34,/r/Coronavirus/comments/f08c5i/global_community_and_irrational_panic/
fgswm6h,0.4199,-0.6908,Thank you!,Global community and irrational panic,2020-02-07 01:47:34,/r/Coronavirus/comments/f08c5i/global_community_and_irrational_panic/
fgs6vu3,0.2395,-0.34,"Yep, manufacturing engineer here, couldnt agree more. China will not be ""normal"" for months on end. I think many people assume that the Trump tariffs have shifted a lot of manufacturing away from China, but in reality they've only shifted final assembly away. The majority of components in things like consumer electronics products will still come there. Try making an iphone without the camera lens, or the volume FPC or the LCD for that matter. Sure other countries make these things. But China makes 80% of them. So if this goes on long term, you'll suddenly have 100% of the demand  scrambling for 20% of the supply. Not gonna happen.The economy WILL take a dice because of this. It WILL bounce back, but very difficult to say when.","Some first-hand details about impending supply chain disruptions throughout China which will likely cause some major ripples to world market in coming weeks. (The dip we saw earlier was just a preview, we won't even have scratched the surface of global economic effects until after the 10th.)",2020-02-07 01:57:17,/r/Coronavirus/comments/f08ezi/some_firsthand_details_about_impending_supply/
fgs3fy9,0.5423,-0.34,It’s the economy crashing that worries me more than this actual virus. Hopefully China will allow foreign aid to help them deal with the situation that’s unfolding there.,"Some first-hand details about impending supply chain disruptions throughout China which will likely cause some major ripples to world market in coming weeks. (The dip we saw earlier was just a preview, we won't even have scratched the surface of global economic effects until after the 10th.)",2020-02-07 01:57:17,/r/Coronavirus/comments/f08ezi/some_firsthand_details_about_impending_supply/
fgsba2m,-0.7339,-0.34,I posted something about this in a professional group I’m in and it was basically laughed at. I plan to place a large order of a specific piece of equipment we use daily to connect customers to the internet. Our distributors still have a lot on stock. But every year during CNY stock always runs very low. I suspect there will be long shortages this year.,"Some first-hand details about impending supply chain disruptions throughout China which will likely cause some major ripples to world market in coming weeks. (The dip we saw earlier was just a preview, we won't even have scratched the surface of global economic effects until after the 10th.)",2020-02-07 01:57:17,/r/Coronavirus/comments/f08ezi/some_firsthand_details_about_impending_supply/
fgs81r0,0.2617,-0.34,"At this very moment there are shills on here and on other social media spreading the talking point that the corona virus is less deadly than the flu and that anyone who thinks otherwise must be wearing a tin foil hat.  As for the stock market?  The Fed has continued is Welfare for Wall  Street program unabated, and between that and people's greed and propensity for denial, the markets have rallied back from the dip last week.  But surely, the rally will be a short lived phenomena, once manufacturing supply lines disrupt major industries.  And in a few weeks, the number of deaths will be hard to hide.We'll have to see how it ll turns out, but I'm not going to fall for the ""everything is OK"" line of BS.","Some first-hand details about impending supply chain disruptions throughout China which will likely cause some major ripples to world market in coming weeks. (The dip we saw earlier was just a preview, we won't even have scratched the surface of global economic effects until after the 10th.)",2020-02-07 01:57:17,/r/Coronavirus/comments/f08ezi/some_firsthand_details_about_impending_supply/
fgs6yxv,-0.8173,-0.34,"Even for things that aren't made in China, almost any complex item has a part made in China.  For example, Hyundai just shut down a South Korean plant, because they use a small number of parts from China.The chemical industry, [including pharmaceuticals](https://www.wired.com/story/the-coronavirus-is-a-threat-to-the-global-drug-supply/)relies heavily on feedstock from China.  They're educated, moderate wage, and they can dump chemical waste out the back door, so the total costs are low.Of course, if the virus starts spreading in our own countries, many sectors of the economy will be completely suspended for a few months.","Some first-hand details about impending supply chain disruptions throughout China which will likely cause some major ripples to world market in coming weeks. (The dip we saw earlier was just a preview, we won't even have scratched the surface of global economic effects until after the 10th.)",2020-02-07 01:57:17,/r/Coronavirus/comments/f08ezi/some_firsthand_details_about_impending_supply/
fgs5f7w,0.3612,-0.34,Quality post and and insights. Thank you.,"Some first-hand details about impending supply chain disruptions throughout China which will likely cause some major ripples to world market in coming weeks. (The dip we saw earlier was just a preview, we won't even have scratched the surface of global economic effects until after the 10th.)",2020-02-07 01:57:17,/r/Coronavirus/comments/f08ezi/some_firsthand_details_about_impending_supply/
fgs4ij5,-0.0498,-0.34,"Very sobering insight. What you presented makes a lot of sense. How have you prepared yourself, or intend to?","Some first-hand details about impending supply chain disruptions throughout China which will likely cause some major ripples to world market in coming weeks. (The dip we saw earlier was just a preview, we won't even have scratched the surface of global economic effects until after the 10th.)",2020-02-07 01:57:17,/r/Coronavirus/comments/f08ezi/some_firsthand_details_about_impending_supply/
fgs4b66,-0.5267,-0.34,"wait for the major car manufacturers to stop production, Hyundai has already shut down production due to parts missing that they usually import from China. This would (for me) be a major sign that it is going downhill from there.","Some first-hand details about impending supply chain disruptions throughout China which will likely cause some major ripples to world market in coming weeks. (The dip we saw earlier was just a preview, we won't even have scratched the surface of global economic effects until after the 10th.)",2020-02-07 01:57:17,/r/Coronavirus/comments/f08ezi/some_firsthand_details_about_impending_supply/
fgsdwhz,0.5609,-0.34,"Thank you so much for posting this, very informative!! Quick question: as a mere consumer, what products should I buy in bulk (a few months supply) while they're still in stock? Will you stock up on anything in particular? Toothpaste, deodorant, anything?","Some first-hand details about impending supply chain disruptions throughout China which will likely cause some major ripples to world market in coming weeks. (The dip we saw earlier was just a preview, we won't even have scratched the surface of global economic effects until after the 10th.)",2020-02-07 01:57:17,/r/Coronavirus/comments/f08ezi/some_firsthand_details_about_impending_supply/
fgsvpf2,0.4926,-0.34,"On the otherside, this standstill in transportation and Production is good For the Environment!","Some first-hand details about impending supply chain disruptions throughout China which will likely cause some major ripples to world market in coming weeks. (The dip we saw earlier was just a preview, we won't even have scratched the surface of global economic effects until after the 10th.)",2020-02-07 01:57:17,/r/Coronavirus/comments/f08ezi/some_firsthand_details_about_impending_supply/
fgsd5ce,0.0,-0.34,[deleted],"Some first-hand details about impending supply chain disruptions throughout China which will likely cause some major ripples to world market in coming weeks. (The dip we saw earlier was just a preview, we won't even have scratched the surface of global economic effects until after the 10th.)",2020-02-07 01:57:17,/r/Coronavirus/comments/f08ezi/some_firsthand_details_about_impending_supply/
fgs5krr,0.5007,-0.34,So is the plan still is just stock up on food guns ammo?? What else to help mitigate this?,"Some first-hand details about impending supply chain disruptions throughout China which will likely cause some major ripples to world market in coming weeks. (The dip we saw earlier was just a preview, we won't even have scratched the surface of global economic effects until after the 10th.)",2020-02-07 01:57:17,/r/Coronavirus/comments/f08ezi/some_firsthand_details_about_impending_supply/
fgsedow,0.867,-0.34,"For some reason the phrase 'Don't put all of your eggs in one basket.' comes to mind after reading this post. We sure do love learning things the hard way. Let's hope you're wrong, but I'm quite certain you're spot on with your predictions.Thanks for sharing your insight. Keep us posted if you can.","Some first-hand details about impending supply chain disruptions throughout China which will likely cause some major ripples to world market in coming weeks. (The dip we saw earlier was just a preview, we won't even have scratched the surface of global economic effects until after the 10th.)",2020-02-07 01:57:17,/r/Coronavirus/comments/f08ezi/some_firsthand_details_about_impending_supply/
fgss321,-0.296,-0.34,"I work at a company that makes specialized equipment and one of the key components of our equipment's design is typically sourced from our shop in China (due to cost, obviously).  We expected the CNY shutdown but literally everyone in my office is operating on the assumption that as of the 10th everything will just snap back to normal.  I've overheard I don't even know how many calls to customers saying ""it's fine, our shop is in Shanghai, not Wuhan, so we'll 100% be able to meet your delivery dates"" which...I strongly doubt.  There is not a single job in production that I know of where it's even been _considered_ that we should make this particular component in one of our US fabrication locations instead, and I can't wait to hear the blowback when we start missing customer dates because the entire company's plan of action was ""wait and see"".","Some first-hand details about impending supply chain disruptions throughout China which will likely cause some major ripples to world market in coming weeks. (The dip we saw earlier was just a preview, we won't even have scratched the surface of global economic effects until after the 10th.)",2020-02-07 01:57:17,/r/Coronavirus/comments/f08ezi/some_firsthand_details_about_impending_supply/
fgskamq,0.0,-0.34,Isn’t Nintendo pausing production on the Switch due to not being able to get parts? Saw a twitter screenshot earlier,"Some first-hand details about impending supply chain disruptions throughout China which will likely cause some major ripples to world market in coming weeks. (The dip we saw earlier was just a preview, we won't even have scratched the surface of global economic effects until after the 10th.)",2020-02-07 01:57:17,/r/Coronavirus/comments/f08ezi/some_firsthand_details_about_impending_supply/
fgsv0ko,0.0,-0.34,How will this affect TSLA specifically?What parts of theirs are made in China? the SOC?,"Some first-hand details about impending supply chain disruptions throughout China which will likely cause some major ripples to world market in coming weeks. (The dip we saw earlier was just a preview, we won't even have scratched the surface of global economic effects until after the 10th.)",2020-02-07 01:57:17,/r/Coronavirus/comments/f08ezi/some_firsthand_details_about_impending_supply/
fgsdwdy,0.0,-0.34,"Another point to add to this is other components made by external suppliers, required by manufacturers to be able to produce goods. Bottlenecks will also come from waiting on production inventory.","Some first-hand details about impending supply chain disruptions throughout China which will likely cause some major ripples to world market in coming weeks. (The dip we saw earlier was just a preview, we won't even have scratched the surface of global economic effects until after the 10th.)",2020-02-07 01:57:17,/r/Coronavirus/comments/f08ezi/some_firsthand_details_about_impending_supply/
