Comment ID,Comment_VS,Title_VS,Comment,Title,Publish Date,Permalink
fgu6eh7,-0.4391,-0.354,only very severe cases are being tested right now. So it takes longer for them to recover I guess.,"If 82% has MILD symptoms, why aren't they better yet? Why don't we see the number of survivors go up?",2020-02-07 13:25:10,/r/Coronavirus/comments/f0h6ku/if_82_has_mild_symptoms_why_arent_they_better_yet/
fgvb07a,0.9566,-0.354,"This interview of a front line doctor: https://www.caixinglobal.com/2020-02-06/reporters-notebook-we-interview-front-line-coronavirus-doctor-101512020.htmlAnd, this study: First Case of 2019 Novel Coronavirus in the United States 35 year old male - symptom progression day 1-12https://www.nejm.org/doi/full/10.1056/NEJMoa2001191On January 19, 2020, a 35-year-old man presented to an urgent care clinic in Snohomish County, Washington, with a 4-day history of cough and subjective fever. On checking into the clinic, the patient put on a mask in the waiting room. After waiting approximately 20 minutes, he was taken into an examination room and underwent evaluation by a provider. He disclosed that he had returned to Washington State on January 15 after traveling to visit family in Wuhan, China. The patient stated that he had seen a health alert from the U.S. Centers for Disease Control and Prevention (CDC) about the novel coronavirus outbreak in China and, because of his symptoms and recent travel, decided to see a health care provider....Given the patient’s travel history, the local and state health departments were immediately notified. Together with the urgent care clinician, the Washington Department of Health notified the CDC Emergency Operations Center. Although the patient reported that he had not spent time at the Huanan seafood market and reported no known contact with ill persons during his travel to China, CDC staff concurred with the need to test the patient for 2019-nCoV on the basis of current CDC “persons under investigation” case definitions.8 Specimens were collected in accordance with CDC guidance and included serum and nasopharyngeal and oropharyngeal swab specimens. After specimen collection, the patient was discharged to home isolation with active monitoring by the local health department.On January 20, 2020, the CDC confirmed that the patient’s nasopharyngeal and oropharyngeal swabs tested positive for 2019-nCoV by real-time reverse-transcriptase–polymerase-chain-reaction (rRT-PCR) assay. In coordination with CDC subject-matter experts, state and local health officials, emergency medical services, and hospital leadership and staff, the patient was admitted to an airborne-isolation unit at Providence Regional Medical Center for clinical observation, with health care workers following CDC recommendations for contact, droplet, and airborne precautions with eye protection.On admission, the patient reported persistent dry cough and a 2-day history of nausea and vomiting; he reported that he had no shortness of breath or chest pain. Vital signs were within normal ranges. On physical examination, the patient was found to have dry mucous membranes. The remainder of the examination was generally unremarkable. After admission, the patient received supportive care, including 2 liters of normal saline and ondansetron for nausea.On days 2 through 5 of hospitalization (days 6 through 9 of illness), the patient’s vital signs remained largely stable, apart from the development of intermittent fevers accompanied by periods of tachycardia (Figure 2). The patient continued to report a nonproductive cough and appeared fatigued. On the afternoon of hospital day 2, the patient passed a loose bowel movement and reported abdominal discomfort. A second episode of loose stool was reported overnight; a sample of this stool was collected for rRT-PCR testing, along with additional respiratory specimens (nasopharyngeal and oropharyngeal) and serum. The stool and both respiratory specimens later tested positive by rRT-PCR for 2019-nCoV, whereas the serum remained negative.Treatment during this time was largely supportive. For symptom management, the patient received, as needed, antipyretic therapy consisting of 650 mg of acetaminophen every 4 hours and 600 mg of ibuprofen every 6 hours. He also received 600 mg of guaifenesin for his continued cough and approximately 6 liters of normal saline over the first 6 days of hospitalization.A chest radiograph taken on hospital day 3 (illness day 7) was reported as showing no evidence of infiltrates or abnormalities (Figure 3). However, a second chest radiograph from the night of hospital day 5 (illness day 9) showed evidence of pneumonia in the lower lobe of the left lung (Figure 4). These radiographic findings coincided with a change in respiratory status starting on the evening of hospital day 5, when the patient’s oxygen saturation values as measured by pulse oximetry dropped to as low as 90% while he was breathing ambient air. On day 6, the patient was started on supplemental oxygen, delivered by nasal cannula at 2 liters per minute. Given the changing clinical presentation and concern about hospital-acquired pneumonia, treatment with vancomycin (a 1750-mg loading dose followed by 1 g administered intravenously every 8 hours) and cefepime (administered intravenously every 8 hours) was initiated.On hospital day 6 (illness day 10), a fourth chest radiograph showed basilar streaky opacities in both lungs, a finding consistent with atypical pneumonia (Figure 5), and rales were noted in both lungs on auscultation. Given the radiographic findings, the decision to administer oxygen supplementation, the patient’s ongoing fevers, the persistent positive 2019-nCoV RNA at multiple sites, and published reports of the development of severe pneumonia3,4 at a period consistent with the development of radiographic pneumonia in this patient, clinicians pursued compassionate use of an investigational antiviral therapy. Treatment with intravenous remdesivir (a novel nucleotide analogue prodrug in development10,11) was initiated on the evening of day 7, and no adverse events were observed in association with the infusion. Vancomycin was discontinued on the evening of day 7, and cefepime was discontinued on the following day, after serial negative procalcitonin levels and negative nasal PCR testing for methicillin-resistant Staphylococcus aureus.On hospital day 8 (illness day 12), the patient’s clinical condition improved. Supplemental oxygen was discontinued, and his oxygen saturation values improved to 94 to 96% while he was breathing ambient air. The previous bilateral lower-lobe rales were no longer present. His appetite improved, and he was asymptomatic aside from intermittent dry cough and rhinorrhea. As of January 30, 2020, the patient remains hospitalized. He is afebrile, and all symptoms have resolved with the exception of his cough, which is decreasing in severity.(The above referenced patient survived and was released from hospital and “remains isolated at home.”) see;https://www.google.com/amp/s/www.usnews.com/news/healthiest-communities/articles/2020-02-04/first-us-coronavirus-patient-released-from-hospital%3fcontext=amp","If 82% has MILD symptoms, why aren't they better yet? Why don't we see the number of survivors go up?",2020-02-07 13:25:10,/r/Coronavirus/comments/f0h6ku/if_82_has_mild_symptoms_why_arent_they_better_yet/
fgugeri,-0.9081,-0.354,When you get Viral pneumonia it does a lot of damage to the lungs and often results in secondary infection. People can linger for a long time slowly going down hill due to chronic O2 deficit until they die 3 months post infection. The same applies to flu pneumonia.,"If 82% has MILD symptoms, why aren't they better yet? Why don't we see the number of survivors go up?",2020-02-07 13:25:10,/r/Coronavirus/comments/f0h6ku/if_82_has_mild_symptoms_why_arent_they_better_yet/
fgtzqe6,0.3612,-0.354,That's what the case in WA looked like. Nasopharyngeal test revealed still harbouring virus.The recovered are being held in in first world countries out of an abundance of caution.,"If 82% has MILD symptoms, why aren't they better yet? Why don't we see the number of survivors go up?",2020-02-07 13:25:10,/r/Coronavirus/comments/f0h6ku/if_82_has_mild_symptoms_why_arent_they_better_yet/
fgu3nf1,-0.7506,-0.354,Was he infected on the 10th or just blew the whistle on the 10th.For all I know he could've been infected 2 weeks ago and passed after a week.,"If 82% has MILD symptoms, why aren't they better yet? Why don't we see the number of survivors go up?",2020-02-07 13:25:10,/r/Coronavirus/comments/f0h6ku/if_82_has_mild_symptoms_why_arent_they_better_yet/
fguhkhf,-0.4404,-0.354,He died from this disease as much as Jimmy Hoffa died of natural causes lol.,"If 82% has MILD symptoms, why aren't they better yet? Why don't we see the number of survivors go up?",2020-02-07 13:25:10,/r/Coronavirus/comments/f0h6ku/if_82_has_mild_symptoms_why_arent_they_better_yet/
fgtylyf,-0.7037,0.0,"Absolutely. Doing anything besides nothing is a great head start. Canned food, rice, any masks you can get, gloves, bleach and/or cleaning products, antibacterial gel. Even if the worst doesn't happen, having a stockpile for the future is never a bad thing!",Secretly prepping in central Europe,2020-02-07 13:25:10,/r/Coronavirus/comments/f0h6kv/secretly_prepping_in_central_europe/
fgty3z6,-0.2263,0.0,Full seal around the eyes with no vents or any airflow whatsoever if you want it to function,Secretly prepping in central Europe,2020-02-07 13:25:10,/r/Coronavirus/comments/f0h6kv/secretly_prepping_in_central_europe/
fgu242k,0.1779,0.0,One mask is better than no mask.,Secretly prepping in central Europe,2020-02-07 13:25:10,/r/Coronavirus/comments/f0h6kv/secretly_prepping_in_central_europe/
fgtypgi,0.0,0.0,"Check the 3m masks if they're FFP2 or FFP3, the N95 designation is a North American one. The FFP is EU, and FFP2 is N95 equivalent. FFP3 is higher.",Secretly prepping in central Europe,2020-02-07 13:25:10,/r/Coronavirus/comments/f0h6kv/secretly_prepping_in_central_europe/
fgu24fr,0.9542,0.0,"In Europe a different classification system for masks and filters is used than in the US. N95 is a classification by the NIOSH (National Institute for Occupational Safety and Health).The N is a classification indicator that it is not resistant to petroleum (doesn't matter in our use case) and the 95 is the percentage of filtered particles. You can also find so called N100 respirators and filters, but they are much more expensive.The Europe system follows the European norm EN 149 for respirators and classifies them via as FFP1 to FFP3. While FFP just stands for ""filtering face piece"" and the number indicates the 3 levels of sealing and filtering ability.FFP3 is considered to provide a very good seal with at max. 5% leakage (average at 2%). It is supposed to filter at least 99% of toxic substances, as well as droplet aerosols, cancer and radioactive substances, enzymes, microorganisms (viruses, germs, fungi and spores) and other dangerous substances, which concentration can reach up to 30x the allowed concentration at your work place.So get some FFP3 masks they have higher filtering abilities as N95 respirators,Yet the best mask is to not touch your face.Your list so far is decent. I'd add some disinfecting laundry detergent to the mix. Also maybe a pack of latex gloves. Make sure that your home medicine cabinet is fully stocked and that you have a supply of high energy canned food to survive a few days, if sh\*t really hits the fan.  edit:  Throw in some (hand)lotion, because sanitizing your skin can be really harsh.  Also stock up on some small sanitizer bottles for on the go and spray bottles for IPA 70 (a mix of 70% isopropanol and 30% water).   If you want to go all in, place dispenser bottles strategically around the house. Best those that you can push with your forearm/elbow, as in hospitals.",Secretly prepping in central Europe,2020-02-07 13:25:10,/r/Coronavirus/comments/f0h6kv/secretly_prepping_in_central_europe/
fgu392g,0.32,0.0,"You should have a FFP3 mask. The goggles have to be fog proof, seal to your face with no gaps. Unless your equipment live up to that they wont protect you as you wish.Also id recommend you to buy UVC water cleanser or a portable carbon fiber filter. Add Xinix aquacare to your list as well and some nitrile gloves. This might be overkill but a protective suit against biological danger with taped seams could also be a good idea if SHTF.The most essential is water and food. Buy bottles for at least 2 weeks (mineral water lasts for months if they aren’t opened and put somewhere dark). 15 bottles per person or so. And make sure you can seal the ventilation in your home. Duck tape and towels would do the job.",Secretly prepping in central Europe,2020-02-07 13:25:10,/r/Coronavirus/comments/f0h6kv/secretly_prepping_in_central_europe/
fgu4opz,0.813,0.0,"I would recommend a 30 day supply of what you normally use, like food, toilet paper and the like. Try to make it mostly canned or dry foods that you normally eat, if nothing happens then you dont lose, and eat the food anyway.  A good first aid kit, you can buy one premade or put one together yourself.  Water is very important, so figure where you will be getting that from if situation gets extreme.  A good reassurance to food is obviously wild fish and game, so basics in that area cant hurt.  Alot of masks are not %100 effective, but they stop you from touching your mouth and nose area which lowers chance of spread.",Secretly prepping in central Europe,2020-02-07 13:25:10,/r/Coronavirus/comments/f0h6kv/secretly_prepping_in_central_europe/
fgu1psq,-0.4023,0.0,If you do not trust the ski googles you could buy swim googles or googles from building suppliers.,Secretly prepping in central Europe,2020-02-07 13:25:10,/r/Coronavirus/comments/f0h6kv/secretly_prepping_in_central_europe/
fgu6pii,0.2144,0.0,"I think you're just being smart to do a little prepping, especially since everything you get can eventually be used anyway (except the mask, but even they can be used for painting).",Secretly prepping in central Europe,2020-02-07 13:25:10,/r/Coronavirus/comments/f0h6kv/secretly_prepping_in_central_europe/
fgudms0,0.9325,0.0,"Well it's not a secret now, is it? Surely you have the equivalent of the FBI there in Germany? /sAll kidding aside, the orifices on your head are the primary vectors for disease, so you'll want to keep those protected.In terms of masks, N95 (and equivalent) are fine, but higher is better and if you have anyone in the household who is immunocompromised you should all have the much tighter fitting respirators with removable media.Alcohol-based sanitizer is what you want for your hands but it'll never be as effective as proper handwashing.If exposure is a concern, wash and dry everything on hot. Use hydrogen peroxide to disinfect surfaces. If you really want to sanitize the air inside, a combination of electrostatic filter, and a system UVC light and/or an ozone generator. (NOTE NOT TO BE TAKEN LIGHTLY: The latter can ONLY be run when there are \*NO living beings indoors\* as it is likely to kill you, your pets, and anything else with a pulse.)Be safe, best of luck to us all!",Secretly prepping in central Europe,2020-02-07 13:25:10,/r/Coronavirus/comments/f0h6kv/secretly_prepping_in_central_europe/
fgtxynk,0.0,0.0,"N95 is a norm/rating (the size and type of particules that it filtrates), 3m is a brand that sells  different type of masks (n95, n99...).",Secretly prepping in central Europe,2020-02-07 13:25:10,/r/Coronavirus/comments/f0h6kv/secretly_prepping_in_central_europe/
fgtyoaf,0.0,0.0,"I think N/P95 code is specific to USA, and Europe's equivalent is FFP3 often shortened to P3.",Secretly prepping in central Europe,2020-02-07 13:25:10,/r/Coronavirus/comments/f0h6kv/secretly_prepping_in_central_europe/
fgv4j74,0.9659,0.0,"Those n95 masks are unreliable. Ski goggles are better than nothing, but they are still nothing compared to a proper full face mask. A full face respirator provides the best seal, the best comfort (in my opinion) and the most protection due to covering eyes as well as mouth.",Secretly prepping in central Europe,2020-02-07 13:25:10,/r/Coronavirus/comments/f0h6kv/secretly_prepping_in_central_europe/
fh1guma,0.0,0.0,3m is a brand not a type of mask.Edit spelling,Secretly prepping in central Europe,2020-02-07 13:25:10,/r/Coronavirus/comments/f0h6kv/secretly_prepping_in_central_europe/
fh5oip8,0.4939,0.0,I am in the same boat. Just buying extra. Not telling my family about it because as soon as they hear Wuhan or China they roll their eyes like I'm talking about some kind of elaborate conspiracy theory. I've mentioned to family and friends it's a good time to just pick up a few more canned goods here or there or to make sure their pantry has some food in it. But if SHTF everyone's going to be going 'i never saw this coming' or 'how did this all happen'.,Secretly prepping in central Europe,2020-02-07 13:25:10,/r/Coronavirus/comments/f0h6kv/secretly_prepping_in_central_europe/
fgtzwm1,0.6908,0.0,"Thanks for reassuring me, I either feel unprepared at all or like I am overreacting when I mention to anyone that I just want a damn mask, goggles and some food in case I have to stay inside.",Secretly prepping in central Europe,2020-02-07 13:25:10,/r/Coronavirus/comments/f0h6kv/secretly_prepping_in_central_europe/
fgtzo7u,0.4939,0.0,"I wonder if ""full seal"" means that sponge on the ski goggles... it seems pretty sealed when on. Either that or those little snorkeling goggles.",Secretly prepping in central Europe,2020-02-07 13:25:10,/r/Coronavirus/comments/f0h6kv/secretly_prepping_in_central_europe/
fgu041x,0.8225,0.0,"Thanks, I found that the mask I was looking at is EN149: FFP1, FFP2. I'm ""safe"", will buy a dozen tomorrow lol",Secretly prepping in central Europe,2020-02-07 13:25:10,/r/Coronavirus/comments/f0h6kv/secretly_prepping_in_central_europe/
fgu3z2m,0.8608,0.0,"Thank you for such a detailed reply, I didn't actually know that there was a different classification before posting this question (for some reason it did not occur to me to google it).I'll try to find a FFP3 mask - I found some masks with two filters as well, but without any specifications on them. Medicine cabinet is fully stocked, I even carry the ""mini kit"" with me if I go somewhere. I did that even before the virus, better safe than sorry.",Secretly prepping in central Europe,2020-02-07 13:25:10,/r/Coronavirus/comments/f0h6kv/secretly_prepping_in_central_europe/
fgu57g2,0.8475,0.0,"Ooh I like nitrile gloves more than latex ones. And great idea for a water filter!I doubt that there is something like xinix in my country, at least I've never seen it, but I want it now and will look for something similar. Thanks for the advice!",Secretly prepping in central Europe,2020-02-07 13:25:10,/r/Coronavirus/comments/f0h6kv/secretly_prepping_in_central_europe/
fgtygoh,0.1027,0.0,"I believe, if I recall correctly from the Miami University testings, they are testing each person multiple times. So 30 people have been cleared since Wednesday, not 30 tests run.",CDC- Why did the US only complete 30 tests in 3 days?,2020-02-07 13:27:44,/r/Coronavirus/comments/f0h7xx/cdc_why_did_the_us_only_complete_30_tests_in_3/
fgu27c3,0.616,0.0,"Not making sense at all...USA 337 and 12 positiveUK 620 tests and 3 positiveI'm not buying it. For either!! There's alot not being said all around the world becuase money talks and no one wants an impact on the economy!!! It's utter bull crap!! I know the truth will cause panic but the truth is what people need!! At least a kind of sugar coated, watered down truth so that people can prepare!?",CDC- Why did the US only complete 30 tests in 3 days?,2020-02-07 13:27:44,/r/Coronavirus/comments/f0h7xx/cdc_why_did_the_us_only_complete_30_tests_in_3/
fgu76go,0.4666,0.0,Less tests less positive results more economy,CDC- Why did the US only complete 30 tests in 3 days?,2020-02-07 13:27:44,/r/Coronavirus/comments/f0h7xx/cdc_why_did_the_us_only_complete_30_tests_in_3/
fgucqiy,0.3774,0.0,"The government is very busy, \*very\* busy. Please ask again later.",CDC- Why did the US only complete 30 tests in 3 days?,2020-02-07 13:27:44,/r/Coronavirus/comments/f0h7xx/cdc_why_did_the_us_only_complete_30_tests_in_3/
fguaa7o,-0.2732,0.0,Because Trump cut funding to CDC ages ago,CDC- Why did the US only complete 30 tests in 3 days?,2020-02-07 13:27:44,/r/Coronavirus/comments/f0h7xx/cdc_why_did_the_us_only_complete_30_tests_in_3/
fgu2yww,-0.536,0.0,"The test for this isn’t hard, it PCR based and highly specific. I could teach any high school biology student to run it. Completely unacceptable not to allow any competent medical lab to confirm cases. They do it for everything else, this isn’t hard.",CDC- Why did the US only complete 30 tests in 3 days?,2020-02-07 13:27:44,/r/Coronavirus/comments/f0h7xx/cdc_why_did_the_us_only_complete_30_tests_in_3/
fgubbf5,0.1645,0.0,No testing no problem. I’m being serious.,CDC- Why did the US only complete 30 tests in 3 days?,2020-02-07 13:27:44,/r/Coronavirus/comments/f0h7xx/cdc_why_did_the_us_only_complete_30_tests_in_3/
fgu0kes,0.0,0.0,44 tested: https://www.reddit.com/r/China_Flu/comments/f0f63m/us_cdc_has_only_tested_44_people_since_wednesday/?utm_source=share&utm_medium=ios_app&utm_name=iossmf,CDC- Why did the US only complete 30 tests in 3 days?,2020-02-07 13:27:44,/r/Coronavirus/comments/f0h7xx/cdc_why_did_the_us_only_complete_30_tests_in_3/
fgupdl2,-0.3686,0.0,Even Dr. Li tested negative for weeks before he finally was tested positive.  Wake up; negative results result in more people getting infected because then they think they are not infected and go back to normal walking around.   The tests they are using are flawed; unless they have improved things since a few weeks ago.,CDC- Why did the US only complete 30 tests in 3 days?,2020-02-07 13:27:44,/r/Coronavirus/comments/f0h7xx/cdc_why_did_the_us_only_complete_30_tests_in_3/
fguw7i6,0.7003,0.0,"I think its safe to say we are or were in short supply.  Not only that, testing had to be done at the CDC. I presume we had to contract out to get tests made, and these things take time.  Finally test kits are being distributed and I hope all that came here untested, get summoned back for testing pronto.",CDC- Why did the US only complete 30 tests in 3 days?,2020-02-07 13:27:44,/r/Coronavirus/comments/f0h7xx/cdc_why_did_the_us_only_complete_30_tests_in_3/
fgtyrwu,-0.6124,0.0,There are also a frightening low number of new tests being run considering the evacuations and flights that have landed since Wednesday.,CDC- Why did the US only complete 30 tests in 3 days?,2020-02-07 13:27:44,/r/Coronavirus/comments/f0h7xx/cdc_why_did_the_us_only_complete_30_tests_in_3/
fguch8x,0.6249,0.0,"  And in a matter of just a day or so, Japan was able to test and confirm 61 from the cruise ship.  CDC still has 70 outstanding tests (Although, they claim that includes 'in-bound in-shipment' tests)",CDC- Why did the US only complete 30 tests in 3 days?,2020-02-07 13:27:44,/r/Coronavirus/comments/f0h7xx/cdc_why_did_the_us_only_complete_30_tests_in_3/
fgu2zpl,0.8779,0.0,"My glimmer of hope is clinical testing in china is under way- WHO posted 27 i believe tests - some of which are already recruiting.    Fingers crossed now that we have identified the animal, treatments and cures are underway.     hoping our governments arent letting it silently spread- hoping we have stronger immunity until treatments and cures are available.   looking at what is happening in China, the rest of the world isnt making sense.",CDC- Why did the US only complete 30 tests in 3 days?,2020-02-07 13:27:44,/r/Coronavirus/comments/f0h7xx/cdc_why_did_the_us_only_complete_30_tests_in_3/
fgueycz,0.0,0.0,All UK tests were probably from the evacuation flights of the people in quarantine and a minority of random civilians,CDC- Why did the US only complete 30 tests in 3 days?,2020-02-07 13:27:44,/r/Coronavirus/comments/f0h7xx/cdc_why_did_the_us_only_complete_30_tests_in_3/
fgv6514,0.0335,0.0,False negatives and false positives both carry a lot of risk for the people doing the test. We have a litigious society and I wouldn't accept the risk.,CDC- Why did the US only complete 30 tests in 3 days?,2020-02-07 13:27:44,/r/Coronavirus/comments/f0h7xx/cdc_why_did_the_us_only_complete_30_tests_in_3/
fguhkdy,0.9446,0.0,And truthful. See no evil hear no evil speak no evil to the masses.We are on our own follow you gut. Watch what they do not what they say. Take steps to protect you and yours.,CDC- Why did the US only complete 30 tests in 3 days?,2020-02-07 13:27:44,/r/Coronavirus/comments/f0h7xx/cdc_why_did_the_us_only_complete_30_tests_in_3/
fgu0vpp,-0.7845,0.0,These seem to be newly ordered tests. it appears what was completed is far less.as of wednesday there were 206 negative and 11 positive. today 225 negative 12 postive.**20 tests. They completed 20 tests in 3 days**i was wrong on 30.,CDC- Why did the US only complete 30 tests in 3 days?,2020-02-07 13:27:44,/r/Coronavirus/comments/f0h7xx/cdc_why_did_the_us_only_complete_30_tests_in_3/
fgtzxnd,0.1531,0.0,"Devils advocate, this may be because from my understanding people were not permitted to board if they showed symptoms, and perhaps they will run if/when symptoms appear.     There have been reports testing is is possible before symptoms- but who knows what is truth vs speculation and rumor.",CDC- Why did the US only complete 30 tests in 3 days?,2020-02-07 13:27:44,/r/Coronavirus/comments/f0h7xx/cdc_why_did_the_us_only_complete_30_tests_in_3/
